artigoEmPeriodico	 	2007	1434-6044	http://www.scopus.com/scopus/inward/citedby.url?partnerID=bb5nvXTn&rel=R6.0.0&doi=10.1140/epjc/s10052-007-0441-1&md5=db0ac2c978504ae4ad63e70b1de5f8d6	Gauge Formulation for Higher Order Gravity	European Physical Journal C	CUZINATTO, R. R.; de MELO, C. A. M. ; MEDEIROS, L. G. ; POMPEIA, P. J.	A2	
artigoEmPeriodico	 	2007	0003-4916	http://www.scopus.com/scopus/inward/citedby.url?partnerID=bb5nvXTn&rel=R6.0.0&doi=10.1016/j.aop.2006.07.006&md5=399e9c5904146f04415d97f1c32bb3f0	Second order gauge theory	Annals of Physics (Print)	CUZINATTO, R. R.; de MELO, C. A. M. ; POMPEIA, P. J.	A2	
artigoEmPeriodico	 	2007	0264-9381	http://www.scopus.com/scopus/inward/citedby.url?partnerID=bb5nvXTn&rel=R6.0.0&doi=10.1088/0264-9381/24/3/013&md5=df24286502dba9712b92062de0858f44	Massless DKP field in a Lyra manifold	Classical and Quantum Gravity (Print)	de MELO, C. A. M.; PIMENTEL, Bruto Max ; CASANA, Rodolfo	A1	
artigoEmPeriodico	 	2007	0375-9474	http://www.scopus.com/scopus/inward/citedby.url?partnerID=bb5nvXTn&rel=R6.0.0&doi=10.1016/j.nuclphysa.2007.09.006&md5=e2257a5c84a92d5d4dc3d5c74405f8e0	Thermodynamics of Quasi-Particles	Nuclear Physics A	GARDIM, F. G.; STEFFENS, F. M.	A4	
artigoEmPeriodico	 	2007	0218-3013	http://dx.doi.org/10.1142/s0218301307008963	THERMODYNAMICS OF QUASI-PARTICLES	International Journal of Modern Physics E	Gardim, Fernando G.; STEFFENS, FERNANDO M.	A4	
artigoEmPeriodico	 	2006	0015-9018	http://www.scopus.com/scopus/inward/citedby.url?partnerID=bb5nvXTn&rel=R6.0.0&doi=10.1007/s10701-006-9076-6&md5=3edc9784cffcade7f0f52248ae9fa4c9	Analytic solutions for the Lambda-FRW model	Foundations of Physics	ALDROVANDI, R. ; CUZINATTO, R. R. ; MEDEIROS, L. G.	A4	
artigoEmPeriodico	 	2006	0103-9733	http://www.scopus.com/scopus/inward/citedby.url?partnerID=bb5nvXTn&rel=R6.0.0&doi=10.1590/s0103-97332006000300029&md5=4bdb8d1f4631448efbbb95956f8bcbb6	Influence of minority carrier transport in the optical properties of double barrier resonant tunneling diodes	BRAZILIAN JOURNAL OF PHYSICS	Camps, I.; Vercik, A. ; Santos, L. F. dos ; Gobato, Y. Galvão	A3	
artigoEmPeriodico	 	2006	0163-1829	http://dx.doi.org/10.1103/PhysRevB.74.041305	Electric-field inversion asymmetry: Rashba and Stark effects for holes in resonant tunneling devices	Physical Review. B, Condensed Matter. (Cessou 1997. Cont. 1098-0121 Physical Review. B, Condensed Matter and Materials Physics)	Carvalho, H. B. de ; Brasil, M. J. S. P. ; Lopez-Richard, V. ; Gobato, Y. Galvão ; Marques, G. E. ; Camps, I. ; Dacal, L. C. O. ; Henini, M. ; Eaves, L. ; Hill, G.	A1	
artigoEmPeriodico	 	2006	0163-1829	http://dx.doi.org/10.1103/PhysRevB.73.155317	Voltage-controlled hole spin injection in nonmagnetic GaAs/AlAs resonant tunneling structures	Physical Review. B, Condensed Matter. (Cessou 1997. Cont. 1098-0121 Physical Review. B, Condensed Matter and Materials Physics)	Carvalho, H. B. de ; Gobato, Y. Galvão ; Brasil, M. J. S. P. ; Lopez-Richard, V. ; Marques, G. E. ; Camps, I. ; Henini, M. ; Eaves, L. ; Hill, G.	A1	
artigoEmPeriodico	 	2006	0268-1242	http://www.scopus.com/scopus/inward/citedby.url?partnerID=bb5nvXTn&rel=R6.0.0&doi=10.1088/0268-1242/21/7/015&md5=752d6d2d05dd16a95d125b5915d56cc3	The temperature dependence of electrical and optical propertiesin InAs/GaAs and GaAs/InAs/AlAs self-assembled quantum dots	SEMICONDUCTOR SCIENCE AND TECHNOLOGY	Chiquito, A. J. ; de Souza, M. G. ; Camps, I. ; Gobato, Y. Galvão	A2	
artigoEmPeriodico	 	2006	0003-4916	http://www.scopus.com/scopus/inward/citedby.url?partnerID=bb5nvXTn&rel=R6.0.0&doi=10.1016/j.aop.2006.07.006&md5=399e9c5904146f04415d97f1c32bb3f0	Second Order Gauge Theory	Annals of Physics (New York)	de MELO, C. A. M.; CUZINATTO, Rodrigo Rocha ; POMPÉIA, Pedro José	A2	
artigoEmPeriodico	 	2006	0004-640X	http://www.scopus.com/scopus/inward/citedby.url?partnerID=bb5nvXTn&rel=R6.0.0&doi=10.1007/s10509-006-9048-5&md5=128112ee7eb5db0d95346f432f2af101	Spinorial Field and Lyra Geometry	Astrophysics and Space Science	de MELO, C. A. M.; PIMENTEL, Bruto Max ; CASANA, Rodolfo	A4	
artigoEmPeriodico	 	2006	1594-9982	http://dx.doi.org/10.1393/ncb/i2006-10014-1	Schwinger's Principle and Gauge Fixing in the Free Electromagnetic Field	Il Nuovo Cimento della Società Italiana di Fisica. B (Testo stampato)	de MELO, C. A. M.; PIMENTEL, Bruto Max ; POMPÉIA, Pedro José	Qualis nao identificado	IL NUOVO CIMENTO DELLA SOCIETÀ ITALIANA DI FISICA. B (TESTO STAMPATO)
artigoEmPeriodico	 	2005	0038-1098	http://www.scopus.com/scopus/inward/citedby.url?partnerID=bb5nvXTn&rel=R6.0.0&doi=10.1016/j.ssc.2005.04.026&md5=e76319eb1814fde2177300c4c60810cd	The dynamics of excitons and trions in resonant tunneling diodes	SOLID STATE COMMUNICATIONS	Camps, I.; Makler, S. S. ; Vercik, A. ; Gobato, Y. Galvão ; Marques, G. E. ; Brasil, M. J. S. P.	A4	
artigoEmPeriodico	 	2005	0026-2692	http://dx.doi.org/10.1016/j.mejo.2005.04.013	Negative Charged Excitons in Double Barrier Diodes	MICROELECTRONICS JOURNAL	Camps, I.; Vercik, A. ; Gobato, Y. Galvão ; Brasil, M. J. S. P. ; Marques, G. E. ; Makler, S. S.	Qualis nao identificado	MICROELECTRONICS JOURNAL
artigoEmPeriodico	 	2005	0103-9733	http://www.scopus.com/scopus/inward/citedby.url?partnerID=bb5nvXTn&rel=R6.0.0&doi=10.1590/s0103-97332005000700040&md5=2f4cc51d67c646807fc52cb03a2d04a9	Electromagnetic Field in Lyra Manifold: A First Order Approach	Brazilian Journal of Physics (Impresso)	de MELO, C. A. M.; PIMENTEL, Bruto Max ; CASANA, Rodolfo	A3	
artigoEmPeriodico	 	2005	0026-2692	http://dx.doi.org/10.1016/j.mejo.2005.02.055	Charge buildup effects in asymmetric p-type resonant tunneling diodes	MICROELECTRONICS JOURNAL	Gobato, Y. Galvão ; Brasil, M. J. S. P. ; Camps, I. ; Carvalho, H. B. de ; Santos, L. F. dos ; Marques, G. E. ; Henini, M. ; Eaves, L. ; Hill, G.	Qualis nao identificado	MICROELECTRONICS JOURNAL
artigoEmPeriodico	 	2005	1806-1117	http://dx.doi.org/10.1590/S1806-11172005000400002	Compreendendo a oscilação dos neutrinos	Revista Brasileira de Ensino de Física (Impresso)	Valdiviesso, Gustavo do A.; Guzzo, Marcelo M.	A1	
artigoEmPeriodico	 	2005	0163-1829	http://www.scopus.com/scopus/inward/citedby.url?partnerID=bb5nvXTn&rel=R6.0.0&doi=10.1103/physrevb.71.075310&md5=293e3603a0afe3efbe37f96d7a73745e	Kinetics of excitonic complexes on tunneling devices	Physical Review. B, Condensed Matter. (Cessou 1997. Cont. 1098-0121 Physical Review. B, Condensed Matter and Materials Physics)	Vercik, A. ; Gobato, Y. Galvão ; Camps, I. ; Marques, G. E. ; Brasil, M. J. S. P. ; Makler, S. S.	A1	
artigoEmPeriodico	 	2004	1824-8039		Scalar and Vector Massive Fields in Lyra's Manifold	Pos Proceedings of Science	de MELO, C. A. M.; PIMENTEL, Bruto Max ; CASANA, Rodolfo	Qualis nao identificado	POS PROCEEDINGS OF SCIENCE
artigoEmPeriodico	 	2004	0921-5107	http://www.scopus.com/scopus/inward/citedby.url?partnerID=bb5nvXTn&rel=R6.0.0&doi=10.1016/j.mseb.2004.05.019&md5=fe73fb066e50da8b0d6731b629501711	Photocurrent and photoluminescence studies of resonant tunneling diodes	Materials Science and Engineering B-Advanced Functional Solid-State Materials	Santos, L. F. dos ; Vercik, A. ; Camps, I. ; Gobato, Y. Galvão	A1	
artigoEmPeriodico	 	2002	0268-1242	http://www.scopus.com/scopus/inward/citedby.url?partnerID=bb5nvXTn&rel=R6.0.0&doi=10.1088/0268-1242/17/9/320&md5=21cfd721b13f646b7325039de28c7cd3	Efficiencies in multiquantum well lasers	SEMICONDUCTOR SCIENCE AND TECHNOLOGY	Camps, I.; Sánchez, M. ; González, J. C.	A2	
artigoEmPeriodico	 	2002	0921-4526	http://www.scopus.com/scopus/inward/citedby.url?partnerID=bb5nvXTn&rel=R6.0.0&doi=10.1016/s0921-4526(02)00491-x&md5=80ffd315fe3fd8380fcac196ae24f220	The coherence of the AlGaAs-GaAs phonon laser	PHYSICA B-CONDENSED MATTER	Makler, S. S. ; Camps, I.	A4	
artigoEmPeriodico	 	2001	0163-1829	http://www.scopus.com/scopus/inward/citedby.url?partnerID=bb5nvXTn&rel=R6.0.0&doi=10.1103/physrevb.64.125311&md5=35fefd6119b0d92d8006582b9231011e	GaAs-AlxGa1-xAs double-barrier heterostructure phonon laser: A full quantum treatment	Physical Review. B, Condensed Matter. (Cessou 1997. Cont. 1098-0121 Physical Review. B, Condensed Matter and Materials Physics)	Camps, I.; Makler, S. S. ; Pastawski, H. M. ; Torres, L. E. F.	A1	
artigoEmPeriodico	 	2001	0022-3093	http://www.scopus.com/scopus/inward/citedby.url?partnerID=bb5nvXTn&rel=R6.0.0&doi=10.1016/s0022-3093(01)00608-1&md5=a026adc183b7786a3d17c37fd2df7e14	Chemical and morphological properties of amorphous silicon oxynitride films deposited by plasma enhanced chemical vapor deposition	JOURNAL OF NON-CRYSTALLINE SOLIDS	SCOPEL, W. L. ; CUZINATTO, R. R. ; TABACNIKS, Manfredo Harri ; FANTINI, M. C. A. ; ALAYO, M. I. ; PEREYRA, I.	A1	
artigoEmPeriodico	 	2000	0038-1098	http://www.scopus.com/scopus/inward/citedby.url?partnerID=bb5nvXTn&rel=R6.0.0&doi=10.1016/s0038-1098(00)00312-4&md5=7b0d87f6a34385190e9b9c984f7506bd	The operation threshold of a double barrier phonon laser	SOLID STATE COMMUNICATIONS	Camps, I.; Makler, S. S.	A4	
artigoEmPeriodico	 	2000	0953-8984	http://www.scopus.com/scopus/inward/citedby.url?partnerID=bb5nvXTn&rel=R6.0.0&doi=10.1088/0953-8984/12/13/322&md5=1c3f2a056e62d548747b65ac6cf4d813	A double-barrier heterostructure generator of terahertz phonons: many-body effects	JOURNAL OF PHYSICS-CONDENSED MATTER	Makler, S. S. ; Camps, I. ; Weberszpil, J. ; Tuyarot, D. E.	A3	
artigoEmPeriodico	 	1999	0103-9733	http://www.scopus.com/scopus/inward/citedby.url?partnerID=bb5nvXTn&rel=R6.0.0&doi=10.1590/s0103-97331999000400015&md5=f7f0b4f900c305b73967e531d200dc2f	A quantum formalism for a terahertz acoustic laser	BRAZILIAN JOURNAL OF PHYSICS	Camps, I.; Makler, S. S. ; Anda, E. V.	A3	
artigoEmPeriodico	 	1997	0268-1242	http://www.scopus.com/scopus/inward/citedby.url?partnerID=bb5nvXTn&rel=R6.0.0&doi=10.1088/0268-1242/12/12/005&md5=421adfc02d8daab4618aa68a502ff61e	Calculation of the thermal resistance and temperature distribution in blue-green semiconductor lasers	SEMICONDUCTOR SCIENCE AND TECHNOLOGY	Camps, I.; González, J. C. ; Sánchez, M.	A2	
artigoEmPeriodico	 	1996	0035-001X		Thermal resistance of double heterostructure separate confinement GaAs/AlGaAs semiconductor lasers in stripe geometry configuration	REVISTA MEXICANA DE FISICA	Marin, E. ; Camps, I. ; Sánchez, M. ; Días, P.	B2	
artigoEmPeriodico	 	1996	0021-8979	http://www.scopus.com/scopus/inward/citedby.url?partnerID=bb5nvXTn&rel=R6.0.0&doi=10.1063/1.361384&md5=1e64b7cef2b7f9deea47aad0f2c2594c	Cavity length dependence of the peak conversion efficiency in AlGaAs lasers	JOURNAL OF APPLIED PHYSICS	Sánchez, M. ; Camps, I. ; González, J. C. ; Días, P. ; Prutskij, T. A.	A1	
trabalhoCompletoEmCongresso	 	2021		MODELOS POPULACIONAIS APLICADOS AO SUL DE MINAS GERAIS	II Congresso Brasileiro Interdisciplinar de Ciência e Tecnologia	de MELO, C. A. M.; PEREIRA, L. H.		
trabalhoCompletoEmCongresso	 	2021	http://dx.doi.org/10.29327/143026.2-102	ESTIMATIVA DOS PARÂMETROS FÍSICOS DE BURACOS NEGROS BINÁRIOS ATRAVÉS DE SUAS ONDAS GRAVITACIONAIS	Anais do Congresso Brasileiro Interdisciplinar em Ciência e Tecnologia	NASCIMENTO, NICOLAS LERIONE NUNES DA SILVA ; CUZINATTO, RODRIGO ROCHA		
trabalhoCompletoEmCongresso	 	2021		PROJEC?A?O DA GERAC?A?O DE RESI?DUOS SO?LIDOS URBANOS EM POC?OS DE CALDAS ATE? 2040 POR MEIO DE MODELOS MATEMA?TICOS POPULACIONAIS	18 Congresso Nacional de Meio Ambiente de Poços de Caldas	PEREIRA, L. H. ; de MELO, C. A. M.		
trabalhoCompletoEmCongresso	 	2016	http://dx.doi.org/10.1007/978-3-030-65775-8_25	In silico development of new acetylcholinesterase inhibitors	6th International Conference on Structural Biology	Camps, I; A. L. Pascoini ; FREDERICO, L. B. ; A. L. F. Arêas ; B. A. Verde		
trabalhoCompletoEmCongresso	 	2012		Polyglycerol dendrimers bearing rhodamine and Gd3+ as terminal groups: Magneto-optical properties and phototoxicity against tumoral cells	Congresso Latino Americano de Órgãos Artificiais e Biomateriais	MARTINS, T. ; M. G. Vivas ; DE BONI, Leonardo ; MENDONCA, C. R. ; de QUEIROZ, A.A.A.		
trabalhoCompletoEmCongresso	 	2011		Mathematical modeling of an horizontal-flow anaerobic immobilized biomass (HAIB) reactor treating acid mine drainage	X DAAL - Simpósio Latino-Americano de Digestão Anaeróbia	RODRIGUEZ, R. P. ; DONOSO-BRAVO, A. ; VALDIVIESSO, G. A.		
trabalhoCompletoEmCongresso	 	2010		A Produção Acadêmica na Área de Exatas: Um Panorama Recente e Relações com a Educação	VII Seminário sobre Leitura e Produçào no Ensino Euperior	de MELO, C. A. M		
trabalhoCompletoEmCongresso	 	2006		Um estudo exploratório sobre as crenças epistemológicas de ingressantes do ensino superior	X Encontro de Pesquisa em Ensino de Física	Rebello Sousa Dias, M.; COIMBRA, D. ; LINDINO, T. C.		
trabalhoCompletoEmCongresso	 	2004		Selective voltage-controlled hole spin in non-magnetic resonant tunneling diondes	2004 MRS Spring Meeting. IUMRS-ICEM 2004	Bittencourt, A. C. R. ; Marques, G. E. ; Gobato, Y. Galvão ; Vercik, A. ; Camps, I. ; Brasil, M. J. S. P.		
trabalhoCompletoEmCongresso	 	2004		Scalar and Vector Massive Fields in Lyra´s Manifold	Fourth International Winter Conference on Mathematical Methods in Physics	de MELO, C. A. M.; PIMENTEL, Bruto Max ; CASANA, Rodolfo		
trabalhoCompletoEmCongresso	 	2003		Variational Formulation of Quantum Mechanics in Riemannian Manifolds: Covariancy and the Choice of Base States	I Encontro Nacional de Física Teórica e Computacional	de MELO, C. A. M.; PIMENTEL, Bruto Max		
trabalhoCompletoEmCongresso	 	2002		Princípio Variacional de Schwinger e Mecânica Estatística: Cavidades Ressonantes e Átomos Frios	Simpósio Tendências da Física Estaística no Brasil	de MELO, C. A. M.; PIMENTEL, Bruto Max		
trabalhoCompletoEmCongresso	 	2002		Princípio Variacional de Schwinger, Espalhamento e Sistemas Quânticos à Temperatura Finita	XXV Congresso Paulo Leal Ferreira de Física Teórica	de MELO, C. A. M.; PIMENTEL, Bruto Max		
trabalhoCompletoEmCongresso	 	2002		Princípio Variacional de Schwinger e Mecânica Estatística: Cavidades Ressonantes e Átomos Frios	Simpósio Rumos da Física Estatística no Brasil.	de MELO, C. A. M.; PIMENTEL, Bruto Max		
trabalhoCompletoEmCongresso	 	2001		Schwinger´s Principle and the B-Field Formalism for the Free Electromagnetic Field	XXII Encontro Nacional de Física de Partículas e Campos	de MELO, C. A. M.; PIMENTEL, Bruto Max ; POMPÉIA, Pedro José		
trabalhoCompletoEmCongresso	 	2000		Mecânica Quântica Quaterniônica a la Schwinger	XXI Encontro Nacional de Física de Partículas e Campos	de MELO, C. A. M.; PIMENTEL, Bruto Max		
trabalhoCompletoEmCongresso	 	2000		Spectrum of Polytropic Fluids: A Statistical Approach	Encontro Nacional de Física de Partículas e Campos	Valdiviesso, G.; GAMA, M. C. ; MAIA JR, A.		
trabalhoCompletoEmCongresso	 	1998		Temperature dependence of the peak power conversion efficiency for AlGaAs diode lasers	II International Workshop on Optoelectronic Materials and their Applications (including Solar Cells)	Sánchez, M. ; Gómez, A. S. ; Peña, R. ; Escabosa, A. ; Prutskij, T. ; Camps, I. ; González, J. C.		
trabalhoCompletoEmCongresso	 	1997		Power conversion efficiency in AlGaAs lasers diodes. Theory and experiment	Symposium on Lasers and Their Applications	Camps, I.; Sánchez, M. ; González, J. C.		
trabalhoCompletoEmCongresso	 	1997		Power conversion efficiency in multiquantum well lasers	Nanoestructura'97. Reunión de sistemas de baja dimensionalidad y sus aplicaciones	Camps, I.; Sánchez, M. ; González, J. C.		
trabalhoCompletoEmCongresso	 	1995		Influencia de la longitud de la cavidad y la longitud de onda de emisión en la eficiencia de conversión en láseres de AlGaAs	V Encuentro Latinoamericano sobre Óptica	Camps, I.; González, J. C. ; Sánchez, M. ; Días, P. ; Marin, E. ; Prutskij, T.		
resumoExpandidoEmCongresso	 	2021	Simulating the X-ARAPUCA, DUNE's next generation light sensors	The 22nd International Workshop on Neutrinos from Accelerators, 2022, Cagliari. Proceedings of The 22nd International Workshop on Neutrinos from Accelerators ¿ PoS(NuFact2021). Trieste: Sissa Medialab	VALDIVIESSO, GUSTAVO		
resumoExpandidoEmCongresso	 	2021	Status of the Short-Baseline Near Detector at Fermilab	The 22nd International Workshop on Neutrinos from Accelerators, 2022, Cagliari. Proceedings of The 22nd International Workshop on Neutrinos from Accelerators ¿ PoS(NuFact2021). Trieste: Sissa Medialab	VALDIVIESSO, GUSTAVO		
resumoExpandidoEmCongresso	 	2020	Understanding the photobleaching mechanisms of MEH-PPV	43ª Reunião Anual da SBQ, 2020, Evento online. Understanding the photobleaching mechanisms of MEH-PPV	RALCOSKI, M. L. ; VIVAS, M.G.		
resumoExpandidoEmCongresso	 	2019	Two-photon Absorption of GaN and AlxGa1-xN Thin Films	Frontiers in Optics + Laser Science APS/DLS, 2019, Washington, DC United States. Two-photon Absorption of GaN and AlxGa1-xN Thin Films	MANOEL, D. S. ; DIPOLD, J. ; MARTINS, R. R. ; FONSECA, R. D. ; VOSS, T. ; WAAG, A. ; VIVAS, M. G. ; MENDONCA, C. R.		
resumoExpandidoEmCongresso	 	2017	Two-Photon Circular-Linear Dichroism on a Binaphtalene-based Polymer	Fronties in Optics, 2017, Washington, DC. Two-Photon Circular-Linear Dichroism on a Binaphtalene-based Polymer	DIPOLD, J. ; KOECKELBERGHS, GUY ; VIVAS, M. G. ; De BONI, L. ; MENDONCA, C. R.		
resumoExpandidoEmCongresso	 	2015	Desenvolvimento de um sensor óptico baseado no fenômeno de Ressonância de Plásmon de Superfície	67 Reunião Anual da SBPC, 2015, São Carlos. Desenvolvimento de um sensor óptico baseado no fenômeno de Ressonância de Plásmon de Superfície	OLIVEIRA, A. C. ; VIVAS, MARCELO G		
resumoExpandidoEmCongresso	 	2015	In silico design of new drugs for myeloid leukemia treatment	MOL2NET, International Conference on Multidisciplinary Sciences, 2015, Sciforum.net. Proceedings of MOL2NET, International Conference on Multidisciplinary Sciences. Basel: MDPI	PEREIRA, W. ; Camps, I		
resumoExpandidoEmCongresso	 	2015	Investigando processos ópticos não lineares através de medidas ópticas lineares	67 Reunião Anual da SBPC, 2015, São Carlos. Investigando processos ópticos não lineares através de medidas ópticas lineares	SIQUEIRA, A. S. F. ; VIVAS, M. G.		
resumoExpandidoEmCongresso	 	2015	Revealing the Dynamic of Excited State Proton Transfer of a Novel ?-conjugated Salicylidene Chromophore	Encontro Latino Americano de Fotoquímica e Fotobiologia, 2015, Maresias. Revealing the Dynamic of Excited State Proton Transfer of a Novel ?-conjugated Salicylidene Chromophore	VIVAS, M. G.; GERMINO, J. C. ; BARBOSA, C. A. ; De Boni, L. ; ATVARZ, T. D. Z. ; MENDONCA, C. R.		
resumoExpandidoEmCongresso	 	2015	Experimental and Theoretical study of effect of the Zn coordination complex on the excited state and two-photon absorption spectra of salicylidene compounds	Encontro Latino Americano de Fotoquímica e Fotobiologia, 2015, Maresias. Experimental and Theoretical study of effect of the Zn coordination complex on the excited state and two-photon absorption spectra of salicylidene compounds	VIVAS, M. G.; GERMINO, J. C. ; BARBOSA, C. A. ; DE BONI, Leonardo ; ATVARZ, T. D. Z. ; MENDONCA, C. R.		
resumoExpandidoEmCongresso	 	2015	Revealing the Dynamic of Excited State Proton Transfer of a Novel ?-conjugated Salicylidene Chromophore	European Conference on Lasers and Electro-Optics - European Quantum Electronics Conference, 2015, Munich. Revealing the Dynamic of Excited State Proton Transfer of a Novel ?-conjugated Salicylidene Chromophore	VIVAS, MARCELO G; GERMINO, J. C. ; BARBOSA, C. A. ; DE BONI, Leonardo ; ATVARZ, T. D. Z. ; MENDONÇA, CLEBER R		
resumoExpandidoEmCongresso	 	2015	Giant Hyper-Rayleigh Scattering Observed in a Class of Chiral Polymers	European Conference on Lasers and Electro-Optics - European Quantum Electronics Conference, 2015, Munich. Giant Hyper-Rayleigh Scattering Observed in a Class of Chiral Polymers	VIVAS, MARCELO G; KOECKELBERGHS, G. ; MENDONÇA, CLEBER R ; DE BONI, Leonardo		
resumoExpandidoEmCongresso	 	2014	Determination of Size and Size Distribution of Water-Soluble CdTe Quantum Dots Synthesized by One-Pot Approach	International Conference on Quantum Dots, 2014, Pisa. International Conference on Quantum Dots	SOUZA, J. C. L. ; VIVAS, M. G. ; MENDONCA, C. R. ; FERRARI, J. L. ; SCHIAVON, MARCO A.		
resumoExpandidoEmCongresso	 	2013	TiO_2 Assisted Rhodamine B Photodegradation via Multiphotonic Excitation	Frontiers in Optics, 2013	FIGUEREDO, TARCÍSIO R. ; VIVAS, MARCELO ; Mendonca, Cleber R.		
resumoExpandidoEmCongresso	 	2013	Two-Photon Circular-Linear Dichroism of Chiral Molecules Based on Phenylacetylene Moieties	Frontiers in Optics, 2013, Orlando. Frontiers in Optics 2013. Washington: OSA	Vivas, Marcelo G.; SILVA, DANIEL ; DE BONI, Leonardo ; CANUTO, SYLVIO ; Mendonca, Cleber R.		
resumoExpandidoEmCongresso	 	2012	Effect of Electron Withdrawing Substituents on the two-photon absorption Properties of a Novel Class of Push-Pull Triarylamine Compounds	Latin America Optics and Photonics Conference, 2012	Vivas, Marcelo G.; DE BONI, Leonardo ; MENDONCA, CLEBER ; ISHOW, ELENA		
resumoExpandidoEmCongresso	 	2012	Influence of Conformational Change Induced by Solvent on the Two-photon Absorption spectrum of Poly(3,6 phenanthrene)s	Latin America Optics and Photonics Conference, 2012	Vivas, Marcelo G.; KOECKELBERGHS, GUY ; MENDONCA, CLEBER		
resumoExpandidoEmCongresso	 	2010	Study of the Two-photon-induced Reduction of Gold Nanoparticles	Frontiers in Optics, 2010, Rochester. Frontiers in Optics 2010/Laser Science XXVI. Washington: OSA	FERREIRA, PAULO HENRIQUE D. ; VIVAS, MARCELO GONÇALVES. ; SIQUEIRA, JONATHAS DE PAULA. ; DE BONI, Leonardo ; MISOGUTI, LINO ; MENDONÇA, CLEBER RENATO.		
resumoExpandidoEmCongresso	 	2010	Femtosecond Pulse Shaping For Coherent Control Of Gold Nanoparticles Formation	Latin America Optics and Photonics Conference, 2010, Recife. Latin America Optics and Photonics Conference. Washington: OSA	MENDONCA, CLEBER ; FERREIRA, PAULO H. ; SIQUEIRA, JONATHAS ; MISOGUTI, LINO ; Vivas, Marcelo G. ; DOS SANTOS, DAVID S. ; DE BONI, Leonardo		
resumoExpandidoEmCongresso	 	2010	Equivalence Principle from the Solar and Reactor Neutrino Observations	XXIV International Conference on Neutrino Physics and Astrophysics, 2012, Atenas, Grécia. Nuclear Physics B (Proceedings Supplements)	Valdiviesso, G.A.; Holanda, P.C. ; GUZZO, M. M.		
resumoExpandidoEmCongresso	 	2010	Polarization-Dependent Two-Photon Absorption of ?-Conjugated Molecules	Frontiers in Optics, 2010	Vivas, Marcelo G.; DE BONI, Leonardo ; Mendonca, Cleber R.		
resumoExpandidoEmCongresso	 	2010	Temperature Dependence of the Two-photon Absorption of Carotenoids	Latin America Optics and Photonics Conference, 2010, Recife. Latin America Optics and Photonics Conference. Washington: OSA	Vivas, Marcelo G.; Mendonca, Cleber R.		
resumoExpandidoEmCongresso	 	2009	Investigation of the Degenerate Two-Photon Absorption Cross-Section in all-trans Retinal: Nonlinear Spectrum and Molecular Structure	International Conference on Advanced Materials, 2009, Rio de janeiro. digital book	M. G. Vivas; D. L. Silva ; Mendonça, C. R.		
resumoExpandidoEmCongresso	 	2009	Absorção de dois fótons degenerada de compostos carotenóides: Espectro não linear e cálculos teóricos	XIII Workshop do programa de pós-graduação em física do IFSC, 2009, São Carlos - SP. Abstract book	M. G. Vivas; SILVA, D. L. ; MENDONCA, C. R.		
resumoExpandidoEmCongresso	 	2008	Molecular modeling of prenilated benzophenones extracted from seeds of Rheedia Brasiliensis	4º Simpósio Brasileiro em Química Medicinal. BrazMedChem 2008, 2008, Porto de Galinhas. PE. 4º Simpósio Brasileiro em Química Medicinal. BrazMedChem 2008. CD-ROM	Ellen Silva de Sousa ; Camps, I. ; Marcelo H. dos Santos ; Nelilma Correa Romeiro ; Márcia P. Veloso		
resumoExpandidoEmCongresso	 	2008	Influence of conformational polymorphism in the receptor-ligand complex formation	4º Simpósio Brasileiro em Química Medicinal. BrazMedChem 2008, 2008, Porto de Galinhas. PE. 4º Simpósio Brasileiro em Química Medicinal. BrazMedChem 2008. CD-ROM	Mauro, A. ; Camps, I. ; Felipe T. Martins		
resumoExpandidoEmCongresso	 	2008	Powder diffraction analyses of crystalline forms of fluconazole, nimesulidum and mebendazole	4º Simpósio Brasileiro em Química Medicinal. BrazMedChem 2008, 2008, Porto de Galinhas. PE. 4º Simpósio Brasileiro em Química Medicinal. BrazMedChem 2008. CD-ROM	Neves, P. P. ; A. C. Doriguetto ; Simone Vieira Pereira ; Mir, M. ; Camps, I. ; Magali Benjamim de Araujo ; Javier A. Ellena		
resumoExpandidoEmCongresso	 	2007	Estudo das propriedades Hemocompatíveis do Poliglicerol dendrítico por Ressonância de Plásmon de Superície	10o Sicem, 2007, São Carlos - SP. digital book	GIAROLA, V. M. ; M. G. Vivas ; de QUEIROZ, A.A.A.		
resumoExpandidoEmCongresso	 	2006	Study of the blood compatibility of polyglycerol dendrimers by using the surface plasmon resonance sensor	World Polymer Congress - Macro 2006, 2006, Rio de Janeiro. digital book	M. G. Vivas; GIAROLA, V. M. ; de QUEIROZ, A.A.A.		
resumoExpandidoEmCongresso	 	2002	Estudo sobre Elementos de Linha de Modelos Cosmológicos	XXV Congresso Paulo Leal Ferreira, 2003, São Paulo. XXV Congresso Paulo Leal Ferreira. São Paulo: Editora Livraria da Física	CUZINATTO, R. R		
resumoExpandidoEmCongresso	 	2002	A Equação de Estado de um Sistema com Interação Aplicada à Cosmologia	XXV Congresso Paulo Leal Ferreira, 2003, São Paulo. XXV Congresso Paulo Leal Ferreira. São Paulo: Editora Livraria da Física	MEDEIROS, L. G. ; CUZINATTO, R. R. ; ALDROVANDI, R.		
