artigoEmPeriodico	 	2024	0308-8146	http://dx.doi.org/10.1016/j.foodchem.2023.137081	Cellular assays combined with metabolomics highlight the dual face of phenolics: From high permeability to morphological cell damage	FOOD CHEMISTRY	G. Rocchetti ; L. Lucini ; GONCALVES, J. E. ; Camps, I. ; LIMA, A. S. ; GRANATO, D. ; PINHEIRO, L. C. ; L. Azevedo	A1	
artigoEmPeriodico	 	2023	1748-0221	http://dx.doi.org/10.1088/1748-0221/18/04/p04034	Highly-parallelized simulation of a pixelated LArTPC on a GPU	Journal of Instrumentation	ABED ABUD, A	A3	
artigoEmPeriodico	 	2023	2470-0010	http://dx.doi.org/10.1103/physrevd.107.112012	Impact of cross-section uncertainties on supernova neutrino spectral parameter fitting in the Deep Underground Neutrino Experiment	PHYSICAL REVIEW D	ABED ABUD, A	A1	
artigoEmPeriodico	 	2023	2470-0010	http://dx.doi.org/10.1103/physrevd.107.092012	Identification and reconstruction of low-energy electrons in the ProtoDUNE-SP detector	PHYSICAL REVIEW D	ABUD, A	A1	
artigoEmPeriodico	 	2023	1434-6052	http://dx.doi.org/10.1140/epjc/s10052-023-11733-2	Reconstruction of interactions in the ProtoDUNE-SP detector with Pandora	EUROPEAN PHYSICAL JOURNAL C. PARTICLES AND FIELDS	ABUD, A	A2	
artigoEmPeriodico	 	2023	1471-2180	http://dx.doi.org/10.1186/s12866-023-02756-6	Genomic landscape of the emerging XDR Salmonella Typhi for mining druggable targets clpP, hisH, folP and gpmI and screening of novel TCM inhibitors, molecular docking and simulation analyses	BMC MICROBIOLOGY	AFZAL, MUNEEBA ; HASSAN, SYED SHAH ; SOHAIL, SAMAN ; Camps, Ihosvany ; KHAN, YASMIN ; BASHARAT, ZARRIN ; KARIM, ASAD ; AURONGZEB, MUHAMMAD ; IRFAN, MUHAMMAD ; SALMAN, MUHAMMAD ; MOREL, CARLOS M.	Qualis nao identificado	BMC MICROBIOLOGY
artigoEmPeriodico	 	2023	0169-4332	http://dx.doi.org/10.1016/j.apsusc.2022.155358	Functionalized boron-nitride nanotubes: First-principles calculations	APPLIED SURFACE SCIENCE	AGUIAR, C. ; CAMPS, M. ; DATTANI, N. ; Camps, I.	A1	
artigoEmPeriodico	 	2023	0921-4526	http://dx.doi.org/10.1016/j.physb.2023.415178	Möbius boron-nitride nanobelts interacting with heavy metal nanoclusters	PHYSICA B-CONDENSED MATTER	AGUIAR, C. ; DATTANI, N. ; Camps, I.	A4	
artigoEmPeriodico	 	2023	1610-2940	http://dx.doi.org/10.1007/s00894-023-05669-3	Möbius carbon nanobelts interacting with heavy metal nanoclusters	JOURNAL OF MOLECULAR MODELING	AGUIAR, C. ; DATTANI, N. ; Camps, I.	A4	
artigoEmPeriodico	 	2023	2073-8994	http://dx.doi.org/10.3390/sym15030709	Dynamical Analysis of the Covarying Coupling Constants in Scalar-Tensor Gravity	Symmetry-Basel	CUZINATTO, RODRIGO R.; GUPTA, RAJENDRA P. ; POMPEIA, PEDRO J.	A4	
artigoEmPeriodico	 	2023	1402-4896	http://dx.doi.org/10.1088/1402-4896/ace561	A massive gauge theory à la</i> Utiyama	Physica Scripta	CUZINATTO, RODRIGO ROCHA; PIMENTEL, BRUTO MAX ; POMPEIA, PEDRO JOSÉ ; SUMIRE ESQUIA, JUAN CARLOS	A4	
artigoEmPeriodico	 	2023	1386-9477	http://dx.doi.org/10.1016/j.physe.2022.115513	Leveraging machine learning to harness non-parabolic effects in semiconductor heterostructures	PHYSICA E-LOW-DIMENSIONAL SYSTEMS & NANOSTRUCTURES	DA SILVA MACEDO, GABRIEL ; DE SOUSA DIAS, MARIAMA REBELLO ; BEZERRA, Anibal Thiago	A3	
artigoEmPeriodico	 	2023	1089-7690	http://dx.doi.org/10.1063/5.0151622	Observation of the two-photon transition enhanced first hyperpolarizability spectra in cinnamaldehyde derivatives: A femtosecond regime study	Journal Of Chemical Physics	DOS SANTOS, CARLOS H. D. ; ZUCOLOTTO COCCA, LEANDRO H. ; PELOSI, ANDRÉ GASPAROTTO ; BATISTA, VASCO F. ; PINTO, DIANA C. G. A. ; FAUSTINO, M. AMPARO F. ; Vivas, Marcelo G. ; DE PAULA SIQUEIRA, JONATHAS ; MENDONÇA, CLEBER R. ; DE BONI, Leonardo	A2	
artigoEmPeriodico	 	2023	0003-4916	http://dx.doi.org/10.1016/j.aop.2023.169411	Viable wormhole solution in Bopp-Podolsky electrodynamics	ANNALS OF PHYSICS	FRIZO, D.A. ; DE MELO, C.A.M. ; MEDEIROS, L.G. ; NEVES, JULIANO C.S.	A2	
artigoEmPeriodico	 	2023	1899-2358	http://dx.doi.org/10.5506/APhysPolBSupp.16.1-A88	Effective Shear and Bulk Viscosities of the Quark-Gluon Plasma: QCD Versus Heavy-ion Data	ACTA PHYSICA POLONICA. B, PROCEEDINGS SUPPLEMENT	GARDIM, F.G.; OLLITRAULT, J.-Y.	B3	
artigoEmPeriodico	 	2023	1463-9076	http://dx.doi.org/10.1039/d2cp05004h	Frequency-resolved microscopic second-order hyperpolarizability of azochromophores: a study on nonlinear all-optical switching applications	PHYSICAL CHEMISTRY CHEMICAL PHYSICS	MOYSÉS, RENATO MAFRA ; BARBANO, EMERSON CRISTIANO ; DA SILVA, DANIEL LUIZ ; VIVAS, MARCELO GONÇALVES ; MISOGUTI, LINO	A1	
artigoEmPeriodico	 	2023	1570-1786	http://dx.doi.org/10.2174/1570178620666230811122313	In-Silico Identification of Dexamethasone-similar Compounds Against SARS-Cov-2 Spike Protein: A Drug Repurposing Approach	LETTERS IN ORGANIC CHEMISTRY	PATHAK, YAMINI ; TRIPATHI, VISHWAS ; Camps, Ihosvany ; QAIS, FAIZAN ABUL ; MISHRA, AMARESH	Qualis nao identificado	LETTERS IN ORGANIC CHEMISTRY
artigoEmPeriodico	 	2023	0031-8949	http://dx.doi.org/10.1088/1402-4896/acbdc8	Revisiting semiconductor bulk hamiltonians using quantum computers	PHYSICA SCRIPTA	PIMENTA, RAPHAEL CÉSAR DE SOUZA ; BEZERRA, Anibal Thiago	A4	
artigoEmPeriodico	 	2023	1463-9076	http://dx.doi.org/10.1039/d2cp05189c	Unveiling the molecular structure and two-photon absorption properties relationship of branched oligofluorenes	PHYSICAL CHEMISTRY CHEMICAL PHYSICS	ZUCOLOTTO COCCA, LEANDRO H. ; PELOSI, ANDRÉ GASPAROTTO ; ABEGÃO, LUIS M. G. ; DE Q. GARCIA, RAFAEL ; MULATIER, JEAN-CHRISTOPHE ; PITRAT, DELPHINE ; BARSU, CYRILLE ; ANDRAUD, CHANTAL ; MENDONÇA, CLEBER R. ; Vivas, Marcelo G. ; DE BONI, Leonardo	A1	
artigoEmPeriodico	 	2022	1748-0221	http://dx.doi.org/10.1088/1748-0221/17/01/p01005	Design, construction and operation of the ProtoDUNE-SP Liquid Argon TPC	Journal of Instrumentation	ABED ABUD, A	A3	
artigoEmPeriodico	 	2022	1434-6052	http://dx.doi.org/10.1140/epjc/s10052-022-10791-2	Separation of track- and shower-like energy deposits in ProtoDUNE-SP using a convolutional neural network	EUROPEAN PHYSICAL JOURNAL C. PARTICLES AND FIELDS	ABED ABUD, A	A2	
artigoEmPeriodico	 	2022	2470-0010	http://dx.doi.org/10.1103/physrevd.105.072006	Low exposure long-baseline neutrino oscillation sensitivity of the DUNE experiment	PHYSICAL REVIEW D	ABUD, A	A1	
artigoEmPeriodico	 	2022	1434-6052	http://dx.doi.org/10.1140/epjc/s10052-022-10549-w	Scintillation light detection in the 6-m drift-length ProtoDUNE Dual Phase liquid argon TPC	EUROPEAN PHYSICAL JOURNAL C. PARTICLES AND FIELDS	ABUD, A	A2	
artigoEmPeriodico	 	2022	0035-8711	http://dx.doi.org/10.1093/mnras/stac2039	Testing a varying-¿ model for dark energy within co-varying physical couplings framework	MONTHLY NOTICES OF THE ROYAL ASTRONOMICAL SOCIETY	CUZINATTO, R R; GUPTA, R P ; HOLANDA, R F L ; JESUS, J F ; PEREIRA, S H	A1	
artigoEmPeriodico	 	2022	0035-8711	http://dx.doi.org/10.1093/mnras/stac3267	Observational constraints on varying fundamental constants in a minimal CPC model	MONTHLY NOTICES OF THE ROYAL ASTRONOMICAL SOCIETY	CUZINATTO, R R; HOLANDA, R F L ; PEREIRA, S H	A1	
artigoEmPeriodico	 	2022	1361-6382	http://dx.doi.org/10.1088/1361-6382/ac51bb	Non-commutativity and non-inertial effects on a scalar field in a cosmic string space-time: I. Klein-Gordon oscillator	Classical and Quantum Gravity	CUZINATTO, RODRIGO ROCHA; DE MONTIGNY, MARC ; POMPEIA, PEDRO JOSÉ	A1	
artigoEmPeriodico	 	2022	1361-6382	http://dx.doi.org/10.1088/1361-6382/ac51bc	Non-commutativity and non-inertial effects on a scalar field in a cosmic string space-time: II. Spin-zero Duffin-Kemmer-Petiau-like oscillator	Classical and Quantum Gravity	CUZINATTO, RODRIGO ROCHA; DE MONTIGNY, MARC ; POMPEIA, PEDRO JOSÉ	A1	
artigoEmPeriodico	 	2022	1434-6052	http://dx.doi.org/10.1140/epjc/s10052-022-10726-x	The Double Chooz antineutrino detectors	EUROPEAN PHYSICAL JOURNAL C. PARTICLES AND FIELDS	de Kerret, H	A2	
artigoEmPeriodico	 	2022	1463-9084	http://dx.doi.org/10.1039/D2CP05006D	Size-dependent photoinduced transparency in colloidal CdTe quantum dots in the strong confinement regime: an inverse linear relationship	PHYSICAL CHEMISTRY CHEMICAL PHYSICS	DOS SANTOS, CARLOS H. D. ; FERREIRA, DIEGO L. ; ZUCOLOTTO COCCA, LEANDRO H. ; MOURÃO, RAFAEL S. ; SCHIAVON, MARCO A. ; MENDONÇA, CLEBER R. ; DE BONI, Leonardo ; Vivas, Marcelo G.	A1	
artigoEmPeriodico	 	2022	1520-5827	http://dx.doi.org/10.1021/acs.langmuir.2c02023	Size-Dependent Photobleaching Mechanism and Kinetics Induced by Nanosecond Laser Pulses in Colloidal Semiconductor Quantum Dots	LANGMUIR	DOS SANTOS, CARLOS H. D. ; FERREIRA, DIEGO LOURENÇONI ; VALE, BRENER R. C. ; MOURÃO, RAFAEL S. ; SCHIAVON, MARCO ANTÔNIO ; VIVAS, MARCELO GONÇALVES	A2	
artigoEmPeriodico	 	2022	2178-7727	http://dx.doi.org/10.17648/acta.scientiae.7247	The Construction of the Tower of Pisa as a Basis for Problem-Solving in the Exact Sciences and the Use of Interdisciplinarity in Teaching	REVISTA ACTA SCIENTIAE	FARIA, L. C. S. ; TREVISAN, K. ; R. Bretas ; Camps, I. ; AVERSI-FERREIRA, T. A.	A2	
artigoEmPeriodico	 	2022	1381-1991	http://dx.doi.org/10.1007/s11030-022-10584-5	Subtractive sequence analysis aided druggable targets mining in Burkholderia cepacia complex and finding inhibitors through bioinformatics approach	MOLECULAR DIVERSITY	HASSAN, SYED SHAH ; SHAMS, RIDA ; Camps, Ihosvany ; BASHARAT, ZARRIN ; SOHAIL, SAMAN ; KHAN, YASMIN ; ULLAH, ASAD ; IRFAN, MUHAMMAD ; ALI, JAVED ; BILAL, MUHAMMAD ; MOREL, CARLOS M.	A3	
artigoEmPeriodico	 	2022	1932-7447	http://dx.doi.org/10.1021/acs.jpcc.1c10655	Al-Au Thin Films for Thermally Stable and Highly Sensitive Plasmonic Sensors	Journal of Physical Chemistry C	KREIDER, MOLLY KATE ; REHAN, ABDUL QADEER ; KENT, ROBERT. M. ; BEZERRA, ANIBAL T. ; REBELLO SOUSA DIAS, MARIAMA	A1	
artigoEmPeriodico	 	2022	1570-1808	http://dx.doi.org/10.2174/1570180819666220401142351	Triamcinolone as a potential inhibitor of SARS-CoV-2 main protease and cytokine storm: An in-silico study	Letters in Drug Design & Discovery	MISHRA, AMARESH ; QAIS, FAIZAN ABUL ; PATHAK, YAMINI ; Camps, Ihosvany ; TRIPATHI, VISHWAS	B1	
artigoEmPeriodico	 	2022	1806-9126	http://dx.doi.org/10.1590/1806-9126-rbef-2022-0004	Ondas gravitacionais de buracos negros coalescentes: um estudo quantitativo a partir de física básica	REVISTA BRASILEIRA DE ENSINO DE FÍSICA (ONLINE)	NASCIMENTO, N. L. N. S. ; CUZINATTO, R. R.	A1	
artigoEmPeriodico	 	2022	1570-1808	http://dx.doi.org/10.2174/1570180819666220622085659	Attacking the SARS-CoV-2 replication machinery with the Pathogen Box?s molecules	Letters in Drug Design & Discovery	OSORIO-MOGOLLÓN, CLEIDY ; OLIVOS-RAMÍREZ, GUSTAVO E. ; OTAZU, KEWIN ; CHENET-ZUTA, MANUEL E. ; ROPÓN-PALACIOS, GEORCKI ; DORES AGUIAR, CINTHIA DAS ; Camps, Ihosvany ; JIMENEZ-AVALOS, GABRIEL M. ; APARI-COSSIO, EDUARDO ; TORRES MOREIRA, NATALIA E. ; CÁRDENAS-CÁRDENAS, REYNA G.	B1	
artigoEmPeriodico	 	2022	1381-1991	http://dx.doi.org/10.1007/s11030-022-10561-y	Targeting notch signaling pathway in breast cancer stem cells through drug repurposing approach	MOLECULAR DIVERSITY	PATHAK, Y. ; Camps, I. ; MISHRA, A. ; TRIPATHI, V.	A3	
artigoEmPeriodico	 	2022	1476-9271	http://dx.doi.org/10.1016/j.compbiolchem.2022.107668	Glycosylation is key for enhancing drug recognition into spike glycoprotein of SARS-CoV-2	COMPUTATIONAL BIOLOGY AND CHEMISTRY	ROPÓN-PALACIOS, GEORCKI ; PÉREZ-SILVA, JHON ; ROJAS-HUMPIRE, RICARDO ; OLIVOS-RAMÍREZ, GUSTAVO E. ; CHENET-ZUTA, MANUEL ; CORNEJO-VILLANUEVA, VICTOR ; CARMEN-SIFUENTES, SHEYLA ; OTAZU, KEWIN ; RAMIREZ-DÍAZ, YARITZA L. ; CHOZO, KAROLYN VEGA ; Camps, Ihosvany	A3	
artigoEmPeriodico	 	2021	1463-9076	http://dx.doi.org/10.1039/d1cp02553h	Effective ?-electron number and Symmetry Perturbation Effect on the Two-photon Absorption of Oligofluorenes	PHYSICAL CHEMISTRY CHEMICAL PHYSICS	ABEGÃO, LUIS M.G. ; COCCA, LEANDRO ; MULATIER, JEAN-CHRISTOPHE ; PITRAT, DELPHINE ; ANDRAUD, CHANTAL ; MISOGUTI, LINO ; Mendonca, Cleber R. ; VIVAS, MARCELO GONCALVES ; BONI, LEONARDO DE	A1	
artigoEmPeriodico	 	2021	1434-6044	http://dx.doi.org/10.1140/epjc/s10052-021-09007-w	Prospects for beyond the Standard Model physics searches at the Deep Underground Neutrino Experiment	EUROPEAN PHYSICAL JOURNAL C	ABI, B	A2	
artigoEmPeriodico	 	2021	1434-6044	http://dx.doi.org/10.1140/epjc/s10052-021-09166-w	Supernova neutrino burst detection with the Deep Underground Neutrino Experiment	EUROPEAN PHYSICAL JOURNAL C	ABI, B	A2	
artigoEmPeriodico	 	2021	2624-8212	http://dx.doi.org/10.3389/frai.2021.649917	Cosmic Ray Background Removal With Deep Neural Networks in SBND	Frontiers in Artificial Intelligence	ACCIARRI, R	Qualis nao identificado	FRONTIERS IN ARTIFICIAL INTELLIGENCE
artigoEmPeriodico	 	2021	1551-0018	http://dx.doi.org/10.3934/mbe.2021467	Classification of gastric emptying and orocaecal transit through artificial neural networks	MATHEMATICAL BIOSCIENCES AND ENGINEERING (ONLINE)	BEZERRA, Anibal Thiago; INSTITUTE OF EXACT SCIENCES, FEDERAL UNIVERSITY OF ALFENAS-MG (UNIFAL-MG), ALFENAS-MG 37133-840, BRAZIL ; PINTO, LEONARDO ANTONIO ; RODRIGUES, DIEGO SAMUEL ; BITTENCOURT, GABRIELA NOGUEIRA ; DE ARRUDA MANCERA, PAULO FERNANDO ; DE ARRUDA MIRANDA, JOSÉ RICARDO ; INSTITUTE OF BIOSCIENCES, SÃO PAULO STATE UNIVERSITY (UNESP), BOTUCATU-SP 18618-689, BRAZIL ; SCHOOL OF TECHNOLOGY, UNIVERSITY OF CAMPINAS (UNICAMP), LIMEIRA-SP 13484-332, BRAZIL	Qualis nao identificado	MATHEMATICAL BIOSCIENCES AND ENGINEERING (ONLINE)
artigoEmPeriodico	 	2021	2470-0010	http://dx.doi.org/10.1103/physrevd.103.124002	Lyra scalar-tensor theory: A scalar-tensor theory of gravity on Lyra manifold	PHYSICAL REVIEW D	CUZINATTO, R.'R.; DE MORAIS, E.'M. ; PIMENTEL, B.'M.	A1	
artigoEmPeriodico	 	2021	0375-9474	http://dx.doi.org/10.1016/j.nuclphysa.2020.121999	Effects of initial state fluctuations on the mean transverse momentum	NUCLEAR PHYSICS A	Gardim, Fernando G.; GIACALONE, GIULIANO ; Luzum, Matthew ; Ollitrault, Jean-Yves	A4	
artigoEmPeriodico	 	2021	0375-9474	http://dx.doi.org/10.1016/j.nuclphysa.2020.121892	p-dependent multiplicity fluctuations from PCA and initial conditions	NUCLEAR PHYSICS A	Gardim, Fernando G.; Grassi, Frédérique ; ISHIDA, PEDRO ; Luzum, Matthew ; Ollitrault, Jean-Yves	A4	
artigoEmPeriodico	 	2021	2469-9985	http://dx.doi.org/10.1103/PhysRevC.103.044907	Effective shear and bulk viscosities for anisotropic flow	PHYSICAL REVIEW C	Gardim, Fernando G.; Ollitrault, Jean-Yves	A1	
artigoEmPeriodico	 	2021	2469-9985	http://dx.doi.org/10.1103/PhysRevC.103.024910	Skewness of mean transverse momentum fluctuations in heavy-ion collisions	PHYSICAL REVIEW C	GIACALONE, GIULIANO ; Gardim, Fernando G. ; NORONHA-HOSTLER, JACQUELYN ; Ollitrault, Jean-Yves	A1	
artigoEmPeriodico	 	2021	2469-9985	http://dx.doi.org/10.1103/PhysRevC.103.024909	Correlation between mean transverse momentum and anisotropic flow in heavy-ion collisions	PHYSICAL REVIEW C	GIACALONE, GIULIANO ; Gardim, Fernando G. ; NORONHA-HOSTLER, JACQUELYN ; Ollitrault, Jean-Yves	A1	
artigoEmPeriodico	 	2021	0753-3322	http://dx.doi.org/10.1016/j.biopha.2021.111356	Repurposing potential of Ayurvedic medicinal plants derived active principles against SARS-CoV-2 associated target proteins revealed by molecular docking, molecular dynamics and MM-PBSA studies	BIOMEDICINE & PHARMACOTHERAPY	KUMAR VERMA, AKALESH ; KUMAR, VIKAS ; SINGH, SWETA ; GOSWAMI, BHABESH CH. ; Camps, Ihosvany ; SEKAR, AISHWARYA ; YOON, SANGHWA ; LEE, KEUN WOO	A2	
artigoEmPeriodico	 	2021	0169-4332	http://dx.doi.org/10.1016/j.apsusc.2021.151547	First-principles calculations of nickel, cadmium, and lead nanoclusters adsorption on single-wall (10,0) boron-nitride nanotube	APPLIED SURFACE SCIENCE	MADEIRA, R. ; Camps, I.	A1	
artigoEmPeriodico	 	2021	2410-390X	http://dx.doi.org/10.3390/instruments5040031	Deep Underground Neutrino Experiment (DUNE) Near Detector Conceptual Design Report	Instruments	MANLY, STEVEN ; KORDOSKY, MIKE ; ON BEHALF OF THE DUNE COLLABORATION	Qualis nao identificado	INSTRUMENTS
artigoEmPeriodico	 	2021	2196-7229	http://dx.doi.org/10.1007/s40516-021-00153-3	Efficient Yet Accessible Arduino-based Control System for Laser Microfabrication of Photonic Platforms	Lasers in Manufacturing and Materials Processing	MUCCIARONI, LUIS RICARDO ; VIVAS, MARCELO GONÇALVES	Qualis nao identificado	LASERS IN MANUFACTURING AND MATERIALS PROCESSING
artigoEmPeriodico	 	2021	2574-0881	http://dx.doi.org/10.1080/25740881.2020.1867169	Fluorescent chitosan nanoparticles as a carrier system for trackable drug delivery	POLYMER-PLASTICS TECHNOLOGY AND MATERIALS	PADILHA, ANDREIA CARVALHO ; VIVAS, MARCELO GONÇALVES ; MELO, MARIA DO SOCORRO FERNANDES ; CAMPOS, MARIA GABRIELA NOGUEIRA	Qualis nao identificado	POLYMER-PLASTICS TECHNOLOGY AND MATERIALS
artigoEmPeriodico	 	2021	2447-6153		Leveraging Qiskit to teach basic quantum computation algorithms.	Parana Journal of Science and Education	Pimenta, R. C. S. ; BEZERRA, Anibal Thiago	Qualis nao identificado	PARANA JOURNAL OF SCIENCE AND EDUCATION
artigoEmPeriodico	 	2021	1520-6106	http://dx.doi.org/10.1021/acs.jpcb.1c05498	Photobleaching Kinetics of MEH-PPV in Solution: The Role of Conformational Disorder	JOURNAL OF PHYSICAL CHEMISTRY B	RAICOSKI, MICHELLE LEIFELD ; VIVAS, MARCELO GONÇALVES	A2	
artigoEmPeriodico	 	2021	2470-0010	http://dx.doi.org/10.1103/physrevd.104.084061	Gravitational waves in higher-order R 2 gravity	PHYSICAL REVIEW D	VILHENA, S.'G. ; MEDEIROS, L.'G. ; CUZINATTO, R.'R.	A1	
artigoEmPeriodico	 	2021	1089-5639	http://dx.doi.org/10.1021/acs.jpca.0c08530	Molecular Structure-Optical Property Relationship of Salicylidene Derivatives: A Study on the First-Order Hyperpolarizability	JOURNAL OF PHYSICAL CHEMISTRY A	Vivas, Marcelo G.; BARBOZA, CRISTINA A. ; GERMINO, JOSE C. ; FONSECA, RUBEN D. ; Silva, Daniel L. ; VAZQUEZ, PEDRO A. M. ; ATVARS, TERESA D. Z. ; MENDONÇA, CLEBER R. ; DE BONI, Leonardo	A3	
artigoEmPeriodico	 	2021	2053-2733	http://dx.doi.org/10.1107/S0108767321087900	Three-dimensional topological analysis of the experimental and theoretical electron density of a 5-fluorocytosine/isoniazid co-crystal	Acta Crystallographica A-Foundation and Advances	WANDERLEY, ADILSON BARROS ; TENORIO, JUAN CARLOS ; Camps, Ihosvany ; LEHMANN, CHRISTIAN W. ; Ellena, Javier	A4	
artigoEmPeriodico	 	2020	1748-0221	http://dx.doi.org/10.1088/1748-0221/15/08/t08008	Volume I. Introduction to DUNE	Journal of Instrumentation	ABI, B	A3	
artigoEmPeriodico	 	2020	1748-0221	http://dx.doi.org/10.1088/1748-0221/15/08/t08009	Volume III. DUNE far detector technical coordination	Journal of Instrumentation	ABI, B	A3	
artigoEmPeriodico	 	2020	1748-0221	http://dx.doi.org/10.1088/1748-0221/15/08/t08010	Volume IV. The DUNE far detector single-phase technology	Journal of Instrumentation	ABI, B	A3	
artigoEmPeriodico	 	2020	2470-0010	http://dx.doi.org/10.1103/physrevd.102.092003	Neutrino interaction classification with a convolutional neural network in the DUNE far detector	PHYSICAL REVIEW D	ABI, B	A1	
artigoEmPeriodico	 	2020	1434-6044	http://dx.doi.org/10.1140/epjc/s10052-020-08456-z	Long-baseline neutrino oscillation physics potential of the DUNE experiment	EUROPEAN PHYSICAL JOURNAL C	ABI, B	A2	
artigoEmPeriodico	 	2020	1748-0221	http://dx.doi.org/10.1088/1748-0221/15/12/p12004	First results on ProtoDUNE-SP liquid argon time projection chamber performance from a beam test at the CERN Neutrino Platform	Journal of Instrumentation	ABI, B	A3	
artigoEmPeriodico	 	2020	1748-0221	http://dx.doi.org/10.1088/1748-0221/15/04/p04026	The Liquid Argon In A Testbeam (LArIAT) experiment	Journal of Instrumentation	ACCIARRI, R	A3	
artigoEmPeriodico	 	2020	1748-0221	http://dx.doi.org/10.1088/1748-0221/15/06/P06033	Construction of precision wire readout planes for the Short-Baseline Near Detector (SBND)	Journal of Instrumentation	ACCIARRI, R	A3	
artigoEmPeriodico	 	2020	1569-8025	http://dx.doi.org/10.1007/s10825-020-01547-w	The application of a modified Levine model to quantum-well infrared photodetectors in the low-temperature regime	Journal of Computational Electronics	BEZERRA, Anibal Thiago	A4	
artigoEmPeriodico	 	2020	1520-6106	http://dx.doi.org/10.1021/acs.jpcb.0c04127	Probing the Strong Near-IR Two-Photon Transition in Supramolecular Triphenylamine-based Polymers by Nonlinear Absorption Spectroscopy	JOURNAL OF PHYSICAL CHEMISTRY B	DIPOLD, JESSICA ; Vivas, Marcelo G. ; KOECKELBERGHS, GUY ; SIQUEIRA, JONATHAS P. ; DE BONI, Leonardo ; Mendonca, Cleber R.	A2	
artigoEmPeriodico	 	2020	0963-9969	http://dx.doi.org/10.1016/j.foodres.2020.109334	Camu-camu (Myrciaria dubia) seeds as a novel source of bioactive compounds with promising antimalarial and antischistosomicidal properties	FOOD RESEARCH INTERNATIONAL	DO CARMO, MARIANA ARAÚJO VIEIRA ; FIDELIS, MARINA ; SANCHEZ, CAROLINE ANDOLFATO ; CASTRO, ALINE PEREIRA ; Camps, Ihosvany ; COLOMBO, FÁBIO ANTÔNIO ; MARQUES, MARCOS JOSÉ ; MYODA, TAKAO ; GRANATO, DANIEL ; AZEVEDO, LUCIANA	A1	
artigoEmPeriodico	 	2020	1745-2473	http://dx.doi.org/10.1038/s41567-020-0846-4	Thermodynamics of hot strong-interaction matter from ultrarelativistic nuclear collisions	Nature Physics	Gardim, Fernando G.; GIACALONE, GIULIANO ; Luzum, Matthew ; Ollitrault, Jean-Yves	A1	
artigoEmPeriodico	 	2020	0370-2693	http://dx.doi.org/10.1016/j.physletb.2020.135749	The mean transverse momentum of ultracentral heavy-ion collisions: A new probe of hydrodynamics	PHYSICS LETTERS B	Gardim, Fernando G.; GIACALONE, GIULIANO ; Ollitrault, Jean-Yves	A2	
artigoEmPeriodico	 	2020	0739-1102	http://dx.doi.org/10.1080/07391102.2019.1655480	Potential novel inhibitors against emerging zoonotic pathogen Nipah virus</i> : a virtual screening and molecular dynamics approach	JOURNAL OF BIOMOLECULAR STRUCTURE & DYNAMICS	ROPÓN-PALACIOS, GEORCKI ; CHENET-ZUTA, MANUEL E. ; OLIVOS-RAMIREZ, GUSTAVO E. ; OTAZU, KEWIN ; ACURIO-SAAVEDRA, JORGE ; Camps, Ihosvany	C	
artigoEmPeriodico	 	2020	2046-2069	http://dx.doi.org/10.1039/d0ra08379h	Probing the high performance of photoinduced birefringence in V-shaped azo/PMMA guest-host films	RSC Advances	SILVA, LIDIANA M. ; Silva, Daniel L. ; BOAS, MARIANA V. ; BRETONNIERE, YANN ; ANDRAUD, CHANTAL ; Vivas, Marcelo G.	A2	
artigoEmPeriodico	 	2020	0925-8388	http://dx.doi.org/10.1016/j.jallcom.2020.153828	Femtosecond-laser induced two-photon absorption of GaN and AlxGa1-xN thin films: Tuning the nonlinear optical response by alloying and doping	JOURNAL OF ALLOYS AND COMPOUNDS	VIVAS, M.G.; MANOEL, D.S. ; DIPOLD, J. ; MARTINS, R.J. ; FONSECA, R.D. ; MANGLANO-CLAVERO, I. ; MARGENFELD, C. ; WAAG, A. ; VOSS, T. ; MENDONCA, C.R.	A1	
artigoEmPeriodico	 	2019	0550-3213	http://dx.doi.org/10.1016/j.nuclphysb.2019.114634	Higher order derivative operators as quantum corrections	NUCLEAR PHYSICS B	BORGES, L.H.C. ; BARONE, F.A. ; DE MELO, C.A.M. ; BARONE, F.E.	A3	
artigoEmPeriodico	 	2019	1475-7516	http://dx.doi.org/10.1088/1475-7516/2019/02/043	New scalar field quartessence	JOURNAL OF COSMOLOGY AND ASTROPARTICLE PHYSICS	BRANDENBERGER, ROBERT ; CUZINATTO, RODRIGO R. ; FRÖHLICH, JÜRG ; NAMBA, RYO	A1	
artigoEmPeriodico	 	2019	1677-2334	http://dx.doi.org/10.5007/2175-7941.2019v36n2p529	Obtenção experimental do coeficiente de arrasto com o lançamento de foguetes de garrafas PET	CADERNO BRASILEIRO DE ENSINO DE FÍSICA	CHANG, JESSICA DE OLIVEIRA ; COSTA, FELIPE LUIZ QUINALHA ; DUTRA, IAGO CIPRIANO ; NERY, GABRIELLE AQUINO FERREIRA ; NERY, LUIS HENRIQUE ; RODRIGUES, EMILLY RAFAELLY RABELO ; SELIN, ANGELO MELARI GARCIA ; ZAMBELLO, FELIPE TEIXEIRA ; PAMPLONA DA SILVA, DANIEL JULIANO ; CUZINATTO, RODRIGO ROCHA	A1	
artigoEmPeriodico	 	2019	0218-2718	http://dx.doi.org/10.1142/S0218271819501190	Covariant c-flation: A variational approach	INTERNATIONAL JOURNAL OF MODERN PHYSICS D	COSTA, RENATO ; CUZINATTO, RODRIGO R. ; FERREIRA, ELISA G. M. ; FRANZMANN, GUILHERME	A3	
artigoEmPeriodico	 	2019	0001-7701	http://dx.doi.org/10.1007/s10714-019-2593-3	Non-commutativity and non-inertial effects on the Dirac oscillator in a cosmic string space-time	GENERAL RELATIVITY AND GRAVITATION	CUZINATTO, R. R.; DE MONTIGNY, M. ; POMPEIA, P. J.	A4	
artigoEmPeriodico	 	2019	2470-0010	http://dx.doi.org/10.1103/physrevd.99.084053	f ( R , ? ? 1	PHYSICAL REVIEW D	CUZINATTO, R.'R. ; DE MELO, C.'A.'M. ; MEDEIROS, L.'G. ; POMPEIA, P.'J.	A1	
artigoEmPeriodico	 	2019	2470-0010	http://dx.doi.org/10.1103/PhysRevD.99.084053	theories of gravity in Einstein frame: A higher order modified Starobinsky inflation model in the Palatini approach	PHYSICAL REVIEW D	CUZINATTO, R.'R.; DE MELO, C.'A.'M. ; MEDEIROS, L.'G. ; POMPEIA, P.'J.	A1	
artigoEmPeriodico	 	2019	1475-7516	http://dx.doi.org/10.1088/1475-7516/2019/02/055	Higher-order modified Starobinsky inflation	JOURNAL OF COSMOLOGY AND ASTROPARTICLE PHYSICS	Cuzinatto, R.R.; MEDEIROS, L.G. ; Pompeia, P.J.	A1	
artigoEmPeriodico	 	2019	1948-7185	http://dx.doi.org/10.1021/acs.jpclett.9b00518	Intramolecular Cooperative and Anti-Cooperative Effect on the Two-Photon Absorption Cross Section in Triphenylamine Derivatives	Journal of Physical Chemistry Letters	FONSECA, RUBEN D. ; Vivas, Marcelo G. ; SILVA, DANIEL LUIZ ; EUCAT, GWENAELLE ; BRETONNIÈRE, YANN ; ANDRAUD, CHANTAL ; Mendonca, Cleber R. ; DE BONI, Leonardo	A1	
artigoEmPeriodico	 	2019	0375-9474	http://dx.doi.org/10.1016/j.nuclphysa.2018.10.089	Probing the transverse size of initial inhomogeneities with flow observables	NUCLEAR PHYSICS A	Gardim, Fernando G.; Grassi, Frédérique ; ISHIDA, P. ; Luzum, Matthew ; MAGALHAES, P. ; NORONHA-HOSTLER, JACQUELYN	A4	
artigoEmPeriodico	 	2019	2469-9985	http://dx.doi.org/10.1103/physrevc.100.054905	<math> <msub> <mi>p</mi> <mi>T</mi> </msub> </math> -dependent particle number fluctuations from principal-component analyses in hydrodynamic simulations of heavy-ion collisions	PHYSICAL REVIEW C	Gardim, Fernando G.; Grassi, Frédérique ; ISHIDA, PEDRO ; Luzum, Matthew ; Ollitrault, Jean-Yves	A1	
