trabalhoCompletoEmCongresso	Ihosvany Camps Rodriguez	1998		Temperature dependence of the peak power conversion efficiency for AlGaAs diode lasers	II International Workshop on Optoelectronic Materials and their Applications (including Solar Cells)	Sánchez, M. ; Gómez, A. S. ; Peña, R. ; Escabosa, A. ; Prutskij, T. ; Camps, I. ; González, J. C.		
trabalhoCompletoEmCongresso	Ihosvany Camps Rodriguez	1997		Power conversion efficiency in AlGaAs lasers diodes. Theory and experiment	Symposium on Lasers and Their Applications	Camps, I.; Sánchez, M. ; González, J. C.		
trabalhoCompletoEmCongresso	Ihosvany Camps Rodriguez	1997		Power conversion efficiency in multiquantum well lasers	Nanoestructura'97. Reunión de sistemas de baja dimensionalidad y sus aplicaciones	Camps, I.; Sánchez, M. ; González, J. C.		
trabalhoCompletoEmCongresso	Ihosvany Camps Rodriguez	1995		Influencia de la longitud de la cavidad y la longitud de onda de emisión en la eficiencia de conversión en láseres de AlGaAs	V Encuentro Latinoamericano sobre Óptica	Camps, I.; González, J. C. ; Sánchez, M. ; Días, P. ; Marin, E. ; Prutskij, T.		
resumoExpandidoEmCongresso	Ihosvany Camps Rodriguez	2015	In silico design of new drugs for myeloid leukemia treatment	MOL2NET, International Conference on Multidisciplinary Sciences, 2015, Sciforum.net. Proceedings of MOL2NET, International Conference on Multidisciplinary Sciences. Basel: MDPI	PEREIRA, W. ; Camps, I		
resumoExpandidoEmCongresso	Ihosvany Camps Rodriguez	2008	Influence of conformational polymorphism in the receptor-ligand complex formation	4º Simpósio Brasileiro em Química Medicinal. BrazMedChem 2008, 2008, Porto de Galinhas. PE. 4º Simpósio Brasileiro em Química Medicinal. BrazMedChem 2008. CD-ROM	Mauro, A. ; Camps, I. ; Felipe T. Martins		
resumoExpandidoEmCongresso	Ihosvany Camps Rodriguez	2008	Molecular modeling of prenilated benzophenones extracted from seeds of Rheedia Brasiliensis	4º Simpósio Brasileiro em Química Medicinal. BrazMedChem 2008, 2008, Porto de Galinhas. PE. 4º Simpósio Brasileiro em Química Medicinal. BrazMedChem 2008. CD-ROM	Ellen Silva de Sousa ; Camps, I. ; Marcelo H. dos Santos ; Nelilma Correa Romeiro ; Márcia P. Veloso		
resumoExpandidoEmCongresso	Ihosvany Camps Rodriguez	2008	Powder diffraction analyses of crystalline forms of fluconazole, nimesulidum and mebendazole	4º Simpósio Brasileiro em Química Medicinal. BrazMedChem 2008, 2008, Porto de Galinhas. PE. 4º Simpósio Brasileiro em Química Medicinal. BrazMedChem 2008. CD-ROM	Neves, P. P. ; A. C. Doriguetto ; Simone Vieira Pereira ; Mir, M. ; Camps, I. ; Magali Benjamim de Araujo ; Javier A. Ellena		
