artigoEmPeriodico	 	2024		http://dx.doi.org/10.1007/s13538-024-01429-7	Holographic Phase Transitions in $$(2+1)$$-Dimensional Black Hole Spacetimes in NMG	BRAZILIAN JOURNAL OF PHYSICS	ABDALLA, ELCIO ; de Oliveira, Jeferson ; PAVAN, ALAN BENDASOLI ; PELLICER, CARLOS EDUARDO	A3	
artigoEmPeriodico	 	2024		http://dx.doi.org/10.46298/ocnmp.13294	SKdV, SmKdV flows and their supersymmetric gauge-Miura transformations	Open Communications in Nonlinear Mathematical Physics	ADANS, Y. F. ; AGUIRRE, A. R. ; GOMES, J. F. ; LOBO, G. V. ; ZIMERMAN, A. H.	Qualis nao identificado	OPEN COMMUNICATIONS IN NONLINEAR MATHEMATICAL PHYSICS
artigoEmPeriodico	 	2024		http://dx.doi.org/10.1140/epjc/s10052-024-12671-3	The role of scalar current coupling along surfaces. EUROPEAN PHYSICAL JOURNAL C	PARTICLES AND FIELDS	Barone, F. A.; BORGES, L. H. C. ; FLORES-HIDALGO, G. ; OLIVEIRA, H. L. ; DA SILVA, W. Y. A.	Qualis nao identificado	PARTICLES AND FIELDS
artigoEmPeriodico	 	2024		http://dx.doi.org/10.1016/j.aop.2024.169749	Planar anisotropic CPT-odd systems: A field theoretical approach	ANNALS OF PHYSICS	BORGES, L.H.C. ; FERRARI, A.F. ; DA SILVA, P.H.O. ; Barone, F.A.	A2	
artigoEmPeriodico	 	2024		http://dx.doi.org/10.33448/rsd-v13i1.44786	Jogos educacionais: Impacto transdisciplinar na aprendizagem e divulgação científica	RESEARCH, SOCIETY AND DEVELOPMENT	CARVALHO, CELSO HENRIQUE CORREA ; OLIVEIRA, ADHIMAR FLÁVIO	C	
artigoEmPeriodico	 	2024		http://dx.doi.org/10.1063/5.0205441	Detection of Dirac fermions in capped SnTe film via magnetotransport measurements	Journal Of Applied Physics	CASTRO, S.; Abramof, E. ; RAPPL, P. H. O. ; PERES, Marcelos Lima	A1	
artigoEmPeriodico	 	2024		http://dx.doi.org/10.1093/mnras/stae1626	Chemical evolution models: the role of type Ia supernovae in the α-elements over Iron relative abundances and their variations in time and space	MONTHLY NOTICES OF THE ROYAL ASTRONOMICAL SOCIETY	Cavichia, Oscar; Mollá, M. ; BAZÁN, J J ; CASTRILLO, A. ; GALBANY, L. ; MILLAN-IRIGOYEN, I. ; ASCASIBAR, Y ; DÍAZ, A. ; Monteiro, H.	A1	
artigoEmPeriodico	 	2024		http://dx.doi.org/10.1016/j.aop.2024.169740	Gauge formulation for magnetic monopoles from generalized gauge fields	ANNALS OF PHYSICS	DE OLIVEIRA, G.A. ; BARONE, F.E. ; Barone, F.A. ; HELAYËL-NETO, J.A.	A2	
artigoEmPeriodico	 	2024		http://dx.doi.org/10.1103/PhysRevD.109.024027	Aspects of regular and singular electromagnetic-generalized-quasitopological-gravities black holes in dimensions	PHYSICAL REVIEW D	de Oliveira, Jeferson ; FONTANA, R.'D.'B. ; PAVAN, A.'B.	A1	
artigoEmPeriodico	 	2024		http://dx.doi.org/10.1016/j.jlumin.2024.120499	Suppression of persistent effect and enhancement of photoconductivity in PbTe:CaF2 epitaxial films	JOURNAL OF LUMINESCENCE	DO PRADO, W.P. ; OKAZAKI, A.K. ; VARGAS, L.M.B. ; DA SILVA, M.J. ; CASTRO, S. ; RAPPL, P.H.O. ; ABRAMOF, E. ; PERES, Marcelos Lima	A2	
artigoEmPeriodico	 	2024		http://dx.doi.org/10.1088/1361-6382/ad3609	Breaking the cosmological principle into pieces: a prelude to the intrinsically homogeneous and isotropic spacetimes	Classical and Quantum Gravity	GOMES, L G	A1	
artigoEmPeriodico	 	2024		http://dx.doi.org/10.1016/j.matchemphys.2024.129185	The effect of porous silicon thickness and pore size on the electrical properties of TiO2/PS heterojunctions	MATERIALS CHEMISTRY AND PHYSICS	HUANCA, DANILO R.; LEITE, LUCAS COSTA	A2	
artigoEmPeriodico	 	2024		http://dx.doi.org/10.1016/j.mseb.2023.117122	Efficiency analysis of thermoelectric generators	Materials Science and Engineering B-Advanced Functional Solid-State Materials	IDER, J. ; ASSAHI, F.Y. ; OLIVEIRA, A.F. ; Rubinger, R.M. ; RUBINGER, C.P.L.	Qualis nao identificado	MATERIALS SCIENCE AND ENGINEERING B-ADVANCED FUNCTIONAL SOLID-STATE MATERIALS
artigoEmPeriodico	 	2024		http://dx.doi.org/10.1103/PhysRevD.109.124019	Normal modes and standing waves of scalar field in nonlinear electromagnetic regular anti-de Sitter spacetimes	PHYSICAL REVIEW D	LIN, KAI ; PAVAN, ALAN B. ; ABDALLA, ELCIO	A1	
artigoEmPeriodico	 	2024		http://dx.doi.org/10.1088/1742-5468/ad4e2b	Blackbody heat capacity at constant pressure	JOURNAL OF STATISTICAL MECHANICS-THEORY AND EXPERIMENT	MOREIRA JR, E S	A2	JOURNAL OF STATISTICAL MECHANICS. THEORY AND EXPERIMENT
artigoEmPeriodico	 	2024		http://dx.doi.org/10.1016/j.jece.2024.113267	Core-Sheath Organic-Inorganic Hybrid Electrospun Fibers for Organophosphorus Heterogeneous Catalysis	JOURNAL OF ENVIRONMENTAL CHEMICAL ENGINEERING	NETTO, JORGE FERNANDES Z. ; MIGUEZ, FLÁVIO B. ; BAHIA, SAMARA B.B.B. ; BOLAIS-RAMOS, LUCAS G. ; VERANO-BRAGA, THIAGO ; TRIGUEIRO, JOÃO P.C. ; Nobuyasu, Roberto S. ; BRANDÃO, TIAGO A.S. ; DE SOUSA, FREDERICO B.	A2	
artigoEmPeriodico	 	2024		http://dx.doi.org/10.1016/j.molstruc.2024.138838	COLORIMETRIC SENSOR FOR COPPER AND LEAD USING SILVER NANOPARTICLES FUNCTIONALIZED WITH FLUORESCEINAMINE ISOMER I	JOURNAL OF MOLECULAR STRUCTURE	PILAQUINGA, FERNANDA ; MIGUEZ, FLÁVIO B. ; Nobuyasu, Roberto S. ; CAICHO-CARANQUI, JHONNY ; DE SOUSA, FREDERICO B. ; MOREY, JERONI ; DE LAS NIEVES PIÑA, MARÍA ; CHUISACA, ESTHEFANÍA ; BORRERO, LUIS ; ALEXIS, FRANK	A3	
artigoEmPeriodico	 	2024		http://dx.doi.org/10.1016/j.matchemphys.2024.129213	Development of an automated and cost-effective apparatus for sol-gel solution deposition using spray coating technique and its application for TiO 2 -based photocatalytic films	MATERIALS CHEMISTRY AND PHYSICS	PINTON, JOÃO HENRIQUE B. ; OLIVEIRA, ADHIMAR FLÁVIO ; Huanca, Danilo Roque ; MOHALLEM, NELCY D.S.	A2	
artigoEmPeriodico	 	2024		http://dx.doi.org/10.3847/1538-3881/ad36bf	First Detection of Outflowing Gas in the Outskirts of the Broad-line Region in 1H 0707−495*	ASTRONOMICAL JOURNAL	Rodríguez-Ardila, Alberto; FONSECA-FARIA, MARCOS ANTONIO ; DIAS DOS SANTOS, DENIMARA ; PANDA, SWAYAMTRUPTA ; MARINELLO, MURILO	A1	THE ASTRONOMICAL JOURNAL
artigoEmPeriodico	 	2024		http://dx.doi.org/10.33448/rsd-v13i2.45182	Desenvolvimento do experimento Túnel de Vento para o ensino interdisciplinar de Ciências	RESEARCH, SOCIETY AND DEVELOPMENT	SANTOS, CAROLYNE AUGUSTO DOS ; OLIVEIRA, ADHIMAR FLÁVIO	C	
artigoEmPeriodico	 	2024		http://dx.doi.org/10.3390/coatings14040510	Exploring Na doping in ZnO Thin Films: Electrical and Optical Insights	Coatings	SILVA, ANA LUIZA C. ; VARGAS, LUIS M. B. ; Peres, Marcelos L. ; TEODORO, MARCIO D. ; DE GODOY, MARCIO P. F.	A4	
artigoEmPeriodico	 	2024		http://dx.doi.org/10.37156/RELEA/2024.37.7	Um jogo digital que apresenta a origem dos elementos químicos	REVISTA LATINO-AMERICANA DE EDUCAÇÃO EM ASTRONOMIA	SIQUEIRA, C. C. ; OLIVEIRA, A.F. ; Newton Figueiredo ; SILVA, M. R. A. ; FARIA, M. A. F.	A3	
artigoEmPeriodico	 	2024		http://dx.doi.org/10.1016/j.tsf.2024.140423	Comparative Analysis of Phase Coherence Length in Polycrystalline CdO Films on Two Distinct Substrates	THIN SOLID FILMS	VARGAS, L.M.B. ; BOLAÑOS, K. ; DA SILVA, M.J. ; CASTRO, S. ; PERES, Marcelos Lima ; DE GODOY, M.P.F.	A2	
artigoEmPeriodico	 	2024		http://dx.doi.org/10.1051/0004-6361/202348172	UV FeII emission model of HE 0413−4031 and its relation to broad-line time delays	ASTRONOMY & ASTROPHYSICS	ZAJAč ; PANDA, SWAYAMTRUPTA ; PANDEY, ASHWANI ; PRINCE, RAJ ; Rodríguez-Ardila, Alberto ; JAISWAL, VIKRAM ; CZERNY, BO'ENA ; HRYNIEWICZ, KRZYSZTOF ; URBANOWICZ, MACIEJ ; TRZCIONKOWSKI, PIOTR ; 'NIEGOWSKA, MARZENA ; FA'KOWSKA, ZUZANNA ; MARTÍNEZ-ALDAMA, MARY LOLI ; WERNER, NORBERT	A1	
artigoEmPeriodico	 	2023		http://dx.doi.org/10.1093/mnras/stad2291	Revisiting the mass of open clusters with Gaia data	MONTHLY NOTICES OF THE ROYAL ASTRONOMICAL SOCIETY	ALMEIDA, ANDERSON ; Monteiro, Hektor ; DIAS, WILTON S	A1	
artigoEmPeriodico	 	2023		http://dx.doi.org/10.1093/mnras/stad3531	A phenomenological wobbling model for isolated pulsars and the braking index	MONTHLY NOTICES OF THE ROYAL ASTRONOMICAL SOCIETY	ARAUJO, E C A ; DE LORENCI, V A ; PETER, P ; RUIZ, L S	A1	
artigoEmPeriodico	 	2023		http://dx.doi.org/10.3390/ma16124480	Comparative Study of Corrosion Behaviors of WC-NiMo and WC-Co Cemented Carbides	Materials	BALBINO, NÁDIA ALVES NERY ; CORRÊA, EDMILSON OTONI ; Huanca, Danilo Roque ; DE FREITAS MATOS, FLÁVIO AMAURY ; DE CARVALHO VALERIANO, LIVIO	A3	
artigoEmPeriodico	 	2023		http://dx.doi.org/10.1093/mnras/stad1148	Digging deeper into NGC 6868 I: Stellar population	MONTHLY NOTICES OF THE ROYAL ASTRONOMICAL SOCIETY	BENEDETTI, JOÃO P V ; Riffel, Rogério ; RICCI, TIAGO ; TREVISAN, MARINA ; RIFFEL, ROGEMAR A ; PASTORIZA, MIRIANI ; DAHMER-HAHN, LUIS G ; RUSCHEL-DUTRA, DANIEL ; Rodríguez-Ardila, Alberto ; HERNANDEZ-JIMENEZ, JOSE A ; STEINER, JOÃO	A1	
artigoEmPeriodico	 	2023		http://dx.doi.org/10.1088/1751-8121/acd48a	Light propagation in ( 2+1 )-dimensional electrodynamics: the case of nonlinear constitutive laws	Journal of Physics A-Mathematical and Theoretical	BITTENCOURT, EDUARDO; BRANDÃO, ELLITON O S ; GOULART, ÉRICO	A2	JOURNAL OF PHYSICS A: MATHEMATICAL AND THEORETICAL
artigoEmPeriodico	 	2023		http://dx.doi.org/10.1088/1475-7516/2023/12/037	Feasibility of singularity avoidance for a collapsing object due to a scalar field	JOURNAL OF COSMOLOGY AND ASTROPARTICLE PHYSICS	BITTENCOURT, EDUARDO; CESAR, ALAN G. ; PEREIRA, JONAS P.	A1	
artigoEmPeriodico	 	2023		http://dx.doi.org/10.1088/1361-6382/acf9d7	From disformal electrodynamics to exotic spacetime singularities	CLASSICAL AND QUANTUM GRAVITY	BITTENCOURT, EDUARDO; FERNANDES, RICARDO ; GOULART, ÉRICO ; OTTONI, JOSÉ ELOY	A1	
artigoEmPeriodico	 	2023		http://dx.doi.org/10.1016/j.aop.2023.169375	Anisotropic motion of an electric dipole in a photon gas near a flat conducting boundary	ANNALS OF PHYSICS	CAMARGO, G.H.S. ; DE LORENCI, V.A. ; FERREIRA, A.L. ; RIBEIRO, C.C.H.	A2	
artigoEmPeriodico	 	2023		http://dx.doi.org/10.1093/mnras/stad097	The multizone chemical evolution of the Galactic bulge: predicting abundances for different radial zones	MONTHLY NOTICES OF THE ROYAL ASTRONOMICAL SOCIETY	CAVICHIA, O; MOLLÁ, M ; BAZÁN, J J	A1	
artigoEmPeriodico	 	2023		http://dx.doi.org/10.1093/mnras/stad1908	Coronal line forest AGN - II	Analysis of the spectral energy distribution. MONTHLY NOTICES OF THE ROYAL ASTRONOMICAL SOCIETY	CERQUEIRA-CAMPOS, F C ; RODRÍGUEZ-ARDILA, A ; PANDA, S ; RIFFEL, R ; DAHMER-HAHN, L G ; MARINELLO, M	Qualis nao identificado	ANALYSIS OF THE SPECTRAL ENERGY DISTRIBUTION. MONTHLY NOTICES OF THE ROYAL ASTRONOMICAL SOCIETY
artigoEmPeriodico	 	2023		http://dx.doi.org/10.1093/mnras/stad1774	A decade of near-infrared variability in NGC4388: insights into the AGN structure	MONTHLY NOTICES OF THE ROYAL ASTRONOMICAL SOCIETY	DAHMER-HAHN, LUIS G ; Rodríguez-Ardila, Alberto ; BIANCHIN, MARINA ; RIFFEL, ROGEMAR A ; Riffel, Rogério ; STORCHI-BERGMANN, THAISA ; HAO, LEI	A1	
artigoEmPeriodico	 	2023		http://dx.doi.org/10.3847/2041-8213/ace974	First Observation of a Double-peaked O i Emission in the Near-infrared Spectrum of an Active Galaxy	Astrophysical Journal Letters	DIAS DOS SANTOS, DENIMARA ; Rodríguez-Ardila, Alberto ; PANDA, SWAYAMTRUPTA ; MARINELLO, MURILO	A1	
artigoEmPeriodico	 	2023		http://dx.doi.org/10.1140/epjc/s10052-023-11364-7	Do isotropic tidal forces imply isotropic cosmic expansion?. EUROPEAN PHYSICAL JOURNAL C	PARTICLES AND FIELDS	DIAS, FABIO SCALCO ; GOMES, LEANDRO GUSTAVO ; MELLO, LUIS FERNANDO	Qualis nao identificado	PARTICLES AND FIELDS
artigoEmPeriodico	 	2023		http://dx.doi.org/10.1016/j.physa.2023.128702	Thermodynamics of a charged relativistic ideal Boltzmann gas	PHYSICA A-STATISTICAL MECHANICS AND ITS APPLICATIONS	FELIX, C.P. ; MOREIRA, E.S.	Qualis nao identificado	PHYSICA A-STATISTICAL MECHANICS AND ITS APPLICATIONS
artigoEmPeriodico	 	2023		http://dx.doi.org/10.1093/mnras/stad1871	Physical conditions and extension of the coronal line region in IC 5063	MONTHLY NOTICES OF THE ROYAL ASTRONOMICAL SOCIETY	FONSECA-FARIA, M A ; RODRÍGUEZ-ARDILA, A ; CONTINI, M ; DAHMER-HAHN, L G ; MORGANTI, R	A1	
artigoEmPeriodico	 	2023		http://dx.doi.org/10.29327/227610	O lifter como experimento didático sobre propriedades elétricas	Revista Científic@ Universitas	GAMA, A. B. P. ; OLIVEIRA, A.F. ; Agenor Pina	A3	
artigoEmPeriodico	 	2023		http://dx.doi.org/10.1016/j.saa.2023.122437	Photoluminescent ellipsometric circular dichroism	SPECTROCHIMICA ACTA PART A-MOLECULAR AND BIOMOLECULAR SPECTROSCOPY	GONÇALVES DALKIRANIS, GUSTAVO ; COSTA BASÍLIO, FERNANDO ; Nobuyasu, Roberto S. ; DE FÁTIMA CURCINO DA SILVA, SILÉSIA ; LUCIA DIAS NOGUEIRA, SANDRA ; MOREIRA THERÉZIO, ERALCI ; SEREIN-SPIRAU, FRANÇOISE ; SILVA, RAIGNA A. ; Marletta, Alexandre	A1	SPECTROCHIMICA ACTA. PART A, MOLECULAR AND BIOMOLECULAR SPECTROSCOPY
artigoEmPeriodico	 	2023		http://dx.doi.org/10.1016/j.mseb.2023.116733	Optical and structural characterization of one-dimensional porous silicon photonic crystals made in single and double electrochemical cells: Study on the back contact effect	Materials Science and Engineering B-Advanced Functional Solid-State Materials	Huanca, Danilo Roque	Qualis nao identificado	MATERIALS SCIENCE AND ENGINEERING B-ADVANCED FUNCTIONAL SOLID-STATE MATERIALS
artigoEmPeriodico	 	2023		http://dx.doi.org/10.1093/mnras/stad1055	Analysis of integral field spectroscopy observations of the planetary nebula Hen 2-108 and its central star	MONTHLY NOTICES OF THE ROYAL ASTRONOMICAL SOCIETY	MIRANDA MARQUES, BÁRBARA L ; Monteiro, Hektor ; ALEMAN, ISABEL ; AKRAS, STAVROS ; TODT, HELGE ; CORRADI, ROMANO L M	A1	
artigoEmPeriodico	 	2023		http://dx.doi.org/10.3847/1538-4365/ac9f3e	Powerful Yet Lonely: Is 3C 297 a High-redshift Fossil Group?	ASTROPHYSICAL JOURNAL SUPPLEMENT SERIES	MISSAGLIA, VALENTINA ; MADRID, JUAN P. ; SCHIRMER, MISCHA ; MASSARO, FRANCESCO ; Rodríguez-Ardila, Alberto ; DONZELLI, CARLOS J. ; VALENCIA, MARTELL ; PAGGI, ALESSANDRO ; KRAFT, RALPH P. ; STUARDI, CHIARA ; WILKES, BELINDA J.	A1	ASTROPHYSICAL JOURNAL. SUPPLEMENT SERIES
artigoEmPeriodico	 	2023		http://dx.doi.org/10.1088/1742-5468/acd8b5	Blackbody thermodynamics in the presence of Casimir?s effect	JOURNAL OF STATISTICAL MECHANICS-THEORY AND EXPERIMENT	MOREIRA JR, E S; DA SILVA, HEITOR	A2	JOURNAL OF STATISTICAL MECHANICS. THEORY AND EXPERIMENT
artigoEmPeriodico	 	2023		http://dx.doi.org/10.1103/PhysRevD.108.105018	Boundary effects on the thermal stability of a black hole at the center of a conducting spherical shell	PHYSICAL REVIEW D	MOREIRA, E.'S	A1	
artigoEmPeriodico	 	2023		http://dx.doi.org/10.1093/mnras/stad1827	The VISCACHA survey - VII	Assembly history of the Magellanic Bridge and SMC Wing from star clusters. MONTHLY NOTICES OF THE ROYAL ASTRONOMICAL SOCIETY	OLIVEIRA, R A P ; MAIA, F F S ; BARBUY, B ; DIAS, B ; SANTOS, J F C ; SOUZA, S O ; KERBER, L O ; BICA, E ; SANMARTIM, D ; QUINT, B ; FRAGA, L ; ARMOND, T ; MINNITI, D ; PARISI, M C ; KATIME SANTRICH, O J ; ANGELO, M S ; PÉREZ-VILLEGAS, A ; DE BÓRTOLI, B J	Qualis nao identificado	ASSEMBLY HISTORY OF THE MAGELLANIC BRIDGE AND SMC WING FROM STAR CLUSTERS. MONTHLY NOTICES OF THE ROYAL ASTRONOMICAL SOCIETY
artigoEmPeriodico	 	2023		http://dx.doi.org/10.3390/universe9120492	Spectral Variability Studies in Active Galactic Nuclei: Exploring Continuum and Emission Line Regions in the Age of LSST and JWST	UNIVERSE	PANDA, SWAYAMTRUPTA ; MARZIANI, PAOLA ; CZERNY, BO'ENA ; Rodríguez-Ardila, Alberto ; POZO NUÑEZ, FRANCISCO	B1	
artigoEmPeriodico	 	2023		http://dx.doi.org/10.1016/j.molstruc.2023.135899	Synthesis by microwave irradiation of new pyrazole-imidazoline-pyrimidine analogs: Physicochemical and photophysical properties and their biological activity against Trypanosoma cruzi	JOURNAL OF MOLECULAR STRUCTURE	PEREIRA, CYNTHIA NATHALIA ; ROSA, JOSÉ OTÁVIO ; LARA, LEONARDO DA SILVA ; ORLANDO, LORRAINE MARTINS ROCHA ; FIGUEIREDO, NATHÁLIA DA SILVA ; PEREIRA, MIRIAN CLAUDIA DE SOUZA ; Junior, Roberto Shigueru Nobuyasu ; SANTOS, MAURÍCIO SILVA DOS	A3	
artigoEmPeriodico	 	2023		http://dx.doi.org/10.1590/0104-1428.20220102	Synergistic electrochemical method to prepare graphene oxide/polyaniline nanocomposite	Polímeros: ciência e Tecnologia	PEREIRA, ERIC LUIZ ; GAMA, ANDERSON ; GONZÁLEZ, MARIA ELENA LEYVA ; OLIVEIRA, ADHIMAR FLÁVIO	A3	
artigoEmPeriodico	 	2023		http://dx.doi.org/10.3390/en16207019	Higher Electrical Conductivity of Functionalized Graphene Oxide Doped with Silver and Copper (II) Ions	Energies	PEREIRA, NELSON GUSTAVO ALVES ; GONZALÉZ, MARIA ELENA LEYVA ; QUEIROZ, ALVARO ANTONIO ALENCAR DE ; OLIVEIRA, ADHIMAR FLÁVIO ; TAVARES WANDERLEY NETO, ESTÁCIO	A2	
artigoEmPeriodico	 	2023		http://dx.doi.org/10.1103/physrevd.107.076007	Quantum vacuum fluctuations near a partially reflecting boundary: Brownian motion of a test charge as probe	PHYSICAL REVIEW D	RIBEIRO, CAIO C. HOLANDA ; De Lorenci, Vitorio A.	A1	
artigoEmPeriodico	 	2023		http://dx.doi.org/10.1093/mnras/stad599	The AGNIFS survey: spatially resolved observations of hot molecular and ionized outflows in nearby active galaxies	MONTHLY NOTICES OF THE ROYAL ASTRONOMICAL SOCIETY	RIFFEL, R A ; STORCHI-BERGMANN, T ; RIFFEL, R ; BIANCHIN, M ; ZAKAMSKA, N L ; RUSCHEL-DUTRA, D ; BENTZ, M C ; BURTSCHER, L ; CRENSHAW, D M ; DAHMER-HAHN, L G ; DAMETTO, N Z ; DAVIES, R I ; DINIZ, M R ; FISCHER, T C ; HARRISON, C M ; MAINIERI, V ; REVALSKI, M ; RODRIGUEZ-ARDILA, A ; ROSARIO, D J ; SCHÖNELL, A J	A1	
artigoEmPeriodico	 	2023		http://dx.doi.org/10.1093/mnras/stad3872	The narrow-line region properties of ESO 138-G001 unveiled by SOAR/SIFS observations	MONTHLY NOTICES OF THE ROYAL ASTRONOMICAL SOCIETY	RODRÍGUEZ-ARDILA, A; MAY, D ; PANDA, S ; FONSECA-FARIA, M A ; FRAGA, L	A1	
artigoEmPeriodico	 	2023		http://dx.doi.org/10.3847/2041-8213/ad07e6	VVV-WIT-12 and Its Fashionable Nebula: A 4 yr Long-period Young Stellar Object with a Light Echo?	Astrophysical Journal Letters	SAITO, ROBERTO K. ; STECKLUM, BRINGFRIED ; MINNITI, DANTE ; LUCAS, PHILIP W. ; GUO, ZHEN ; SMITH, LEIGH C. ; FRAGA, LUCIANO ; NAVARETE, FELIPE ; BEAMÍN, JUAN CARLOS ; MORRIS, CALUM	A1	
artigoEmPeriodico	 	2023		http://dx.doi.org/10.1051/0004-6361/202346648	The VISCACHA survey	VIII. Chemical evolution history of the Small Magellanic Cloud west halo clusters. ASTRONOMY & ASTROPHYSICS	SAROON, S. ; DIAS, BRUNO ; TSUJIMOTO, TAKUJI ; PARISI, M.C. ; MAIA, FRANCISCO ; KERBER, LEANDRO ; BEKKI, KENJI ; MINNITI, DANTE ; OLIVEIRA, R.A.P. ; WESTERA, P. ; KATIME SANTRICH, ORLANDO J. ; BICA, EDUARDO ; SANMARTIM, DAVID ; CORREA QUINT, BRUNO ; FRAGA, LUCIANO	Qualis nao identificado	VIII. CHEMICAL EVOLUTION HISTORY OF THE SMALL MAGELLANIC CLOUD WEST HALO CLUSTERS. ASTRONOMY & ASTROPHYSICS
artigoEmPeriodico	 	2023		http://dx.doi.org/10.1063/5.0122729	Weak localization effect in Zn 1− x Cd x O/CdO heterostructures	Journal Of Applied Physics	VARGAS, L. M. B. ; BOLAÑOS, K. ; DA SILVA, M. J. ; CASTRO, S. ; PERES, Marcelos Lima ; DE GODOY, M. P. F.	A1	
artigoEmPeriodico	 	2023		http://dx.doi.org/10.1016/j.jlumin.2023.119873	Fast and broadband photoresponse in CdO thin film	JOURNAL OF LUMINESCENCE	VARGAS, L.M.B. ; DA SILVA, M.J. ; CASTRO, S.DE ; SILVA, A.L.C. ; PAIVA, A.B. ; TEODORO, M.D. ; DE GODOY, M.P.F. ; SOARES, D.A.W. ; PERES, M.L.	A2	
artigoEmPeriodico	 	2023		http://dx.doi.org/10.1016/j.matchemphys.2023.128070	Thickness and porosity characterization in porous silicon photonic crystals: The etch-stop effect	MATERIALS CHEMISTRY AND PHYSICS	VILLANUEVA, JACKELYNE L.M. ; HUANCA, DANILO R. ; OLIVEIRA, ADHIMAR F.	A2	
artigoEmPeriodico	 	2023		http://dx.doi.org/10.1016/j.sna.2023.114784	One-dimensional porous silicon photonic crystals for chemosensors: Geometrical factors influencing the sensitivity	SENSORS AND ACTUATORS A-PHYSICAL	VILLANUEVA, JACKELYNE L.M. ; HUANCA, DANILO. R. ; OLIVEIRA, ADHIMAR F.	A1	SENSORS AND ACTUATORS. A, PHYSICAL
artigoEmPeriodico	 	2022		http://dx.doi.org/10.1140/epjc/s10052-022-10952-3	Spin-1/2 -bosons- with mass dimension 3/2 and fermions with mass dimension 1 cannot represent physical particle states. EUROPEAN PHYSICAL JOURNAL C	PARTICLES AND FIELDS	Aguirre, A. R.; CHAICHIAN, M. M. ; E SILVA, B. A. COUTO ; SÁNCHEZ-VEGA, B. L.	Qualis nao identificado	PARTICLES AND FIELDS
artigoEmPeriodico	 	2022		http://dx.doi.org/10.1093/mnras/stac632	Spectroscopic analysis tool for intEgraL fieLd unIt daTacubEs ( satellite ): case studies of NGC 7009 and NGC 6778 with MUSE	MONTHLY NOTICES OF THE ROYAL ASTRONOMICAL SOCIETY	AKRAS, S ; MONTEIRO, H ; WALSH, J R ; GARCÍA-ROJAS, J ; ALEMAN, I ; BOFFIN, H ; BOUMIS, P ; CHIOTELLIS, A ; CORRADI, R M L ; GONÇALVES, D R ; GUTIÉRREZ-SOTO, L A ; JONES, D ; MORISSET, C ; PAPANIKOLAOU, X	A1	
artigoEmPeriodico	 	2022		http://dx.doi.org/10.22201/ia.01851101p.2022.58.01.11	TEMPERATURE DISCREPANCY WITH PHOTOIONIZATION MODELS OF THE NARROW-LINE REGION	REVISTA MEXICANA DE ASTRONOMIA Y ASTROFISICA	BINETTE, L. ; VILLAR MARTÍN, M. ; MAGRIS C., G. ; MARTÍNEZ-PAREDES, M. ; ALARIE, A. ; RODRÍGUEZ ARDILA, A. ; VILLICAÑA-PEDRAZA, I.	A4	REVISTA MEXICANA DE ASTRONOMÍA Y ASTROFÍSICA
artigoEmPeriodico	 	2022		http://dx.doi.org/10.1088/1361-6382/ac96c3	On the intrinsically flat cosmological models in a lattice	CLASSICAL AND QUANTUM GRAVITY	BITTENCOURT, EDUARDO; GOMES, LEANDRO GUSTAVO ; SANTOS, GRASIELE BATISTA	A1	
artigoEmPeriodico	 	2022		http://dx.doi.org/10.1016/j.physe.2022.115458	Light-induced Shubnikov-de Haas oscillations and evidence of Dirac Fermions in n-type PbTe single quantum well	PHYSICA E-LOW-DIMENSIONAL SYSTEMS & NANOSTRUCTURES	BOLAÑOS, K. ; CASTRO, S. ; RAPPL, P.H.O. ; ABRAMOF, E. ; PERES, Marcelos Lima	A3	PHYSICA E. LOW-DIMENSIONAL SYSTEMS AND NANOSTRUCTURES
artigoEmPeriodico	 	2022		http://dx.doi.org/10.1103/PhysRevD.105.025008	Higher order derivatives extension of Maxwell-Chern-Simons electrodynamics in the presence of field sources and material boundaries	PHYSICAL REVIEW D	BORGES, L.'H.'C. ; BARONE, F.'A. ; OLIVEIRA, H.'L.	A1	
artigoEmPeriodico	 	2022		http://dx.doi.org/10.1016/j.physletb.2021.136759	Features of planar Lee-Wick electrodynamics	PHYSICS LETTERS B	BORGES, L.H.C. ; Barone, F.A.	A2	PHYSICS LETTERS. B
artigoEmPeriodico	 	2022		http://dx.doi.org/10.1063/5.0088499	Weak antilocalization effect and multi-channel transport in SnTe quantum well	Applied Physics Letters (on-line)	CASTRO, S.; KAWATA, B. ; LOPES, G. R. F. ; RAPPL, P. H. DE O. ; ABRAMOF, E. ; PERES, Marcelos Lima	A1	
artigoEmPeriodico	 	2022		http://dx.doi.org/10.1093/mnras/stac3454	A closer look at NGC 7314 nuclear region: a multiwavelength analysis of the Seyfert nucleus and its surroundings	MONTHLY NOTICES OF THE ROYAL ASTRONOMICAL SOCIETY	DA SILVA, PATRÍCIA ; MENEZES, R B ; DÍAZ, Y ; RODRÍGUEZ-ARDILA, A ; LÓPEZ-NAVAS, E ; ARÉVALO, P ; HERNÁNDEZ-GARCÍA, L	A1	
artigoEmPeriodico	 	2022		http://dx.doi.org/10.1103/PhysRevA.105.023530	Aspects of wave propagation in a nonlinear medium: Birefringence and the second-order magnetoelectric coefficients	PHYSICAL REVIEW A	De Lorenci, Vitorio A	A1	
artigoEmPeriodico	 	2022		http://dx.doi.org/10.1038/s41550-022-01845-2	The messy death of a multiple star system and the resulting planetary nebula as observed by JWST	Nature Astronomy	DE MARCO, ORSOLA ; AKASHI, MUHAMMAD ; AKRAS, STAVROS ; ALCOLEA, JAVIER ; ALEMAN, ISABEL ; AMRAM, PHILIPPE ; BALICK, BRUCE ; DE BECK, ELVIRE ; BLACKMAN, ERIC G. ; BOFFIN, HENRI M. J. ; BOUMIS, PANOS ; BUBLITZ, JESSE ; BUCCIARELLI, BEATRICE ; BUJARRABAL, VALENTIN ; CAMI, JAN ; CHORNAY, NICHOLAS ; CHU, YOU-HUA ; CORRADI, ROMANO L. M. ; FRANK, ADAM ; MONTEIRO, H.	A1	
artigoEmPeriodico	 	2022		http://dx.doi.org/10.1063/5.0097470	Temperature, detriment or advantage for memory emergence: the case of ZnO	Journal Of Chemical Physics	DE PAIVA, ALINE BASTOS ; SILVA, RAFAEL SCHIO WENGENROTH ; DE GODOY, MARCIO PERON FRANCO ; VARGAS, LUIS MIGUEL BOLAÑOS ; PERES, Marcelos Lima ; SOARES, DEMETRIO A. WERNER ; LOPEZ-RICHARD, VICTOR	A2	
artigoEmPeriodico	 	2022		http://dx.doi.org/10.3390/surfaces5010014	The Negative Photoconductivity of Ag/AgO Grown by Spray-Pyrolysis	Surfaces	DE PAIVA, ALINE BASTOS ; VARGAS, LUIS MIGUEL BOLAÑOS ; DA SILVA, MATHEUS JOSÉ ; RODRIGUES, ARIANO DE GIOVANNI ; SOARES, DEMÉTRIO A. W. ; PERES, Marcelos Lima ; DE GODOY, MARCIO PERON FRANCO	Qualis nao identificado	SURFACES
artigoEmPeriodico	 	2022		http://dx.doi.org/10.3847/1538-4365/ac5b66	BASS	XXVIII. Near-infrared Data Release 2: High-ionization and Broad Lines in Active Galactic Nuclei*. ASTROPHYSICAL JOURNAL SUPPLEMENT SERIES	DEN BROK, JAKOB S. ; KOSS, MICHAEL J. ; TRAKHTENBROT, BENNY ; STERN, DANIEL ; CANTALUPO, SEBASTIANO ; LAMPERTI, ISABELLA ; RICCI, FEDERICA ; RICCI, CLAUDIO ; OH, KYUSEOK ; BAUER, FRANZ E. ; RIFFEL, ROGERIO ; Rodríguez-Ardila, Alberto ; BÄR, RUDOLF ; HARRISON, FIONA ; ICHIKAWA, KOHEI ; MEJÍA-RESTREPO, JULIAN E. ; MUSHOTZKY, RICHARD ; POWELL, MEREDITH C. ; BOISSAY-MALAQUIN, ROZENN ; STALEVSKI, MARKO	Qualis nao identificado	XXVIII. NEAR-INFRARED DATA RELEASE 2: HIGH-IONIZATION AND BROAD LINES IN ACTIVE GALACTIC NUCLEI*. ASTROPHYSICAL JOURNAL SUPPLEMENT SERIES
artigoEmPeriodico	 	2022		http://dx.doi.org/10.1142/s0218271822500493	The power-law dependence between the matter-radiation and Hubble anisotropies	INTERNATIONAL JOURNAL OF MODERN PHYSICS D	Dias, F. S. ; SANTOS, G. B. ; GOMES, L. G. ; MELLO, L. F.	A3	
artigoEmPeriodico	 	2022		http://dx.doi.org/10.33448/rsd-v11i6.28383	Uma análise das investigações históricas sobre a luz e o entendimento das cores	RESEARCH, SOCIETY AND DEVELOPMENT	DIAS, RANULFO DA SILVA ; OLIVEIRA, ADHIMAR FLÁVIO	C	
artigoEmPeriodico	 	2022		http://dx.doi.org/10.1093/mnras/stac718	58 open clusters investigated with UBVRI and Gaia eDR3 data	MONTHLY NOTICES OF THE ROYAL ASTRONOMICAL SOCIETY	DIAS, W S ; MONTEIRO, H ; CAETANO, T ; HICKEL, G ; ALVES, G ; SACCHI, M ; LÉPINE, J R D ; AMARINHO, N	A1	
