artigoEmPeriodico	 	2007		http://dx.doi.org/10.1016/j.snb.2006.07.019	Sulfonated polystyrene polymer humidity sensor: synthesis and characterization. Sensors and Actuators	B, Chemical, Estados Unidos	RUBINGER, C. P. L.; MARTINS, C. R ; De PAOLI, M-A ; Rubinger, R.M.	Qualis nao identificado	B, CHEMICAL, ESTADOS UNIDOS
artigoEmPeriodico	 	2007		http://dx.doi.org/10.1155/2007/83893	Inductorless Chua?s circuit: experimental time series analysis	Mathematical Problems in Engineering	Rubinger, R.M. ; NASCIMENTO, André Wagner Mota ; MELLO, L.F.O. ; RUBINGER, C. P. L. ; Albuquerque, H. A. ; MANZANARES FILHO, N.	Qualis nao identificado	MATHEMATICAL PROBLEMS IN ENGINEERING
artigoEmPeriodico	 	2006		http://dx.doi.org/10.1016/j.nuclphysb.2006.06.017	Stability and thermodynamics of brane black holes. Nuclear Physics	B	ABDALLA, E ; CUADROSMELGAR, B ; PAVAN, A. B. ; MOLINA, C	Qualis nao identificado	B
artigoEmPeriodico	 	2006		http://dx.doi.org/10.1051/0004-6361:20053149	Whole Earth telescope observations of the ZZ Ceti star HL Tau 76	Astronomy & Astrophysics (Berlin)	et al. ; Dolez, N. ; Vauclair, G. ; Kleinman, S. J. ; Chevreton, M. ; Fu, J. N. ; Solheim, J.-E. ; González Perez, J. M. ; Ulla, A. ; Fraga, L. ; FRAGA, L. ; KANAAN, A. ; Reed, M. ; Kawaler, S. ; O'Brien, M. S. ; Metcalfe, T. S. ; Nather, R. E. ; Sanwal, D. ; Klumpe, E. W. ; Mukadam, A. ; Wood, M. A.	A1	
artigoEmPeriodico	 	2006		http://dx.doi.org/10.1086/505137	Whole Earth Telescope Observations of the Pulsating Subdwarf B Star PG 0014+067	The Astrophysical Journal	et al. ; Vu?kovi?, M. ; Kawaler, S. D. ; O¿Toole, S. ; Csubry, Z. ; Baran, A. ; Zola, S. ; Moskalik, P. ; Klumpe, E. W. ; Riddle, R. ; O¿Brien, M. S. ; Mullally, F. ; Wood, M. A. ; Wilkat, V. ; Zhou, A.?Y. ; Reed, M. D. ; Terndrup, D. M. ; Sullivan, D. J. ; Kim, S.?L. ; Chen, W. P. ; FRAGA, L.	A1	
artigoEmPeriodico	 	2006		http://dx.doi.org/10.1051/0004-6361:20065508	The helium-weak silicon star HR 7224	Astronomy & Astrophysics (Berlin)	LEHMANN, H. ; TSYMBAL, V. ; Mkrtichian, D. E. ; Fraga, L. ; FRAGA, L.	A1	
artigoEmPeriodico	 	2006		http://dx.doi.org/10.1103/physrevd.74.085030	Two field BPS solutions for generalized Lorentz breaking models. Physical Review	D, Particles and Fields (Online)	M. Hott ; A. de Souza Duttra ; F. A. Barone	Qualis nao identificado	D, PARTICLES AND FIELDS
artigoEmPeriodico	 	2006		http://dx.doi.org/10.1086/498676	Ages of White Dwarf-Red Subdwarf Systems	The Astrophysical Journal	MONTEIRO, H.; JAO, W. ; HENRY, T. ; SUBASAVAGE, J. ; BEAULIEU, T.	A1	
artigoEmPeriodico	 	2006		http://dx.doi.org/10.1086/505904	E	; Three-Dimensional Photoionization Structure and Distances of Planetary Nebulae. III. NGC 6781. THE ASTROPHYSICAL JOURNAL	MONTEIRO, H.; SCHWARZ, H	Qualis nao identificado	; THREE-DIMENSIONAL PHOTOIONIZATION STRUCTURE AND DISTANCES OF PLANETARY NEBULAE. III. NGC 6781. THE ASTROPHYSICAL JOURNAL
artigoEmPeriodico	 	2006			Specific heat of a particle on the cone. Physical Review	A	MOREIRA, E. S.; OLIVEIRA, E. S.	Qualis nao identificado	A
artigoEmPeriodico	 	2006			A 0.8-2.4 μm spectral atlas of active galactic nuclei	Astronomy & Astrophysics (Berlin)	RIFFEL, R. ; Rodríguez-Ardila, A. ; PASTORIZA, M. G.	A1	
artigoEmPeriodico	 	2006			The near-infrared spectrum of Mrk 1239: direct evidence of the dusty torus?	Monthly Notices of the Royal Astronomical Society, Edinburgh	Rodríguez-Ardila, A.; MAZZALAY, X.	Qualis nao identificado	MONTHLY NOTICES OF THE ROYAL ASTRONOMICAL SOCIETY, EDINBURGH
artigoEmPeriodico	 	2006			Outflows of Very Ionized Gas in the Centers of Seyfert Galaxies: Kinematics and Physical Conditions	The Astrophysical Journal	Rodríguez-Ardila, A.; PRIETO, A. ; VIEGAS, S. ; GRUENWALD, R.	A1	
artigoEmPeriodico	 	2006		http://dx.doi.org/10.1016/j.apsusc.2005.12.096	Langmuir-Blodgett and Langmuir-Schaefer films of poly(5-amino-1-naphthol) conjugated polymers	APPLIED SURFACE SCIENCE, Estados Unidos	RUBINGER, C. P. L.; MOREIRA, R. L. ; CURY, L. A. ; FONTES, G. N. ; NEVES, B. R. A. ; FERREIRA, C. A. ; MENEGUZZI, A.	Qualis nao identificado	APPLIED SURFACE SCIENCE, ESTADOS UNIDOS
artigoEmPeriodico	 	2006		http://dx.doi.org/10.1590/S0103-97332006000300004	Variable Range Hopping Conduction in Low-Temperature Molecular Beam Epitaxy GaAs	Brazilian Journal of Physics, São Paulo	Rubinger, R.M. ; Albuquerque, H. A. ; SILVA, Rodrigo Lacerda da ; de OLIVEIRA, A.G. ; Ribeiro, G.M. ; RODRIGUES, Wagner Nunes ; RUBINGER, C. P. L. ; Moreira, M.V.B.	Qualis nao identificado	BRAZILIAN JOURNAL OF PHYSICS, SÃO PAULO
artigoEmPeriodico	 	2006		http://dx.doi.org/10.1088/0268-1242/21/12/030	Temperature dependent activation energy and variable rangehopping in semi-insulating GaAs	Semiconductor Science and Technology	Rubinger, R.M. ; Ribeiro, G.M. ; de OLIVEIRA, A.G. ; Albuquerque, H. A. ; SILVA, Rodrigo Lacerda da ; RUBINGER, C. P. L. ; RODRIGUES, Wagner Nunes ; Moreira, M.V.B.	A2	
artigoEmPeriodico	 	2006		http://dx.doi.org/10.1016/j.physleta.2006.08.011	Aspects of light propagation in anisotropic dielectric media	Physics Letters A	V. A. De Lorenci; J. M. Salim	A3	
artigoEmPeriodico	 	2006		http://dx.doi.org/10.1016/j.physleta.2006.04.010	Electromagnetic light rays in local dielectrics. Physics Letters	A (Print)	V. A. De Lorenci; R. Klippert	Qualis nao identificado	A
artigoEmPeriodico	 	2005		http://dx.doi.org/10.1051/0004-6361:20041125	Whole Earth Telescope observations of BPM?37093: A?seismologicaltest of crystallization theory in white dwarfs	Astronomy & Astrophysics (Berlin)	et al. ; KANAAN, A. ; NITTA, A. ; Winget, D. E. ; KEPLER, S. O. ; Montgomery, M. H. ; Metcalfe, T. S. ; OLIVEIRA, H. ; Fraga, L. ; FRAGA, L. ; da Costa, A. F. M. ; Costa, J. E. S. ; Castanheira, B. G. ; Giovannini, O. ; Nather, R. E. ; Mukadam, A. ; Kawaler, S. D. ; O'Brien, M. S. ; Reed, M. D. ; Kleinman, S. J. ; Provencal, J. L.	A1	
artigoEmPeriodico	 	2005		http://dx.doi.org/10.1111/j.1365-2966.2005.08807.x	Pushing the ground-based limit: 14-mumag photometric precision with the definitive Whole Earth Telescope asteroseismic data set for the rapidly oscillating Ap star HR 1217	Monthly Notices of the Royal Astronomical Society	et al. ; KURTZ, D. W. ; Cameron, C. ; Cunha, M. S. ; Dolez, N. ; Vauclair, G. ; Pallier, E. ; Ulla, A. ; KEPLER, S. O. ; da Costa, A. ; KANAAN, A. ; FRAGA, L. ; Fraga, L. ; Giovannini, O. ; Wood, M. A. ; Silvestri, N. ; Kawaler, S. D. ; Riddle, R. L. ; Reed, M. D. ; Watson, T. K. ; Metcalfe, T. S.	A1	
artigoEmPeriodico	 	2005		http://dx.doi.org/10.1103/PhysRevD.71.067701	Scharnhorst effect for a general two-parameter Lagrangian density. Physical Review. D, Particles and Fields (Online) (Cessou em 2003. Cont. ISSN 1550-2368 Physical Review. D	Particles, Fields, Gravitation, and Cosmol	F. A. Barone; C. Farina	Qualis nao identificado	PARTICLES, FIELDS, GRAVITATION, AND COSMOL
artigoEmPeriodico	 	2005		http://dx.doi.org/10.1103/PhysRevD.72.105012	Casimir effect for gauge scalars: The Kalb-Ramond case	Physical Review D (Particles, Fields, Gravitation and Cosmology)	F. A. Barone; J.A. Helayël-Neto ; L.M. de Moraes	A1	
artigoEmPeriodico	 	2005		http://dx.doi.org/10.1086/426809	Three-Dimensional Photoionization Structure and Distances of Planetary Nebulae. II. Menzel 1	The Astrophysical Journal	MONTEIRO, H.; SCHWARZ, H. E. ; GRUENWALD, Ruth ; GUENTHNER, K. ; HEATHCOTE, S. R.	A1	
artigoEmPeriodico	 	2005			The continuum and narrow-line region of the narrow-line Seyfert 1 galaxy Mrk 766	Monthly Notices of the Royal Astronomical Society, Edinburgh	Rodríguez-Ardila, A.; CONTINI, M. ; VIEGAS, S.	Qualis nao identificado	MONTHLY NOTICES OF THE ROYAL ASTRONOMICAL SOCIETY, EDINBURGH
artigoEmPeriodico	 	2005			Molecular hydrogen and [FeII] in active galactic nuclei - II	Results for Seyfert 2 galaxies. Monthly Notices of the Royal Astronomical Society, Edinburgh	Rodríguez-Ardila, A.; RIFFEL, R. ; PASTORIZA, M. G.	Qualis nao identificado	RESULTS FOR SEYFERT 2 GALAXIES. MONTHLY NOTICES OF THE ROYAL ASTRONOMICAL SOCIETY, EDINBURGH
artigoEmPeriodico	 	2005		http://dx.doi.org/10.1103/PhysRevD.71.024005	Semiclassical back reaction around a cosmic dislocation. Physical Review. D. Particles and fields (Cessou em 2003. Cont. 1550-7998 Physical review	D, Particles, Fields, Gravitation, and Cosmology)	V. A. De Lorenci; R. Klippert ; E. S. Moreira Jr.	Qualis nao identificado	D, PARTICLES, FIELDS, GRAVITATION, AND COSMOLOGY)
artigoEmPeriodico	 	2004		http://dx.doi.org/10.1016/s0920-5632(03)02411-3	Radiative corrections to the Casimir effect for the massive scalar field. Nuclear Physics	B, Proceedings Supplement (Print)	Barone, F.A.; CAVALCANTI, R.M. ; FARINA, C.	Qualis nao identificado	B, PROCEEDINGS SUPPLEMENT
artigoEmPeriodico	 	2004		http://dx.doi.org/10.1086/381523	Proper Motion and Kinematics of the Ansae in NGC 7009	The Astrophysical Journal	MONTEIRO, H.; FERNANDEZ, R. ; SCHWARZ, H. E.	A1	
artigoEmPeriodico	 	2004		http://dx.doi.org/10.1086/421038	Three-Dimensional Photoionization Structure and Distances of Planetary Nebulae. I. NGC 6369	The Astrophysical Journal	MONTEIRO, H.; SCHWARZ, H. E. ; GRUENWALD, Ruth ; HEATHCOTE, S. R.	A1	
artigoEmPeriodico	 	2004			Molecular hydrogen and [Fe II] in Active Galactic Nuclei	Astronomy & Astrophysics (Berlin), Les Ulis, Cedex A	Rodríguez-Ardila, A.; PASTORIZA, M. G. ; VIEGAS, S. ; Sigut, T. A. A. ; Pradhan, A. K.	Qualis nao identificado	ASTRONOMY & ASTROPHYSICS , LES ULIS, CEDEX A
artigoEmPeriodico	 	2004		http://dx.doi.org/10.1016/j.synthmet.2004.04.023	AFM studies of Poly(5-amino-1-naphthol) ultrathinfilms obtained by associating Langmuir-Schaefer and Langmuir-Blodgett methods	SYNTHETIC METALS, Estados Unidos	RUBINGER, C. P. L.; MOREIRA, R. L. ; NEVES, B. R. A. ; CURY, L. A. ; FERREIRA, Carlos Arthur ; MENEGUZZI, Álvaro	Qualis nao identificado	SYNTHETIC METALS, ESTADOS UNIDOS
artigoEmPeriodico	 	2004		http://dx.doi.org/10.1103/PhysRevD.70.047502	Spinning strings, cosmic dislocations, and chronology protection. Physical Review. D. Particles and fields (Cessou em 2003. Cont. 1550-7998 Physical review	D, Particles, Fields, Gravitation, and Cosmology)	V. A. De Lorenci; E. S. Moreira Jr.	Qualis nao identificado	D, PARTICLES, FIELDS, GRAVITATION, AND COSMOLOGY)
artigoEmPeriodico	 	2004		http://dx.doi.org/10.1103/PhysRevD.70.124035	Birefringence in nonlinear anisotropic dielectric media. Physical Review. D. Particles and fields (Cessou em 2003. Cont. 1550-7998 Physical review	D, Particles, Fields, Gravitation, and Cosmology)	V. A. De Lorenci; R. Klippert ; D. H. Teodoro	Qualis nao identificado	D, PARTICLES, FIELDS, GRAVITATION, AND COSMOLOGY)
artigoEmPeriodico	 	2003			The narrow line region of Ark 564	Astronomy & Astrophysics (Berlin), Les Ulis, Cedex A	CONTINI, M. ; Rodríguez-Ardila, A. ; VIEGAS, S.	Qualis nao identificado	ASTRONOMY & ASTROPHYSICS , LES ULIS, CEDEX A
artigoEmPeriodico	 	2003		http://dx.doi.org/10.1142/S0217751X03015507	Lessons from the Casimir Effect on a Spinning Circle	International Journal of Modern Physics A	De Lorenci, V. A.; MOREIRA, E. S.	A4	
artigoEmPeriodico	 	2003		http://dx.doi.org/10.1046/j.1365-8711.2003.06373.x	Amplitude and frequency variability of the pulsating DB white dwarf stars KUV 05134+2605 and PG 1654+160 observed with the Whole Earth Telescope	Monthly Notices of the Royal Astronomical Society	et al. ; Handler, G. ; O'Donoghue, D. ; Muller, M. ; Solheim, J.-E. ; Gonzalez-Perez, J. M. ; Johannessen, F. ; Paparo, M. ; Szeidl, B. ; Viraghalmy, G. ; Silvotti, R. ; Vauclair, G. ; Dolez, N. ; Pallier, E. ; Chevreton, M. ; KURTZ, D. W. ; Bromage, G. E. ; Cunha, M. S. ; Ostensen, R. ; Fraga, L. ; FRAGA, L.	A1	
artigoEmPeriodico	 	2003		http://dx.doi.org/10.1086/377044	Constraining the Evolution of ZZ Ceti	The Astrophysical Journal	et al. ; Mukadam, Anjum S. ; KEPLER, S. O. ; Winget, D. E. ; Nather, R. E. ; Kilic, M. ; Mullally, F. ; von Hippel, T. ; Kleinman, S. J. ; NITTA, A. ; Guzik, J. A. ; Bradley, P. A. ; Matthews, J. ; Sekiguchi, K. ; Sullivan, D. J. ; Sullivan, T. ; Shobbrook, R. R. ; Birch, P. ; Jiang, X. J. ; Xu, D. W. ; FRAGA, L.	A1	
artigoEmPeriodico	 	2003		http://www.scopus.com/scopus/inward/citedby.url?partnerID=bb5nvXTn&rel=R6.0.0&doi=10.1103/physreva.67.022103&md5=686bdf723f2d9d85e249efad0ba579ef	Influence of two parallel plates on atomic levels. Physical Review	A	F. A. Barone; D.T. Alves ; C. Farina ; A.C. Tort	Qualis nao identificado	A
artigoEmPeriodico	 	2003		http://dx.doi.org/10.1119/1.1538573	Three methods for calculating the Feynman propagator	American Journal of Physics	F. A. Barone; H. Boschi-Filho ; C. Farina	A3	
artigoEmPeriodico	 	2003			High Precision with the Whole Earth Telescope: Lessons and Some Results from XCov20 for the roAp Star HR 1217	Baltic Astronomy	KURTZ, D. W. ; et al ; FRAGA, L.	Qualis nao identificado	BALTIC ASTRONOMY
artigoEmPeriodico	 	2003		http://dx.doi.org/10.1088/0264-9381/20/5/306	Analogue black holes in flowing dielectrics	Classical and Quantum Gravity (Print)	M. Novello ; S. Peres Bergliaffa ; J. M. Salim ; V. A. De Lorenci ; R. Klippert	A1	
artigoEmPeriodico	 	2003			Hidden Starburst in Seyfert 1 Galaxies	MONTHLY NOTICES OF THE ROYAL ASTRONOMICAL SOCIETY, Edinburgh	Rodríguez-Ardila, A.; VIEGAS, S.	Qualis nao identificado	MONTHLY NOTICES OF THE ROYAL ASTRONOMICAL SOCIETY, EDINBURGH
artigoEmPeriodico	 	2003			PG 1605+072 in WET XCov22: Support for the Multi Site Spectroscopic Telescope	Baltic Astronomy	Schuh, S. L. et al. ; MONTEIRO, H.	Qualis nao identificado	BALTIC ASTRONOMY
artigoEmPeriodico	 	2003		http://dx.doi.org/10.1103/PhysRevD.67.124002	Renormalized scalar propagator around a dispiration. Physical Review. D. Particles and fields (Cessou em 2003. Cont. 1550-7998 Physical review	D, Particles, Fields, Gravitation, and Cosmology)	V. A. De Lorenci; E. S. Moreira Jr.	Qualis nao identificado	D, PARTICLES, FIELDS, GRAVITATION, AND COSMOLOGY)
artigoEmPeriodico	 	2003		http://dx.doi.org/10.1103/PhysRevD.68.061502	On optical black holes in moving dielectrics	Physical Review. D. Particles and fields (Cessou em 2003. Cont. 1550-7998 Physical review. D, Particles, Fields, Gravitation, and Cosmology)	V. A. De Lorenci; R. Klippert ; Y. N. Obukhov	A1	
artigoEmPeriodico	 	2002			Multicolor photometry of ten Seyfert 1 galaxies	Astronomy & Astrophysics (Berlin), Alemanha	BORIS, N. ; DONZELLI, C. J. ; PASTORIZA, M. G. ; Rodríguez-Ardila, A. ; FERREIRO, D.	Qualis nao identificado	ASTRONOMY & ASTROPHYSICS , ALEMANHA
artigoEmPeriodico	 	2002		http://dx.doi.org/10.1046/j.1365-8711.2002.05294.x	Discovery of the 'missing' mode in HR 1217 by the Whole Earth Telescope	Monthly Notices of the Royal Astronomical Society (Print)	FRAGA, L.; et al. ; KURTZ, D. W. ; Kawaler, S. D. ; Riddle, R. L. ; Reed, M. D. ; Cunha, M. S. ; Wood, M. ; Silvestri, N. ; Watson, T. K. ; Dolez, N. ; Moskalik, P. ; Zola, S. ; Pallier, E. ; Guzik, J. A. ; Metcalfe, T. S. ; Mukadam, A. S. ; Nather, R. E. ; Winget, D. E. ; Sullivan, D. J. ; Sullivan, T.	A1	
artigoEmPeriodico	 	2002			Infrared Fe II Emission in Narrow-Line Seyfert 1 Galaxies	The Astrophysical Journal, Estados Unidos	Rodríguez-Ardila, A.; VIEGAS, S. ; PASTORIZA, M. G. ; PRATO, L.	Qualis nao identificado	THE ASTROPHYSICAL JOURNAL, ESTADOS UNIDOS
artigoEmPeriodico	 	2002			Near-Infrared Coronal Lines in Narrow-Line Seyfert 1 Galaxies	The Astrophysical Journal, Estados Unidos	Rodríguez-Ardila, A.; VIEGAS, S. ; PASTORIZA, M. G. ; PRATO, L.	Qualis nao identificado	THE ASTROPHYSICAL JOURNAL, ESTADOS UNIDOS
artigoEmPeriodico	 	2002			The O I Line Emission in Active Galactic Nuclei Revisited	The Astrophysical Journal, Estados Unidos	Rodríguez-Ardila, A.; VIEGAS, S. ; PASTORIZA, M. G. ; PRATO, L. ; DONZELLI, C. J.	Qualis nao identificado	THE ASTROPHYSICAL JOURNAL, ESTADOS UNIDOS
artigoEmPeriodico	 	2002		http://dx.doi.org/10.1103/PhysRevE.65.026612	A	De Lorenci. Effective geometry for light traveling in material media. Physical Review E. (Cessou em 2000. Cont. 1539-3755 Physical Review. E, Statistical, Nonlinear, and Soft Matter Physics)	V	Qualis nao identificado	DE LORENCI. EFFECTIVE GEOMETRY FOR LIGHT TRAVELING IN MATERIAL MEDIA. PHYSICAL REVIEW E.
artigoEmPeriodico	 	2002		http://dx.doi.org/10.1103/PhysRevD.65.085013	Classical self-forces in a space with a topological defect. Physical Review. D. Particles and fields (Cessou em 2003. Cont. 1550-7998 Physical review	D, Particles, Fields, Gravitation, and Cosmology)	V. A. De Lorenci; E. S. Moreira Jr.	Qualis nao identificado	D, PARTICLES, FIELDS, GRAVITATION, AND COSMOLOGY)
artigoEmPeriodico	 	2002		http://dx.doi.org/10.1103/PhysRevD.65.107503	Vacuum polarization on the spinning circle	Physical Review. D. Particles and fields (Cessou em 2003. Cont. 1550-7998 Physical review. D, Particles, Fields, Gravitation, and Cosmology)	V. A. De Lorenci; E. S. Moreira Jr.	A1	
artigoEmPeriodico	 	2002		http://dx.doi.org/10.1103/PhysRevD.65.064027	Analogue gravity from electrodynamics in nonlinear media. Physical Review. D. Particles and fields (Cessou em 2003. Cont. 1550-7998 Physical review	D, Particles, Fields, Gravitation, and Cosmology)	V. A. De Lorenci; R. Klippert	Qualis nao identificado	D, PARTICLES, FIELDS, GRAVITATION, AND COSMOLOGY)
artigoEmPeriodico	 	2002		http://dx.doi.org/10.1103/PhysRevD.65.063501	Nonlinear electrodynamics and the FRW universes	Physical Review. D. Particles and fields (Cessou em 2003. Cont. 1550-7998 Physical review. D, Particles, Fields, Gravitation, and Cosmology)	V. A. De Lorenci; R. Klippert ; M. Novello ; J. M. Salim	A1	
artigoEmPeriodico	 	2001		http://dx.doi.org/10.1119/1.1326081	Path integral and the induction law	American Journal of Physics	Barone, F. A.; C. Farina	A3	
artigoEmPeriodico	 	2001		http://dx.doi.org/10.1119/1.1311784	The zeta function method and the harmonic oscillator propagator	American Journal of Physics	F. A. Barone; C. Farina	A3	
artigoEmPeriodico	 	2001		http://www.scopus.com/scopus/inward/citedby.url?partnerID=bb5nvXTn&rel=R6.0.0&doi=10.1088/0264-9381/18/1/501&md5=eba652fe6fa3e6bce6378a2d997c4932	The rotating detector and vacuum fluctuations	Classical and Quantum Gravity (Print)	Lorenci, V A De; PAOLA, R D M DE ; SVAITER, N F	A1	
artigoEmPeriodico	 	2001		http://dx.doi.org/10.1103/PhysRevD.63.103516	Non-linear electrodynamics can generate a closed space-like path for photons. Physical Review. D. Particles and fields (Cessou em 2003. Cont. 1550-7998 Physical review	D, Particles, Fields, Gravitation, and Cosmology)	M. Novello ; J. M. Salim ; V. A. De Lorenci ; E. Elbaz	Qualis nao identificado	D, PARTICLES, FIELDS, GRAVITATION, AND COSMOLOGY)
artigoEmPeriodico	 	2001			Thermal fluctuations of a quantized massive scalar field in a Rindler background	Physical Review D	MEDINA, R. ; MOREIRA, E. S.	A1	
artigoEmPeriodico	 	2001			O Espectro de FeII na Região de 1 mu nos Núcleos Ativos de Galáxia. Boletim	Sociedade Astronômica Brasileira, São Paulo	Rodríguez-Ardila, A	Qualis nao identificado	SOCIEDADE ASTRONÔMICA BRASILEIRA, SÃO PAULO
artigoEmPeriodico	 	2001		http://www.scopus.com/scopus/inward/citedby.url?partnerID=bb5nvXTn&rel=R6.0.0&doi=10.1103/physrevd.63.027501&md5=91403d49dda3770c2fb2cca0e1a93826	Remarks on vacuum fluctuations around a spinning cosmic string. Physical Review. D. Particles and fields (Cessou em 2003. Cont. 1550-7998 Physical review	D, Particles, Fields, Gravitation, and Cosmology)	V. A. De Lorenci; E. S. Moreira Jr.	Qualis nao identificado	D, PARTICLES, FIELDS, GRAVITATION, AND COSMOLOGY)
artigoEmPeriodico	 	2001		http://dx.doi.org/10.1016/S0370-2693(01)00588-3	Electromagnetic wave propagation inside a material medium: an effective geometry interpretation. Physics Letters	B (Print)	V. A. De Lorenci; M. A. Souza	Qualis nao identificado	B
artigoEmPeriodico	 	2001		http://dx.doi.org/10.1051/0004-6361:20010089	Dyadosphere bending of light. Astronomy & Astrophysics (Berlin	Print)	V. A. De Lorenci; N. Figueiredo ; H. H. Fliche ; M. Novello	Qualis nao identificado	PRINT)
artigoEmPeriodico	 	2000		http://dx.doi.org/10.1103/PhysRevD.61.045001	Geometrical aspects of light propagation in non linear electrodynamics. Physical Review. D. Particles and fields (Cessou em 2003. Cont. 1550-7998 Physical review	D, Particles, Fields, Gravitation, and Cosmology)	M. Novello ; V. A. De Lorenci ; R. Klippert ; J. M. Salim	Qualis nao identificado	D, PARTICLES, FIELDS, GRAVITATION, AND COSMOLOGY)
artigoEmPeriodico	 	2000		http://dx.doi.org/10.1086/309058	Morphology and Kinematics of Planetary Nebulae. II. A Diabolo Model for NGC 3132	THE ASTROPHYSICAL JOURNAL	MONTEIRO, H.; MORRISET, Cristophe ; GRUENWALD, Ruth ; VIEGAS, Sueli M	A1	
artigoEmPeriodico	 	2000		http://www.scopus.com/scopus/inward/citedby.url?partnerID=bb5nvXTn&rel=R6.0.0&doi=10.1016/s0370-2693(99)01403-3&md5=40e1ca1f598f196ba70766506c739c7b	The radiation era in scalar-tensor cosmology. Physics Letters	B (Print)	R. Klippert ; V. A. De Lorenci ; M. Novello ; J. M. Salim	Qualis nao identificado	B
artigoEmPeriodico	 	2000			The Narrow-Line Region of Narrow-Line Seyfert 1 Galaxies	The Astrophysical Journal, Estados Unidos	Rodríguez-Ardila, A.; BINETTE, L. ; PASTORIZA, M. G. ; DONZELLI, C. J.	Qualis nao identificado	THE ASTROPHYSICAL JOURNAL, ESTADOS UNIDOS
artigoEmPeriodico	 	2000			Visible and near-infrared spectroscopy of Seyfert 1 and narrow-line Seyfert 1 galaxies. The Astrophysical Journal	Supplement Series, Chicago	Rodríguez-Ardila, A.; PASTORIZA, M. G. ; DONZELLI, C. J.	Qualis nao identificado	SUPPLEMENT SERIES, CHICAGO
artigoEmPeriodico	 	2000		http://dx.doi.org/10.1088/0264-9381/17/20/306	The rotating detector and vacuum fluctuations	Classical and Quantum Gravity (Print), Inglaterra	V. A. De Lorenci; R. De Paola ; N. F. Svaiter	Qualis nao identificado	CLASSICAL AND QUANTUM GRAVITY , INGLATERRA
artigoEmPeriodico	 	2000		http://dx.doi.org/10.1016/S0370-2693(00)00522-0	Light propagation in nonlinear electrodynamics. Physics Letters	B (Print)	V. A. De Lorenci; R. Klippert ; M. Novello ; J. M. Salim	Qualis nao identificado	B
artigoEmPeriodico	 	1999			Ambiguity in the evaluation of the effective action on the cone	Physical Review D	IELLICI, D. ; MOREIRA, E. S.	A1	
artigoEmPeriodico	 	1999		http://dx.doi.org/10.1016/S0375-9601(99)00080-8	The Velocity of Gravitational Waves. Physics Letters	A (Print)	M. Novello ; V. A. De Lorenci ; L. R. Freitas ; O. D. Aguiar	Qualis nao identificado	A
artigoEmPeriodico	 	1999		http://dx.doi.org/10.1142/S0217751X9900035X	A rotating quantum vacuum and the depolarization problem in storage rings	International Journal of Modern Physics A	V. A. De Lorenci; N. F. Svaiter	A4	
artigoEmPeriodico	 	1999		http://dx.doi.org/10.1023/A:1018807714794	A Rotating Quantum Vacuum	Foundations of Physics	V. A. De Lorenci; N. F. Svaiter	A4	
artigoEmPeriodico	 	1999		http://dx.doi.org/10.1088/0264-9381/16/10/302	From spinning to non spinning cosmic string spacetime	Classical and Quantum Gravity (Print), IOPublishing	V. A. De Lorenci; R. De Paola ; N. F. Svaiter	Qualis nao identificado	CLASSICAL AND QUANTUM GRAVITY , IOPUBLISHING
artigoEmPeriodico	 	1998			Note on the point-splitting procedure to evaluate vacuum fluctuation in certain cylindrically symmetric backgrounds	Physical Review D	BREVIK, I. ; MATSAS, G. E. A. ; MOREIRA, E. S.	A1	
artigoEmPeriodico	 	1998			Gluon Confinement	Il Nuovo Cimento della Società Italiana di Fisica. B (Testo stampato)	M. Novello ; V. A. De Lorenci ; E. Elbaz	Qualis nao identificado	IL NUOVO CIMENTO DELLA SOCIETÀ ITALIANA DI FISICA. B
artigoEmPeriodico	 	1998		http://dx.doi.org/10.1142/S0217751X98002183	Some Aspects of Geometrical Confinement	International Journal of Modern Physics A	M. Novello ; V. A. De Lorenci ; E. Elbaz	A4	
artigoEmPeriodico	 	1998			Aspects of classical and quantum motion on a flux cone. Physical Review	A	MOREIRA, E. S	Qualis nao identificado	A
artigoEmPeriodico	 	1998			Path integral on a flux cone. Physical Review	A	MOREIRA, E. S	Qualis nao identificado	A
artigoEmPeriodico	 	1998			Spectroscopy of the nuclear emission line regions of the two newly detected Seyfert 1 galaxies F10.01 and A08.12	The Astrophysical Journal, Chicago	Rodríguez-Ardila, A.; PASTORIZA, M. G. ; MAZA, J.	Qualis nao identificado	THE ASTROPHYSICAL JOURNAL, CHICAGO
artigoEmPeriodico	 	1998			Gravitational Particle Production in Spinning Cosmic String Spacetimes. Il Nuovo Cimento della Società Italiana di Fisica	B (Testo stampato)	V. A. De Lorenci; R. De Paola ; N. F. Svaiter	Qualis nao identificado	B
artigoEmPeriodico	 	1997		http://dx.doi.org/10.1006/aphy.1996.5637	Do Gravitational Waves Travel at Light Velocity	Annals of Physics (Print)	M. Novello ; V. A. De Lorenci ; L. R. Freitas	A2	
artigoEmPeriodico	 	1997			Steeps toward determination of the size and structure of the broad-line region in active galactic nuclei. X. Variability of Fairall 9 from optical data. The Astrophysical Journal	Supplement Series, Chicago	SANTOS-LLÉO, M. et al. (63 autores em total) ; Rodríguez-Ardila, A.	Qualis nao identificado	SUPPLEMENT SERIES, CHICAGO
artigoEmPeriodico	 	1997		http://dx.doi.org/10.1103/PhysRevD.56.3329	Topology Change in Canonical Quantum Cosmology	Physical Review. D. Particles and fields (Cessou em 2003. Cont. 1550-7998 Physical review. D, Particles, Fields, Gravitation, and Cosmology)	V. A. De Lorenci; J. Martin ; N. P. Neto ; I. D. Soares	A1	
artigoEmPeriodico	 	1996			Non-Linear Non-Local Theory Of Gravity - II	Gravitation & Cosmology (Print), Russia	M. Novello ; V. A. De Lorenci	Qualis nao identificado	GRAVITATION & COSMOLOGY , RUSSIA
artigoEmPeriodico	 	1996			The nucleus of C16.16: another case of double-peaked AGN.	The Astrophysical Journal, Chicago	Rodríguez-Ardila, A.; PASTORIZA, M. G. ; BICA, E. ; MAZA, J.	Qualis nao identificado	THE ASTROPHYSICAL JOURNAL, CHICAGO
artigoEmPeriodico	 	1996			Circumnuclear star formation in active galaxies	The Astrophysical Journal, Chicago	STORCHI-BERGMANN, T. ; Rodríguez-Ardila, A. ; SCHMITT, H. R. ; WILSON, A. ; BALDWIN, J.	Qualis nao identificado	THE ASTROPHYSICAL JOURNAL, CHICAGO
