artigoEmPeriodico	 	2023	1519-6984	http://dx.doi.org/10.1590/1519-6984.03316	A new approach to mark termites (Cornitermes cumulans (Kollar) Blattodea: Isoptera) for laboratory bioassays	BRAZILIAN JOURNAL OF BIOLOGY	Alessandra Marins ; Paulo Fellipe Cristaldo ; Leticia R Paiva ; Octavio Miramontes ; Og DeSouza	A2	BRAZILIAN JOURNAL OF MICROBIOLOGY
artigoEmPeriodico	 	2023	2164-6457	http://dx.doi.org/10.5890/JAND.2023.06.004	Anomalous heat diffusion in a boundary layer: A Fractionary Blasius?s System	JOURNAL OF APPLIED NONLINEAR DYNAMICS	MONTEIRO, T. B. ; ALMEIDA, A. C. L. ; OLIVEIRA, Adélcio Carlos de	B2	
artigoEmPeriodico	 	2022	1742-5468	http://dx.doi.org/10.1088/1742-5468/ac70dc	Contact process on weighted planar stochastic lattice	JOURNAL OF STATISTICAL MECHANICS-THEORY AND EXPERIMENT	ALVES, SIDINEY G ; DE OLIVEIRA, MARCELO M	A2	
artigoEmPeriodico	 	2022	0003-3804	http://dx.doi.org/10.1002/andp.202100564	The Gor'kov and Melik-Barkhudarov Correction to an Imbalanced Fermi Gas in the Presence of Impurities	ANNALEN DER PHYSIK	Caldas, Heron; RUFO, S. ; GRIFFITH, M. A. R.	A3	
artigoEmPeriodico	 	2022	1463-9076	http://dx.doi.org/10.1039/d2cp03264c	An electrodeposition model with surface relaxation predicts temperature and current effects in compact and dendritic film morphologies	PHYSICAL CHEMISTRY CHEMICAL PHYSICS	Carrasco, Ismael S. S. ; Alves, Sidiney G. ; Reis, Fábio D. A. A.	A1	
artigoEmPeriodico	 	2022	0022-5193	http://dx.doi.org/10.1016/j.jtbi.2022.111106	Social context modulates scale-free movements in a social insect	JOURNAL OF THEORETICAL BIOLOGY	CASTIBLANCO, JULIETH ; CRISTALDO, PAULO F. ; PAIVA, LETICIA R. ; DESOUZA, OG	A1	
artigoEmPeriodico	 	2022	2470-0045	http://dx.doi.org/10.1103/PhysRevE.106.024302	Heterogeneous mean-field theory for two-species symbiotic processes on networks	PHYSICAL REVIEW E	COSTA, G. S. ; de OLIVEIRA, M. M. ; FERREIRA JR., S. C.	A1	
artigoEmPeriodico	 	2022	2470-0029	http://dx.doi.org/10.1103/PhysRevD.105.024021	Nonlinear electrodynamics nonminimally coupled to gravity: Symmetric-hyperbolicity and causal structure	Physical Review D	GOULART, ÉRICO; BERGLIAFFA, SANTIAGO ESTEBAN PEREZ	A1	
artigoEmPeriodico	 	2022	2632-072X	http://dx.doi.org/10.1088/2632-072X/aca949	Visibility graphs of animal foraging trajectories	Journal Of Physics-Complexity	PAIVA, LETICIA R; ALVES, SIDINEY G ; LACASA, LUCAS ; DESOUZA, OG ; MIRAMONTES, OCTAVIO	C	
artigoEmPeriodico	 	2022	0378-4371	http://dx.doi.org/10.1016/j.physa.2022.128313	A complementary resource relation of concurrence and roughness for a two-qubit state	PHYSICA A-STATISTICAL MECHANICS AND ITS APPLICATIONS	REIS, M. ; OLIVEIRA, Adélcio Carlos de	A1	
artigoEmPeriodico	 	2021	0143-0807	http://dx.doi.org/10.1088/1361-6404/ac059a	Derivation of the Boltzmann entropy equation in a toy model	EUROPEAN JOURNAL OF PHYSICS	ALMEIDA, GABRIELLE OLIVEIRA ; CRUZ SILVA, MAYCON JÚNIOR ; MOTA, ANDRE	A3	
artigoEmPeriodico	 	2021	0960-0779	http://dx.doi.org/10.1016/j.chaos.2020.110616	An epidemiological model with voluntary quarantine strategies governed by evolutionary game dynamics	CHAOS SOLITONS & FRACTALS	AMARAL, M. A. ; de OLIVEIRA, M. M. ; JAVARONE, M. A.	A1	
artigoEmPeriodico	 	2021	2470-0045	http://dx.doi.org/10.1103/PhysRevE.104.064102	Criticality and Griffiths phases in random games with quenched disorder	PHYSICAL REVIEW E	AMARAL, M. A. ; de Oliveira, Marcelo M.	A1	
artigoEmPeriodico	 	2021	2469-9934	http://dx.doi.org/10.1103/PhysRevA.104.043523	Spherical symmetry and nonmagnetic dielectrics in analog models of gravity	PHYSICAL REVIEW A	BITTENCOURT, EDUARDO ; KLIPPERT, RENATO ; DA SILVA, DIEGO RENAN ; GOULART, ÉRICO	A1	
artigoEmPeriodico	 	2021	0129-1831	http://dx.doi.org/10.1142/S0129183121501552	Finding the dominant zero of the energy probability distribution	INTERNATIONAL JOURNAL OF MODERN PHYSICS C	CARVALHO, J. J. ; Mota, A. L.	A4	
artigoEmPeriodico	 	2021	1434-6060	http://dx.doi.org/10.1140/epjd/s10053-020-00028-w	The quantum Jarzynski inequality for superconducting optical cavities	EUROPEAN PHYSICAL JOURNAL D	DE PAULA, JOSIANE OLIVEIRA REZENDE ; DE FARIA, J. G. PEIXOTO ; DE OLIVEIRA, J. G. G. ; DE CARVALHOFALCÃO, RICARDO ; Oliveira, Adélcio C.	A4	
artigoEmPeriodico	 	2021	2624-8174	http://dx.doi.org/10.3390/physics3040071	Stellar Structure in a Newtonian Theory with Variable G	Physics	FABRIS, J. C. ; OTTONI, T. ; TONIATO, J. D. ; VELTEN, H.	C	
artigoEmPeriodico	 	2021	2190-5444	http://dx.doi.org/10.1140/epjp/s13360-021-01146-z	Newtonian-like gravity with variable G	European Physical Journal Plus	FABRIS, JÚLIO C. ; GOMES, TALES ; TONIATO, JÚNIOR D. ; VELTEN, HERMANO	A2	
artigoEmPeriodico	 	2021	0219-8878	http://dx.doi.org/10.1142/S0219887821500389	Spacetime foliations, quaternions and knotted light	INTERNATIONAL JOURNAL OF GEOMETRIC METHODS IN MODERN PHYSICS	Goulart, E.; OTTONI, J. E.	B1	
artigoEmPeriodico	 	2021	1361-6382	http://dx.doi.org/10.1088/1361-6382/ac08a9	Space and time ambiguities in vacuum electrodynamics	Classical and Quantum Gravity	GOULART, ÉRICO; BITTENCOURT, EDUARDO	A1	
artigoEmPeriodico	 	2021	1367-2630	http://dx.doi.org/10.1088/1367-2630/ac0203	Effective fermion mass in relativistic and non-relativistic systems	NEW JOURNAL OF PHYSICS	Heron Caldas	A2	
artigoEmPeriodico	 	2021	1091-6490	http://dx.doi.org/10.1073/pnas.2004369118	Scale-free movement patterns in termites emerge from social interactions and preferential attachments	PROCEEDINGS OF THE NATIONAL ACADEMY OF SCIENCES OF THE UNITED STATES OF AMERICA (ONLINE)	PAIVA, LETICIA R; MARINS, ALESSANDRA ; CRISTALDO, P. F. ; RIBEIRO, DANILO ; ALVES, SIDINEY G. ; REYNOLDS, ANDY ; DESOUZA, OG ; MIRAMONTES, OCTAVIO	A1	
artigoEmPeriodico	 	2021	0378-4371	http://dx.doi.org/10.1016/j.physa.2021.126099	Continuum reset dynamics as a pathway to Newtonian classical limit of Quantum Mechanics	PHYSICA A-STATISTICAL MECHANICS AND ITS APPLICATIONS	OLIVEIRA, Adélcio Carlos de	A1	
artigoEmPeriodico	 	2021	2525-5444	http://dx.doi.org/10.34179/revisem.v6i1.13637	Modelagem Matemática para Previsão de Jogos de Futebol	REVISTA SERGIPANA DE MATEMÁTICA E EDUCAÇÃO MATEMÁTICA	PINHEIRO RAMOS, LUIZ FERNANDO ; CESAR FERNANDES, HUMBERTO ; DE OLIVEIRA BATISTA, BEN DÊIVIDE	A4	
artigoEmPeriodico	 	2021	1572-8137	http://dx.doi.org/10.1007/s10825-021-01761-0	Relation between the roughness, linear entropy and visibility of a quantum state, the Jaynes?Cummings model	Journal of Computational Electronics	REIS, M. ; Oliveira, Adélcio C.	A4	JOURNAL OF COMPUTATIONAL ELECTRONICS (PRINT)
artigoEmPeriodico	 	2021	2470-0045	http://dx.doi.org/10.1103/physreve.103.062205	Dynamical aspects of a bouncing ball in a nonhomogeneous field	PHYSICAL REVIEW E	SILVEIRA, FELIPE AUGUSTO O. ; Alves, Sidiney G. ; LEONEL, EDSON D. ; LADEIRA, DENIS G.	A1	
artigoEmPeriodico	 	2021	2470-0010	http://dx.doi.org/10.1103/physrevd.104.044020	Post-Newtonian ? -like parameters and the gravitational slip in scalar-tensor and f ( R ) theories	PHYSICAL REVIEW D	TONIATO, JÚNIOR D.; RODRIGUES, DAVI C.	A1	
artigoEmPeriodico	 	2021	2675-4754	http://dx.doi.org/10.47456/Cad.Astro.v2n2.35952	que são ondas gravitacionais?	Cadernos de Astronomia	Toniato, Júnior Diniz	C	
artigoEmPeriodico	 	2020	2470-0010	http://dx.doi.org/10.1103/physrevd.102.112006	Abbott, B	PHYSICAL REVIEW D	AAD, G	A1	
artigoEmPeriodico	 	2020	1434-6044	http://dx.doi.org/10.1140/epjc/s10052-020-08554-y	Abbott, B	EUROPEAN PHYSICAL JOURNAL C	AAD, G	A2	
