artigoEmPeriodico	 	2018	0972-0960	http://dx.doi.org/10.17654/am100010001	DIFFUSION PROCESSES MODELED WITH HIGHER ORDER DIFFERENTIAL TERMS	FAR EAST JOURNAL OF APPLIED MATHEMATICS	ALMEIDA, A. C. L. ; Oliveira, Adélcio C.	B4	
artigoEmPeriodico	 	2018	2470-0045	http://dx.doi.org/10.1103/PhysRevE.97.032801	Radial restricted solid-on-solid and etching interface-growth models	PHYSICAL REVIEW E	Alves, Sidiney G	A1	
artigoEmPeriodico	 	2018	2164-6457	http://dx.doi.org/10.5890/jand.2018.06.002	On the localization of invariant tori in a family of generalized standard mappings and its applications to scaling in a chaotic sea	Journal of Applied Nonlinear Dynamics	COSTA, DIOGO RICARDO DA ; CALDAS, IBER'E L. ; LADEIRA, DENIS G. ; Leonel, Edson D.	B2	
artigoEmPeriodico	 	2018	0378-4371	http://dx.doi.org/10.1016/j.physa.2018.07.035	Cell aggregation in monolayer culture: Clues to a universal kinetics	PHYSICA A-STATISTICAL MECHANICS AND ITS APPLICATIONS	DA SILVA, P.C.A. ; SANTOS, A.A. ; ALVES, S.G. ; MARTINS, M.L.	A1	
artigoEmPeriodico	 	2018	2470-0010	http://dx.doi.org/10.1103/physrevd.97.075036	Torsion limits from t t ¯ production at the LHC	PHYSICAL REVIEW D	DE ALMEIDA, F.'M.'L. ; DE ANDRADE, F.'R. ; DO VALE, M.'A.'B. ; NEPOMUCENO, A.'A.	A1	
artigoEmPeriodico	 	2018	2470-0045	http://dx.doi.org/10.1103/physreve.97.060101	Finite-size scaling for discontinuous nonequilibrium phase transitions	PHYSICAL REVIEW E	de Oliveira, Marcelo M.; LUZ, M. G. E. ; FIORE, C. E.	A1	
artigoEmPeriodico	 	2018	2153-1196	http://dx.doi.org/10.4236/jmp.2018.93031	Quantum States of Interacting Atoms in Quasi-One-Dimensional Ultracold Trapped Gases	JOURNAL OF MODERN PHYSICS	E MIRANDA, POLYANNA GUIMARÃES ; DE FREITAS, DÉBORA NAZARÉ ; MOTA, ANDRÉ LUIZ	B2	
artigoEmPeriodico	 	2018	2045-2322	http://dx.doi.org/10.1038/s41598-018-27240-4	Fundamental ingredients for discontinuous phase transitions in the inertial majority vote model	Scientific Reports	ENCINAS, J. M. ; HARUNARI, P. E. ; de OLIVEIRA, M. M. ; FIORE, C. E.	A1	
artigoEmPeriodico	 	2018	2470-0045	http://dx.doi.org/10.1103/physreve.98.032129	Temporal disorder in discontinuous nonequilibrium phase transitions: General results	PHYSICAL REVIEW E	FIORE, C. E. ; de OLIVEIRA, M. M. ; HOYOS, J. A.	A1	
artigoEmPeriodico	 	2018	2640-9690	http://dx.doi.org/10.31031/EME.2018.01.000515	Anomalous Diffusion Through Homopolar Membrane: One-Dimensional Model	Evolutions in Mechanical Engineeniring	GIMENEZ, G. G. ; OLIVEIRA, ADÉLCIO	Qualis nao identificado	EVOLUTIONS IN MECHANICAL ENGINEENIRING
artigoEmPeriodico	 	2018	0003-4916	http://dx.doi.org/10.1016/j.aop.2018.04.022	Finite Temperature Phase Diagrams of a Two-band Model of Superconductivity	ANNALS OF PHYSICS	Heron Caldas; CELES, A. ; D. Nozadze	A2	
artigoEmPeriodico	 	2018	0375-9601	http://dx.doi.org/10.1016/j.physleta.2018.01.023	Roughness as classicality indicator of a quantum state	PHYSICS LETTERS A	LEMOS, HUMBERTO C.F. ; ALMEIDA, ALEXANDRE C.L. ; AMARAL, BARBARA ; C.OLIVEIRA, ADÉLCIO	A3	
artigoEmPeriodico	 	2018	2164-6457	http://dx.doi.org/10.5890/jand.2018.06.009	Dynamics of a non-uniform Euler-Bernoulli beam: sensitivity study in the parameter space	Journal of Applied Nonlinear Dynamics	Lilian Ribeiro ; SOARES, G. V. ; ALMEIDA, A. C. L. ; Oliveira, Adélcio C.	B2	
artigoEmPeriodico	 	2017	1434-6044	http://www.scopus.com/scopus/inward/citedby.url?partnerID=bb5nvXTn&rel=R6.0.0&doi=10.1140/epjc/s10052-017-4965-8&md5=8165cb947f9c5337f2d1cfa45b3475b3	AAD, G	EUROPEAN PHYSICAL JOURNAL C	Aaboud, M	A2	
artigoEmPeriodico	 	2017	2470-0010	http://dx.doi.org/10.1103/PhysRevD.96.052004	Search for new phenomena in dijet events using of collision data collected at with the ATLAS detector	PHYSICAL REVIEW D	Aaboud, M	A1	
artigoEmPeriodico	 	2017	1029-8479	http://dx.doi.org/10.1007/jhep08(2017)052	AAD, G	JOURNAL OF HIGH ENERGY PHYSICS	Aaboud, M	A1	
artigoEmPeriodico	 	2017	1029-8479	http://www.scopus.com/scopus/inward/citedby.url?partnerID=bb5nvXTn&rel=R6.0.0&doi=10.1007/jhep10(2017)182&md5=22576af80e0e68c906bca4040088e317	AAD, G	JOURNAL OF HIGH ENERGY PHYSICS	Aaboud, M	A1	
artigoEmPeriodico	 	2017	0370-2693	http://www.scopus.com/scopus/inward/citedby.url?partnerID=bb5nvXTn&rel=R6.0.0&doi=10.1016/j.physletb.2017.09.066&md5=cd7b3cd18f609d47f759b03355c23bb6	Search for heavy resonances decaying to a W or Z boson and a Higgs boson in the final state in pp collisions at with the ATLAS detector	PHYSICS LETTERS B	Aaboud, M	A2	
artigoEmPeriodico	 	2017	0003-4916	http://www.scopus.com/scopus/inward/citedby.url?partnerID=bb5nvXTn&rel=R6.0.0&doi=10.1016/j.aop.2017.07.006&md5=a340824a2c0e2e00fa1cb28c135cd9fe	A two-band model for p-wave superconductivity	ANNALS OF PHYSICS	Caldas, Heron; BATISTA, F.S. ; CONTINENTINO, MUCIO A. ; DEUS, FERNANDA ; NOZADZE, DAVID	A2	
artigoEmPeriodico	 	2017	0921-4526	http://www.scopus.com/scopus/inward/citedby.url?partnerID=bb5nvXTn&rel=R6.0.0&doi=10.1016/j.physb.2017.04.003&md5=6c38c6b2e8f1be2463df0445dd83392b	Continuous local model for two-dimensional spin ice	Physica. B, Condensed Matter (Print)	DA FONSECA, J.E. ; MORAIS, C.W. ; MOTA, A.L. ; NUNES, L.H.C.M.	A4	
artigoEmPeriodico	 	2017	1742-5468	http://dx.doi.org/10.1088/1742-5468/aa71d3	Effects of diffusion in competitive contact processes on bipartite lattices	JOURNAL OF STATISTICAL MECHANICS-THEORY AND EXPERIMENT	de OLIVEIRA, M. M.; FIORE, C. E.	A2	
artigoEmPeriodico	 	2017	1932-6203	http://dx.doi.org/10.1371/journal.pone.0182672	The advantage of being slow: The quasi-neutral contact process	PLoS One	DE OLIVEIRA, MARCELO MARTINS; Dickman, Ronald	A1	
artigoEmPeriodico	 	2017	2470-0045	http://dx.doi.org/10.1103/physreve.96.042305	Partial inertia induces additional phase transition in the majority vote model	PHYSICAL REVIEW E	HARUNARI, P. E. ; de OLIVEIRA, M. M. ; FIORE, C. E.	A1	
artigoEmPeriodico	 	2017	2470-0045	http://dx.doi.org/10.1103/physreve.95.042137	Convergence radius of perturbative Lindblad-driven nonequilibrium steady states	PHYSICAL REVIEW E	LEMOS, Humberto C. F.; PROSEN, TOMA'	A1	
artigoEmPeriodico	 	2017	0217-9792	http://dx.doi.org/10.1142/s021797921750237x	Phase transition and monopole densities in a nearest neighbor two-dimensional spin ice model	INTERNATIONAL JOURNAL OF MODERN PHYSICS B	Morais, C. W. ; DE FREITAS, D. N. ; Mota, A. L. ; BASTONE, E. C.	B2	
artigoEmPeriodico	 	2017	2470-0010	http://dx.doi.org/10.1103/physrevd.96.064034	Will-Nordtvedt PPN formalism applied to renormalization group extensions of general relativity	PHYSICAL REVIEW D	TONIATO, J.'D.; RODRIGUES, D. C. ; ALMEIDA, A. ; BERTINI, N.	A1	
artigoEmPeriodico	 	2016	0375-9601	http://dx.doi.org/10.1016/j.physleta.2015.11.034	Characteristic entanglement timescales of a qubit coupled to a quartic oscillator	Physics Letters. A (Print)	A. R. Bosco de Magalhães ; Oliveira, Adélcio C.	A3	
artigoEmPeriodico	 	2016	1029-8479	http://www.scopus.com/scopus/inward/citedby.url?partnerID=bb5nvXTn&rel=R6.0.0&doi=10.1007/jhep06(2016)059&md5=e1467b7dab2819a300bf7a27fe270d9d	AAD, G	The Journal of High Energy Physics (Online)	Aaboud, M	A1	
artigoEmPeriodico	 	2016	2470-0010	http://dx.doi.org/10.1103/PhysRevD.94.032005	Search for new phenomena in final states with an energetic jet and large missing transverse momentum in collisions at using the ATLAS detector	PHYSICAL REVIEW D	Aaboud, M	A1	
artigoEmPeriodico	 	2016	1434-6044	http://www.scopus.com/scopus/inward/citedby.url?partnerID=bb5nvXTn&rel=R6.0.0&doi=10.1140/epjc/s10052-016-4385-1&md5=5f32e191ec397b484bd084c2b7a3b1cf	AAD, G	European Physical Journal. C, Particles and Fields (Print)	Aaboud, M	A2	
artigoEmPeriodico	 	2016	2470-0010	http://dx.doi.org/10.1103/PhysRevD.94.052002	Search for pair production of Higgs bosons in the final state using proton-proton collisions at with the ATLAS detector	PHYSICAL REVIEW D	Aaboud, M	A1	
artigoEmPeriodico	 	2016	1029-8479	http://www.scopus.com/scopus/inward/citedby.url?partnerID=bb5nvXTn&rel=R6.0.0&doi=10.1007/jhep09(2016)173&md5=6ae70dc3ff211477fc26069a53cdeaee	AAD, G	The Journal of High Energy Physics (Online)	Aaboud, M	A1	
artigoEmPeriodico	 	2016	1029-8479	http://www.scopus.com/scopus/inward/citedby.url?partnerID=bb5nvXTn&rel=R6.0.0&doi=10.1007/jhep09(2016)001&md5=630c634cb00046da5777de87ef39657c	AAD, G	The Journal of High Energy Physics (Online)	Aaboud, M	A1	
artigoEmPeriodico	 	2016	1434-6044	http://www.scopus.com/scopus/inward/citedby.url?partnerID=bb5nvXTn&rel=R6.0.0&doi=10.1140/epjc/s10052-015-3823-9&md5=b074901d310b6ebc11e2a0d1456b20d1	Abbott, B	European Physical Journal. C, Particles and Fields (Print)	AAD, G	A2	
artigoEmPeriodico	 	2016	1029-8479	http://www.scopus.com/scopus/inward/citedby.url?partnerID=bb5nvXTn&rel=R6.0.0&doi=10.1007/jhep03(2016)026&md5=dfcd5622e2caf7c39216fea675fd04e0	Abbott, B	The Journal of High Energy Physics (Online)	AAD, G	A1	
artigoEmPeriodico	 	2016	1029-8479	http://www.scopus.com/scopus/inward/citedby.url?partnerID=bb5nvXTn&rel=R6.0.0&doi=10.1007/jhep03(2016)041&md5=1d3a3bcddb6288608c5cd568eb798401	Abbott, B	The Journal of High Energy Physics (Online)	AAD, G	A1	
artigoEmPeriodico	 	2016	2470-0045	http://dx.doi.org/10.1103/physreve.93.052131	Scaling, cumulant ratios, and height distribution of ballistic deposition in <math> <mrow> <mn>3</mn> <mo>+</mo> <mn>1</mn> </mrow> </math> and <math> <mrow> <mn>4</mn> <mo>+</mo> <mn>1</mn> </mrow> </math> dimensions	PHYSICAL REVIEW E	Alves, Sidiney G.; Ferreira, Silvio C.	A1	
artigoEmPeriodico	 	2016	1367-2630	http://www.scopus.com/scopus/inward/citedby.url?partnerID=bb5nvXTn&rel=R6.0.0&doi=10.1088/1367-2630/18/9/093018&md5=b4a6f62bf654c7abbe598b7c9ba2e128	Hallmarks of the Kardar-Parisi-Zhang universality class elicited by scanning probe microscopy	New Journal of Physics	Alves, Sidiney G; ARAUJO, C. I. L. ; Ferreira, Silvio C.	A2	
artigoEmPeriodico	 	2016	2331-7019	http://dx.doi.org/10.1103/PhysRevApplied.6.024015	Multilevel Thermally Assisted Magnetoresistive Random-Access Memory Based on Exchange-Biased Vortex Configurations	PHYS REV APPL	ARAUJO, C. I. L. ; Alves, Sidiney G ; BUDA-PREJBEANU, L. D. ; DIENY, B.	A1	
artigoEmPeriodico	 	2016	2470-0010	http://dx.doi.org/10.1103/PhysRevD.94.084011	From Hopf fibrations to exotic causal replacements	PHYSICAL REVIEW D	BEZARES, MIGUEL ; GOULART, ÉRICO ; PALOMERA, GONZALO ; PONS, DANIEL J. ; REYES, ENRIQUE G.	A1	
artigoEmPeriodico	 	2016	2470-0010	http://dx.doi.org/10.1103/PhysRevD.93.124023	More about scalar gravity	PHYSICAL REVIEW D	BITTENCOURT, E. ; MOSCHELLA, U. ; Novello, M ; TONIATO, J. D.	A1	
artigoEmPeriodico	 	2016	2470-0053	http://dx.doi.org/10.1103/PhysRevE.94.042208	Transport of chaotic trajectories from regions distant from or near to structures of regular motion of the Fermi-Ulam model	PHYSICAL REVIEW E	DE FARIA, NILSON B. ; TAVARES, DANIEL S. ; DE PAULA, WENDERSON C. S. ; Leonel, Edson D. ; LADEIRA, DENIS G.	A1	
artigoEmPeriodico	 	2016	2470-0045	http://dx.doi.org/10.1103/PhysRevE.94.052138	Temporal disorder does not forbid discontinuous absorbing phase transitions in low dimensional systems	PHYSICAL REVIEW E	de OLIVEIRA, M. M.; FIORE, C. E.	A1	
artigoEmPeriodico	 	2016	2470-0045	http://dx.doi.org/10.1103/physreve.93.012110	Continuous and discontinuous absorbing-state phase transitions on Voronoi-Delaunay random lattices	PHYSICAL REVIEW E	DE OLIVEIRA, MARCELO M. ; Alves, Sidiney G. ; Ferreira, Silvio C.	A1	
artigoEmPeriodico	 	2016	0295-5075	http://www.scopus.com/scopus/inward/citedby.url?partnerID=bb5nvXTn&rel=R6.0.0&doi=10.1209/0295-5075/115/10004&md5=beaa60163368101abbfc9ea85355c0e2	Nonlinear electrodynamics is skilled with knots	Europhysics Letters (Print)	Goulart, E	A3	
artigoEmPeriodico	 	2016	1678-5878	http://dx.doi.org/10.1007/s40430-016-0624-5	Study of diffusion applied to electrodialysis: three-dimensional model in cylindrical coordinates	Journal of the Brazilian Society of Mechanical Sciences and Engineering (Impresso)	Igor Pereira Vieira ; Oliveira, Adélcio C.	A4	
artigoEmPeriodico	 	2016	0378-4371	http://dx.doi.org/10.1016/j.physa.2016.02.065	Effects of vascularization on cancer nanochemotherapy outcomes	PHYSICA A-STATISTICAL MECHANICS AND ITS APPLICATIONS	PAIVA, L. R.; FERREIRA, S. C. ; MARTINS, M. L.	A1	
artigoEmPeriodico	 	2016	1742-6588	http://dx.doi.org/10.1088/1742-6596/706/5/052012	Ward identities and the analogous Goldberger-Treiman relation in a three-flavor Spectral Quark Model	Journal of Physics. Conference Series (Print)	REIS, E A ; Mota, A L ; DIAS, E W	Qualis nao identificado	JOURNAL OF PHYSICS. CONFERENCE SERIES (PRINT)
artigoEmPeriodico	 	2016	2470-0045	http://dx.doi.org/10.1103/PhysRevE.94.042123	Comparing the influence of distinct kinds of temporal disorder in a low-dimensional absorbing transition model	PHYSICAL REVIEW E	SOLANO, C. M. D. ; de OLIVEIRA, M. M. ; FIORE, C. E.	A1	
artigoEmPeriodico	 	2015	1434-6044	http://www.scopus.com/scopus/inward/citedby.url?partnerID=bb5nvXTn&rel=R6.0.0&doi=10.1140/epjc/s10052-014-3233-4&md5=6ac794dc8b79eac46bb09adf741b71e5	Abbott, B	European Physical Journal. C, Particles and Fields (Print)	AAD, G	A2	
artigoEmPeriodico	 	2015	1434-6044	http://www.scopus.com/scopus/inward/citedby.url?partnerID=bb5nvXTn&rel=R6.0.0&doi=10.1140/epjc/s10052-015-3306-z&md5=32e7127ecb6261af23d5684935166860	Search for dark matter in events with heavy quarks and missing transverse momentum in $$pp$$ p p collisions with the ATLAS detector	European Physical Journal. C, Particles and Fields (Print)	AAD, G	A2	
artigoEmPeriodico	 	2015	1550-7998	http://dx.doi.org/10.1103/PhysRevD.92.032004	Search for high-mass diphoton resonances in collisions at with the ATLAS detector	Physical Review. D, Particles, Fields, Gravitation, and Cosmology	AAD, G	A1	
artigoEmPeriodico	 	2015	1029-8479	http://www.scopus.com/scopus/inward/citedby.url?partnerID=bb5nvXTn&rel=R6.0.0&doi=10.1007/jhep07(2015)162&md5=2bdb57e263b327dd5b80084e4d718046	Abbott, B	J HIGH ENERGY PHYS	AAD, G	A1	
artigoEmPeriodico	 	2015	1550-7998	http://dx.doi.org/10.1103/physrevd.92.012010	Abbott, B	Physical Review. D, Particles, Fields, Gravitation, and Cosmology	AAD, G	A1	
artigoEmPeriodico	 	2015	0031-9007	http://dx.doi.org/10.1103/physrevlett.114.221802	Abbott, B	Physical Review Letters (Print)	AAD, G	A1	
artigoEmPeriodico	 	2015	1434-6044	http://www.scopus.com/scopus/inward/citedby.url?partnerID=bb5nvXTn&rel=R6.0.0&doi=10.1140/epjc/s10052-015-3534-2&md5=dcf07352f56aa11bce0f95ec99104b06	Abbott, B	European Physical Journal. C, Particles and Fields (Print)	AAD, G	A2	
artigoEmPeriodico	 	2015	1434-6044	http://www.scopus.com/scopus/inward/citedby.url?partnerID=bb5nvXTn&rel=R6.0.0&doi=10.1140/epjc/s10052-015-3261-8&md5=a764b76bae7ca5edf546d75649262e8c	Abbott, B	European Physical Journal. C, Particles and Fields (Print)	AAD, G	A2	
artigoEmPeriodico	 	2015	1550-7998	http://dx.doi.org/10.1103/physrevd.91.012008	Abbott, B	Physical Review. D, Particles, Fields, Gravitation, and Cosmology	AAD, G	A1	
artigoEmPeriodico	 	2015	1029-8479	http://www.scopus.com/scopus/inward/citedby.url?partnerID=bb5nvXTn&rel=R6.0.0&doi=10.1007/jhep03(2015)041&md5=1cc00da2551d3fb869d221962683fbd7	Abbott, B	J HIGH ENERGY PHYS	AAD, G	A1	
artigoEmPeriodico	 	2015	1029-8479	http://www.scopus.com/scopus/inward/citedby.url?partnerID=bb5nvXTn&rel=R6.0.0&doi=10.1007/jhep09(2015)108&md5=4a6228191b46866cac44e0a1b3d7c958	Abbott, B	J HIGH ENERGY PHYS	AAD, G	A1	
