artigoEmPeriodico	 	2014	1569-3759		Testing for rational speculative bubbles in the Brazilian residential real-estate market	Contemporary Studies in Economic and Financial Analysis	de OLIVEIRA, M. M.; ALMEIDA, A. C. L.	Qualis nao identificado	CONTEMPORARY STUDIES IN ECONOMIC AND FINANCIAL ANALYSIS
artigoEmPeriodico	 	2014	1550-2376	http://www.scopus.com/scopus/inward/citedby.url?partnerID=bb5nvXTn&rel=R6.0.0&doi=null&md5=f8a2d9f8af7e0fb17f9968fbbee28b49	Phase diagram of the symbiotic two-species contact process	PHYSICAL REVIEW E (STATISTICAL, NONLINEAR, AND SOFT MATTER PHYSICS)	de OLIVEIRA, M. M.; DICKMAN, R.	A1	
artigoEmPeriodico	 	2014	1550-7998	http://dx.doi.org/10.1103/PhysRevD.89.105008	Inspecting baby Skyrmions with effective metrics	Physical Review. D, Particles, Fields, Gravitation, and Cosmology	GIBBONS, G.'W. ; Goulart, E.	A1	
artigoEmPeriodico	 	2014	0003-4916	http://www.scopus.com/scopus/inward/citedby.url?partnerID=bb5nvXTn&rel=R6.0.0&doi=10.1016/j.aop.2014.05.008&md5=01b173643b8581664156bce7d343dfc7	Topological transitions in multi-band superconductors	Annals of Physics (Print)	M. A. Continentino ; F. Deus ; I. T. Padilha ; H. Caldas	A2	
artigoEmPeriodico	 	2014	0375-9601	http://www.scopus.com/scopus/inward/citedby.url?partnerID=bb5nvXTn&rel=R6.0.0&doi=10.1016/j.physleta.2014.09.022&md5=8b23a44e200ba7abe3ac6dd15f349d64	Topological states in normal and superconducting p-wave chains	Physics Letters. A (Print)	M. A. Continentino ; H. Caldas ; D. Nozadze ; N. Trivedi	A3	
artigoEmPeriodico	 	2014	1742-5468	http://www.scopus.com/scopus/inward/citedby.url?partnerID=bb5nvXTn&rel=R6.0.0&doi=10.1088/1742-5468/2014/07/p07015&md5=945ca8d42e92e8642044b598dd102434	Mechanism for enhancement of superconductivity in multi-band systems with odd parity hybridization	Journal of Statistical Mechanics	M. A. Continentino ; I. T. Padilha ; Heron Caldas	A2	
artigoEmPeriodico	 	2014	0003-4916	http://www.scopus.com/scopus/inward/citedby.url?partnerID=bb5nvXTn&rel=R6.0.0&doi=10.1016/j.aop.2013.10.007&md5=4d4b208f6a7937a72ce80807a0336f37	Competing effective interactions of Dirac electrons in the Spin-Fermion system	Annals of Physics (Print)	MARINO, E.C. ; Nunes, Lizardo H.C.M.	A2	
artigoEmPeriodico	 	2014	1932-6203	http://www.scopus.com/scopus/inward/citedby.url?partnerID=bb5nvXTn&rel=R6.0.0&doi=10.1371/journal.pone.0111183&md5=87542ad7ce5052371880d2cf4dfce62e	Lévy Flights and Self-Similar Exploratory Behaviour of Termite Workers: Beyond Model Fitting	Plos One	MIRAMONTES, OCTAVIO ; DESOUZA, OG ; PAIVA, LETICIA RIBEIRO ; MARINS, ALESSANDRA ; OROZCO, SIRIO	A1	
artigoEmPeriodico	 	2014	1475-7516	http://www.scopus.com/scopus/inward/citedby.url?partnerID=bb5nvXTn&rel=R6.0.0&doi=10.1088/1475-7516/2014/01/e01&md5=8d98b8f03f0a5dca5ad41e565f6d0030	Erratum: Geometric scalar theory of gravity	Journal of Cosmology and Astroparticle Physics	NOVELLO, M ; BITTENCOURT, E ; MOSCHELLA, U ; GOULART, E ; SALIM, J.M ; TONIATO, J.D	A1	
artigoEmPeriodico	 	2014	0378-4371	http://www.scopus.com/scopus/inward/citedby.url?partnerID=bb5nvXTn&rel=R6.0.0&doi=10.1016/j.physa.2013.09.025&md5=d4ae9a20ef951359cbc5114ec5825fb7	Classical Limit of Quantum Mechanics Induced by Continuous Measurements	Physica. A (Print)	Oliveira, Adélcio C	A1	
artigoEmPeriodico	 	2014	1988-4206		ESTUDO DA RESISTÊNCIA ÔHMICA EM MEMBRANA DE TROCA CATIÔNICA NO PROCESSO DE ELETRODIÁLISE	Revista Iberoamericana de Polímeros (Internet)	Ruan C. A. Moura ; Zolacir T. O. jr ; Oliveira, Adélcio C. ; Franco Dany Amado	Qualis nao identificado	REVISTA IBEROAMERICANA DE POLÍMEROS (INTERNET)
artigoEmPeriodico	 	2013	1742-5468	http://www.scopus.com/scopus/inward/citedby.url?partnerID=bb5nvXTn&rel=R6.0.0&doi=10.1088/1742-5468/2013/05/p05007&md5=3e88b1f37d61d9200b73b1236f8a8d82	Non-universal parameters, corrections and universality in Kardar-Parisi-Zhang growth	Journal of Statistical Mechanics	Alves, Sidiney G; OLIVEIRA, T. J. ; Ferreira, S. C.	A2	
artigoEmPeriodico	 	2013	0264-9381	http://www.scopus.com/scopus/inward/citedby.url?partnerID=bb5nvXTn&rel=R6.0.0&doi=10.1088/0264-9381/30/15/155020&md5=c8ed6ecbc6e637d912f494a7a85b3bfc	Disformal invariance of Maxwell?s field equations	Classical and Quantum Gravity (Print)	GOULART, E; FALCIANO, F T	A1	
artigoEmPeriodico	 	2013	1361-6455	http://www.scopus.com/scopus/inward/citedby.url?partnerID=bb5nvXTn&rel=R6.0.0&doi=10.1088/0953-4075/46/15/155301&md5=b60a52a3e8677424b980448b24e64c80	Nesting and lifetime effects in the FFLO state of quasi-one-dimensional imbalanced Fermi gases	Journal of Physics B: Atomic, Molecular and Optical Physics	Heron Caldas; CONTINENTINO, M. A.	A3	JOURNAL OF PHYSICS. B, ATOMIC, MOLECULAR AND OPTICAL PHYSICS
artigoEmPeriodico	 	2013	1050-2947	http://dx.doi.org/10.1103/PhysRevA.88.023615	Influence of induced interactions on superfluid properties of quasi-two dimensional dilute Fermi gases with spin-orbit coupling	Physical Review. A	Heron Caldas; R. L. S. Farias ; M. A. Continentino	A1	
artigoEmPeriodico	 	2013	1475-7516	http://www.scopus.com/scopus/inward/citedby.url?partnerID=bb5nvXTn&rel=R6.0.0&doi=10.1088/1475-7516/2013/06/014&md5=e4058b8842242c2b4a4faa03a25a81ad	Geometric scalar theory of gravity	Journal of Cosmology and Astroparticle Physics	NOVELLO, M ; BITTENCOURT, E ; MOSCHELLA, U ; GOULART, E ; SALIM, J.M ; TONIATO, J.D	A1	
artigoEmPeriodico	 	2013	1539-3755	http://www.scopus.com/scopus/inward/citedby.url?partnerID=bb5nvXTn&rel=R6.0.0&doi=10.1103/physreve.87.040102&md5=ce4cd71e3323c4f8fd8d7650e2600bd1	Kardar-Parisi-Zhang universality class in (2+1) dimensions: Universal geometry-dependent distributions and finite-time corrections	Physical Review. E, Statistical, Nonlinear, and Soft Matter Physics (Print)	OLIVEIRA, T. J. ; ALVES, S. G. ; Ferreira, S. C.	A1	
artigoEmPeriodico	 	2013	1478-3975	http://www.scopus.com/scopus/inward/citedby.url?partnerID=bb5nvXTn&rel=R6.0.0&doi=10.1088/1478-3975/10/2/025005&md5=75b47499934a561974779a651ab9197b	Multiscale model for the effects of adaptive immunity suppression on the viral therapy of cancer	PHYSICAL BIOLOGY (ONLINE)	PAIVA, LETICIA R; SILVA, HALLAN S ; FERREIRA, SILVIO C ; MARTINS, MARCELO L	Qualis nao identificado	PHYSICAL BIOLOGY (ONLINE)
artigoEmPeriodico	 	2013	1550-2376	http://www.scopus.com/scopus/inward/citedby.url?partnerID=bb5nvXTn&rel=R6.0.0&doi=10.1103/physreve.87.032158&md5=71708b0669c738e260eb95649c3a4b8b	Thermal conductivity of anharmonic crystals with self-consistent baths: Analytical computation with discrete time	Physical Review. E, Statistical, Nonlinear and Soft Matter Physics (Online)	Pereira, Emmanuel ; FALCAO, RICARDO ; LEMOS, Humberto C. F.	A1	
artigoEmPeriodico	 	2012	1742-5468	http://www.scopus.com/scopus/inward/citedby.url?partnerID=bb5nvXTn&rel=R6.0.0&doi=10.1088/1742-5468/2012/10/p10011&md5=a188c994173f7a644df0e77a3b3ef4df	Eden clusters in three dimensions and the Kardar-Parisi-Zhang universality class	Journal of Statistical Mechanics	ALVES, S. G.; Ferreira, S. C.	A2	
artigoEmPeriodico	 	2012	1742-5468	http://www.scopus.com/scopus/inward/citedby.url?partnerID=bb5nvXTn&rel=R6.0.0&doi=10.1088/1742-5468/2012/10/p10019&md5=6d5f07de8b54894dc4a1abac81c84d84	Superfluidity in two-dimensional imbalanced Fermi gases	Journal of Statistical Mechanics	CALDAS, Heron Carlos de Godoy ; A. L. Mota ; FARIAS, R. L. S. ; SOUZA, L.	A2	
artigoEmPeriodico	 	2012	1550-2376	http://www.scopus.com/scopus/inward/citedby.url?partnerID=bb5nvXTn&rel=R6.0.0&doi=10.1103/physreve.86.011121&md5=9aa46dc659bada404d0ee7ff8586c8b6	Symbiotic two-species contact process	PHYSICAL REVIEW E (STATISTICAL, NONLINEAR, AND SOFT MATTER PHYSICS)	DE OLIVEIRA, MARCELO MARTINS; DOS SANTOS, RENATO VIEIRA ; Dickman, Ronald	A1	
artigoEmPeriodico	 	2012	0378-4371	http://www.scopus.com/scopus/inward/citedby.url?partnerID=bb5nvXTn&rel=R6.0.0&doi=10.1016/j.physa.2012.07.026&md5=514d2fd7aaf72b598b3d8da390709010	Correlations equalities and some upper bounds for the critical temperature for spin one systems	Physica. A (Print)	F. C. Sá Barreto ; MOTA, A. L.	A1	
artigoEmPeriodico	 	2012	2090-4673	http://dx.doi.org/10.5402/2012/260951	Mimicking General Relativity with Newtonian Dynamics	ISRN Mathematical Physics	Goulart, E	Qualis nao identificado	ISRN MATHEMATICAL PHYSICS
artigoEmPeriodico	 	2012	0264-9381	http://www.scopus.com/scopus/inward/citedby.url?partnerID=bb5nvXTn&rel=R6.0.0&doi=10.1088/0264-9381/29/8/085011&md5=296fbaba8336bb179622ce86d7103db6	A new symmetry of the relativistic wave equation	Classical and Quantum Gravity (Print)	Goulart, E.; F. T. Falciano	A1	
artigoEmPeriodico	 	2012	1098-0121	http://www.scopus.com/scopus/inward/citedby.url?partnerID=bb5nvXTn&rel=R6.0.0&doi=10.1103/physrevb.86.144503&md5=dd76c8c966925368ee2f5333f496fc38	Quantum normal-to-inhomogeneous superconductor phase transition in nearly two-dimensional metals	PHYSICAL REVIEW B	Heron Caldas; CONTINENTINO, M. A.	A1	
artigoEmPeriodico	 	2012	0031-8949	http://dx.doi.org/10.1088/0031-8949/86/03/035001	Effectively irreversible fringe contrast attenuation induced by one degree of freedom	Physica Scripta (Print)	MAGALHAES, A. R. B. ; OLIVEIRA, Adélcio Carlos de	A4	
artigoEmPeriodico	 	2012	0375-9601	http://www.scopus.com/scopus/inward/citedby.url?partnerID=bb5nvXTn&rel=R6.0.0&doi=10.1016/j.physleta.2011.12.030&md5=2556f1d9f97a68cdf9afed65f8362997	Superconducting and excitonic quantum phase transitions in doped Dirac electronic systems	Physics Letters. A (Print)	Nunes, Lizardo H.C.M.; Farias, Ricardo L.S. ; Marino, Eduardo C.	A3	
artigoEmPeriodico	 	2012	0038-1098	http://www.scopus.com/scopus/inward/citedby.url?partnerID=bb5nvXTn&rel=R6.0.0&doi=10.1016/j.ssc.2012.08.019&md5=3bccdf7ad0b3becf16f1482bd3b740ce	Superconductivity in graphene stacks: From the bilayer to graphite	Solid State Communications	NUNES, LIZARDO H.C.M. ; MOTA, A.L. ; MARINO, E.C.	A4	
artigoEmPeriodico	 	2012	2153-1196	http://dx.doi.org/10.4236/jmp.2012.38094	Semiclassical Husimi Function of Simple and Chaotic Systems	Journal of Modern Physics	Oliveira, Adélcio C	B2	
artigoEmPeriodico	 	2012	0378-4371	http://www.scopus.com/scopus/inward/citedby.url?partnerID=bb5nvXTn&rel=R6.0.0&doi=10.1016/j.physa.2012.05.064&md5=29b40f03053bd31d38215fd4d73c7e0c	Influence of experimental resolution on the quantum-to-classical transition in the quartic oscillator	Physica. A (Print)	Oliveira, Adélcio C.; de Magalhães, A.R. Bosco ; de Faria, J.G. Peixoto	A1	
artigoEmPeriodico	 	2012	1539-3755	http://www.scopus.com/scopus/inward/citedby.url?partnerID=bb5nvXTn&rel=R6.0.0&doi=10.1103/physreve.85.010601&md5=592a274794a2663a97484d44b5f8360c	Universal fluctuations in Kardar-Parisi-Zhang growth on one-dimensional flat substrates	Physical Review. E, Statistical, Nonlinear, and Soft Matter Physics (Print)	OLIVEIRA, T. J. ; Ferreira, S. C. ; S. C. FERREIRA Jr. ; ALVES, S. G.	A1	
artigoEmPeriodico	 	2012	1094-1622	http://www.scopus.com/scopus/inward/citedby.url?partnerID=bb5nvXTn&rel=R6.0.0&doi=10.1103/physreva.86.033603&md5=6e156cd48d5ad92cf6ffc7601a27fe89	Finite-temperature phase diagram of quasi-two-dimensional imbalanced Fermi gases beyond mean field	Physical Review. A, Atomic, Molecular, and Optical Physics (Online)	M. A. RESENDE ; Mota, A L ; R. L. S. Farias ; Heron Caldas	A1	
artigoEmPeriodico	 	2012	1742-5468	http://www.scopus.com/scopus/inward/citedby.url?partnerID=bb5nvXTn&rel=R6.0.0&doi=10.1088/1742-5468/2012/05/p05006&md5=4a27a993c664fbd3b41eed626fccef5c	Correlation equalities and upper bounds for the transverse Ising model	Journal of Statistical Mechanics	Sá Barreto, F C ; Mota, A L	A2	
artigoEmPeriodico	 	2011	1742-5468	http://www.scopus.com/scopus/inward/citedby.url?partnerID=bb5nvXTn&rel=R6.0.0&doi=10.1088/1742-5468/2011/04/p04022&md5=bc14cc2a2a670a49fb47179773f520fd	Transitions in a probabilistic interface growth model	Journal of Statistical Mechanics	ALVES, S. G.; MOREIRA, J. G.	A2	
artigoEmPeriodico	 	2011	0295-5075	http://www.scopus.com/scopus/inward/citedby.url?partnerID=bb5nvXTn&rel=R6.0.0&doi=10.1209/0295-5075/96/48003&md5=a363f844d3919f78899eee734c1d9858	Universal fluctuations in radial growth models belonging to the KPZ universality class	Europhysics Letters (Print)	ALVES, S. G.; Oliveira, T. J. ; Ferreira, S. C.	A3	
artigoEmPeriodico	 	2011	1742-5468	http://dx.doi.org/10.1088/1742-5468/2011/10/P10005	An effective field theory model for one-dimensional CH chains: effects at finite chemical potential, temperature and external Zeeman magnetic field	Journal of Statistical Mechanics	Caldas, Heron	A2	
artigoEmPeriodico	 	2011	1539-3755	http://www.scopus.com/scopus/inward/citedby.url?partnerID=bb5nvXTn&rel=R6.0.0&doi=10.1103/physreve.84.011125&md5=dddc59f0d420f3d990be63220c104f24	Contact Process with Sublatttice Symmetry-Breaking	PHYSICAL REVIEW E	de OLIVEIRA, M. M.; Dickman, Ronald	A1	
artigoEmPeriodico	 	2011	1550-7998	http://www.scopus.com/scopus/inward/citedby.url?partnerID=bb5nvXTn&rel=R6.0.0&doi=10.1103/physrevd.83.125022&md5=586296c6829d63d7920889b6ec21ccb9	Scalar quantum field theory in disordered media	Physical Review. D, Particles, Fields, Gravitation, and Cosmology	Goulart, E.; Arias, E. ; Krein, G. ; Menezes, G. ; Svaiter, N.	A1	
artigoEmPeriodico	 	2011	1550-7998	http://www.scopus.com/scopus/inward/citedby.url?partnerID=bb5nvXTn&rel=R6.0.0&doi=10.1103/physrevd.84.105027&md5=a50785498968dd111535133f24e52a3c	Effective metric in nonlinear scalar field theories	Physical Review. D, Particles, Fields, Gravitation, and Cosmology	Goulart, E.; Bergliaffa, Santiago	A1	
artigoEmPeriodico	 	2011	0264-9381	http://www.scopus.com/scopus/inward/citedby.url?partnerID=bb5nvXTn&rel=R6.0.0&doi=10.1088/0264-9381/28/24/245008&md5=511f5067935f6d67ceb398e510b0b12b	Hidden geometries in nonlinear theories: a novel aspect of analogue gravity	Classical and Quantum Gravity (Print)	Goulart, E.; M. Novello ; F. T. Falciano ; TONIATO, J.	A1	
artigoEmPeriodico	 	2011	0217-751X	http://dx.doi.org/10.1142/S0217751X11053067	Momentum Space Regularizations and the Indeterminacy in the Schwinger Model	International Journal of Modern Physics A	Morais, C. W. ; MOTA, A. L.	A4	
artigoEmPeriodico	 	2011	0378-4371	http://www.scopus.com/scopus/inward/citedby.url?partnerID=bb5nvXTn&rel=R6.0.0&doi=10.1016/j.physa.2011.06.077&md5=f31906fb236aadac6f90a6377e0015fb	Scaling laws in the diffusion limited aggregation of persistent random walkers	Physica. A (Print)	Nogueira, Isadora R. ; Alves, Sidiney G. ; Ferreira, Silvio C.	A1	
artigoEmPeriodico	 	2011	0264-9381	http://www.scopus.com/scopus/inward/citedby.url?partnerID=bb5nvXTn&rel=R6.0.0&doi=10.1088/0264-9381/28/14/145022&md5=aadfff439b4f104d3f0208ebd78500ea	Beyond analog gravity: the case of exceptional dynamics	Classical and Quantum Gravity (Print)	NOVELLO, M. ; Goulart, E.	A1	
artigoEmPeriodico	 	2011	0003-6951	http://www.scopus.com/scopus/inward/citedby.url?partnerID=bb5nvXTn&rel=R6.0.0&doi=10.1063/1.3551619&md5=69b8b37b77159d3c79e93ffd23724e32	A multiscale model to evaluate the efficacy of anticancer therapies based on chimeric polypeptide nanoparticles	Applied Physics Letters	Paiva, L. R.; Martins, M. L.	A1	
artigoEmPeriodico	 	2011	1539-3755	http://www.scopus.com/scopus/inward/citedby.url?partnerID=bb5nvXTn&rel=R6.0.0&doi=10.1103/physreve.84.041918&md5=5b8570b81063b6e0d151720dbcc75981	Questing for an optimal, universal viral agent for oncolytic virotherapy	Physical Review. E, Statistical, Nonlinear, and Soft Matter Physics (Print)	Paiva, L. R.; Martins, M. L. ; Ferreira, S. C.	A1	
artigoEmPeriodico	 	2011	1539-3755	http://www.scopus.com/scopus/inward/citedby.url?partnerID=bb5nvXTn&rel=R6.0.0&doi=10.1103/physreve.84.061135&md5=58b5ff4aa4923dbbaf6f8dc9c42881dd	Ingredients of thermal rectification: The case of classical and quantum self-consistent harmonic chains of oscillators	Physical Review. E, Statistical, Nonlinear, and Soft Matter Physics (Print)	Pereira, Emmanuel ; Lemos, Humberto ; Ávila, Ricardo	A1	
artigoEmPeriodico	 	2011	1539-3755	http://www.scopus.com/scopus/inward/citedby.url?partnerID=bb5nvXTn&rel=R6.0.0&doi=10.1103/physreve.83.037101&md5=9d6d71829076d1b8a33986db12b4e6da	Explaining the high number of infected people by dengue in Rio de Janeiro in 2008 using a susceptible-infective-recovered model	Physical Review. E, Statistical, Nonlinear, and Soft Matter Physics (Print)	T. Botari ; ALVES, S. G. ; E. D. Leonel	A1	
artigoEmPeriodico	 	2010	1742-5468	http://dx.doi.org/10.1088/1742-5468/2010/09/P09012	Cluster¿cluster aggregation with particle replication and chemotaxy: a simple model for the growth of animal cells in culture	Journal of Statistical Mechanics	Alves, S G; Martins, M L	A2	
artigoEmPeriodico	 	2010	1742-5468	http://dx.doi.org/10.1088/1742-5468/2010/03/P03027	Temperature effects on the magnetization of quasi-one-dimensional Peierls distorted materials	Journal of Statistical Mechanics	Caldas, Heron	A2	
artigoEmPeriodico	 	2010	0217-751X	http://dx.doi.org/10.1142/s0217751x10050573	GEOMETRICAL PROPERTIES OF ELECTROMAGNETIC TIDAL FORCES	International Journal of Modern Physics A	GOULART, ÉRICO; FALCIANO, FELIPE TOVAR	A4	
artigoEmPeriodico	 	2009	0021-9606	http://www.scopus.com/scopus/inward/citedby.url?partnerID=bb5nvXTn&rel=R6.0.0&doi=10.1063/1.3158359&md5=91ec6bc8d8325c16657a2b75e6557a39	Effects of the mean free path and relaxation in a model for the aggregation of particles in superfluid media	Journal of Chemical Physics	ALVES, S. G.; VILESOV, A. F. ; FERREIRA Jr, S. C.	A2	
artigoEmPeriodico	 	2009	0202-2893	http://dx.doi.org/10.1134/s0202289309030013	Gravitational waves in singular and bouncing FLRW universes	Gravitation & Cosmology (Print)	ANTUNES, V. ; Goulart, E. ; NOVELLO, M.	B2	
artigoEmPeriodico	 	2009	0550-3213	http://www.scopus.com/scopus/inward/citedby.url?partnerID=bb5nvXTn&rel=R6.0.0&doi=10.1016/j.nuclphysb.2008.09.002&md5=4aa2e6aca7e9535f47d4499e67b36698	Asymmetrically doped polyacetylene	Nuclear Physics. B (Print)	Caldas, H	A3	
artigoEmPeriodico	 	2009	0921-4526	http://www.scopus.com/scopus/inward/citedby.url?partnerID=bb5nvXTn&rel=R6.0.0&doi=10.1016/j.physb.2009.07.068&md5=f321e1dc64476611b6043b9ec59e4b1b	Asymmetrically Doped 1-Dimensional Trans-Polymers	Physica. B, Condensed Matter	Caldas, H	A4	
artigoEmPeriodico	 	2009	1098-0121	http://www.scopus.com/scopus/inward/citedby.url?partnerID=bb5nvXTn&rel=R6.0.0&doi=10.1103/physrevb.80.115428&md5=76994a232b74e0ae603c11f7c83f816d	Magnetization of planar four-fermion systems	PHYSICAL REVIEW B	Caldas, Heron; Ramos, Rudnei O.	A1	
artigoEmPeriodico	 	2009	0264-9381	http://www.scopus.com/scopus/inward/citedby.url?partnerID=bb5nvXTn&rel=R6.0.0&doi=10.1088/0264-9381/26/13/135015&md5=c20cf1be20564867b192af140f34b07b	A classification of the effective metric in nonlinear electrodynamics	Classical and Quantum Gravity (Print)	DE OLIVEIRA COSTA, ÉRICO GOULART; PEREZ BERGLIAFFA, SANTIAGO ESTEBAN	A1	
artigoEmPeriodico	 	2009	1550-7998	http://dx.doi.org/10.1103/PhysRevD.79.085002	Axial-vector coupling and chiral anomaly in the spectral quark model	Physical Review D, Particles, Fields, Gravitation and Cosmology	FERREIRA, L. C. ; MOTA, A. L.	A1	
artigoEmPeriodico	 	2009	0217-751X	http://www.scopus.com/scopus/inward/citedby.url?partnerID=bb5nvXTn&rel=R6.0.0&doi=10.1142/s0217751x0904628x&md5=78396b4bfd947275854b1e54d72d34c6	FORMAL ANALOGIES BETWEEN GRAVITATION AND ELECTRODYNAMICS	International Journal of Modern Physics A	Goulart, E.; FALCIANO, F. T.	A4	
artigoEmPeriodico	 	2009	1539-3755	http://www.scopus.com/scopus/inward/citedby.url?partnerID=bb5nvXTn&rel=R6.0.0&doi=10.1103/physreve.80.026204&md5=0d0cc2a4962ccb91e5798db696a18164	Role of the effective Hilbert-space size of the reservoir for the decoherence process	Physical Review. E, Statistical, Nonlinear and Soft Matter Physics	Oliveira, Adélcio C.; de Magalhães, A. R. Bosco	A1	
artigoEmPeriodico	 	2009	0378-4371	http://dx.doi.org/10.1016/j.physa.2008.12.055	Tunnel effect as a hidden variable theory test	Physica. A	OLIVEIRA, Adélcio Carlos de; Amarante-Segundo, Gesil S.	A1	
artigoEmPeriodico	 	2009	1751-8113	http://www.scopus.com/scopus/inward/citedby.url?partnerID=bb5nvXTn&rel=R6.0.0&doi=10.1088/1751-8113/42/38/385002&md5=06df3dbca845cee7c52488fab4182ca1	On the topological phase transition of the two-dimensional XY-model on the Voronoi¿Delaunay lattice	Journal of Physics. A, Mathematical and Theoretical (Print)	Oliveira-Neto, N M ; ALVES, S. G. ; Silva, R L ; Pereira, A R ; Moura-Melo, W A	A2	
artigoEmPeriodico	 	2009	0008-5472	http://www.scopus.com/scopus/inward/citedby.url?partnerID=bb5nvXTn&rel=R6.0.0&doi=10.1158/0008-5472.can-08-2173&md5=0d2caab4a3023e19894575d8dfc293c9	A Multiscale Mathematical Model for Oncolytic Virotherapy	Cancer Research	PAIVA, L. R.; Binny, C. ; Ferreira, S. C. ; Martins, M. L.	Qualis nao identificado	CANCER RESEARCH
artigoEmPeriodico	 	2009	1751-8113	http://www.scopus.com/scopus/inward/citedby.url?partnerID=bb5nvXTn&rel=R6.0.0&doi=10.1088/1751-8113/42/22/225006&md5=d54c387d6fe46433dc220c2b3ffea2e6	Symmetry of heat conductivity in inhomogeneous quantum chains	Journal of Physics. A, Mathematical and Theoretical	Pereira, Emmanuel ; Lemos, Humberto C F	A2	
artigoEmPeriodico	 	2009	1742-5468	http://www.scopus.com/scopus/inward/citedby.url?partnerID=bb5nvXTn&rel=R6.0.0&doi=10.1088/1742-5468/2009/08/p08011&md5=85c5c655c31ff1cb2eefb81700de0c59	Quasi-stationary simulations of the directed percolation universality class in d=3 dimensions	Journal of Statistical Mechanics	R. S. Sander ; de OLIVEIRA, M. M. ; FERREIRA JR., S. C.	A2	
artigoEmPeriodico	 	2008	0103-9733	http://www.scopus.com/scopus/inward/citedby.url?partnerID=bb5nvXTn&rel=R6.0.0&doi=10.1590/s0103-97332008000100016&md5=ccfa745092686d8a9b3bb09976d96df1	Strategies for optimize off-lattice agregate simulations	Brazilian Journal of Physics (Impresso)	ALVES, S. G.; FERREIRA Jr, S. C. ; MARTINS, M. L.	A3	
artigoEmPeriodico	 	2008	1742-5468	http://www.scopus.com/scopus/inward/citedby.url?partnerID=bb5nvXTn&rel=R6.0.0&doi=10.1088/1742-5468/2008/08/p08013&md5=d585c87b13fecea161b5d1c6bd336353	Temperature effects in a Fermi gas with population imbalance	Journal of Statistical Mechanics. Theory and Experiment	Caldas, Heron ; A. L. Mota	A2	
artigoEmPeriodico	 	2008	1098-0121	http://www.scopus.com/scopus/inward/citedby.url?partnerID=bb5nvXTn&rel=R6.0.0&doi=10.1103/physrevb.77.205109&md5=eb1cc0dea702e53da7c666658b644de5	Critical dopant concentration in polyacetylene and phase diagram from a continuous four-Fermi model	Physical Review. B, Condensed Matter and Materials Physics	Caldas, Heron; Kneur, Jean-Loïc ; Pinto, Marcus Benghi ; Ramos, Rudnei O.	A1	
artigoEmPeriodico	 	2008	1742-5468	http://www.scopus.com/scopus/inward/citedby.url?partnerID=bb5nvXTn&rel=R6.0.0&doi=10.1088/1742-5468/2008/11/p11001&md5=853e16218ab308e59b68f8cefc063bc3	Universality of the contact process with random dilution	Journal of Statistical Mechanics	de OLIVEIRA, M. M.; FERREIRA JR., S. C.	A2	
artigoEmPeriodico	 	2008	0202-2893	http://dx.doi.org/10.1134/s0202289308040051	Cosmological stability of Weyl conformal tensor	Gravitation & Cosmology (Print)	Goulart, E.; NOVELLO, M.	B2	
artigoEmPeriodico	 	2008	1063-651X	http://www.scopus.com/scopus/inward/citedby.url?partnerID=bb5nvXTn&rel=R6.0.0&doi=10.1103/physreve.78.031133&md5=3abc0757899c3889fa33968625c02c89	Contact process on a Voronoi triangulation	Physical Review E - Statistical Physics, Plasmas, Fluids and Related Interdisciplinary Topics	Marcelo Martins de Oliveira ; ALVES, S. G. ; FERREIRA Jr, S. C. ; Ronald Dickman	A1	
artigoEmPeriodico	 	2008	1539-3755	http://www.scopus.com/scopus/inward/citedby.url?partnerID=bb5nvXTn&rel=R6.0.0&doi=10.1103/physreve.78.031108&md5=a2cc410c061b1d1caeacda141bc8fbe3	Symmetry properties of heat conduction in inhomogeneous materials	Physical Review. E, Statistical, Nonlinear and Soft Matter Physics	PEREIRA, E. ; LEMOS, Humberto C. F.	A1	
artigoEmPeriodico	 	2007	1742-5468	http://dx.doi.org/10.1088/1742-5468/2007/10/p10015	Symmetry break in ferromagnetic electrocrystallization: the interplay between dipolar interactions and Laplacian growth	Journal of Statistical Mechanics	ALVES, S. G.; BRAGA, F. L. ; MARTINS, M. L.	A2	
artigoEmPeriodico	 	2007	1742-5468	http://www.scopus.com/scopus/inward/citedby.url?partnerID=bb5nvXTn&rel=R6.0.0&doi=10.1088/1742-5468/2007/11/p11012&md5=51e606328e850b97d83b1f36051ef573	Surface energy in cold asymmetrical fermion superfluids	Journal of Statistical Mechanics. Theory and Experiment	Caldas, Heron	A2	
artigoEmPeriodico	 	2007	1095-3787	http://www.scopus.com/scopus/inward/citedby.url?partnerID=bb5nvXTn&rel=R6.0.0&doi=10.1103/physreve.76.031116&md5=0568ee97a6ab93f1a4ddbf1559e992c2	Heat conduction in quantum harmonic chains with alternate masses and self-consistent thermal reservoirs	Physical Review. E, Statistical Physics, Plasmas, Fluids, and Related Interdisciplinary Topics (Online)	FRANCISCO NETO, A. ; LEMOS, H. C. F. ; PEREIRA, E.	A1	PHYSICAL REVIEW E - STATISTICAL PHYSICS, PLASMAS, FLUIDS AND RELATED INTERDISCIPLINARY TOPICS
artigoEmPeriodico	 	2007	0378-4371	http://dx.doi.org/10.1016/j.physa.2006.07.004	Effects of temperature on the relaxation to equilibrium and stationary nonequilibrium states of some Langevin systems	Physica. A	LEMOS, Humberto C. F.; PEREIRA, E.	A1	
artigoEmPeriodico	 	2007	0264-9381	http://www.scopus.com/scopus/inward/citedby.url?partnerID=bb5nvXTn&rel=R6.0.0&doi=10.1088/0264-9381/24/11/015&md5=7cd9efe5dde93f5c2bf8791af47b5a65	Cosmological Effects of Nonlinear Electrodynamics	Classical and Quantum Gravity (Print)	M. Novello ; J. Salim ; S. Bergliafa ; Goulart, E.	A1	
artigoEmPeriodico	 	2007	0550-3213	http://www.scopus.com/scopus/inward/citedby.url?partnerID=bb5nvXTn&rel=R6.0.0&doi=10.1016/j.nuclphysb.2007.01.029&md5=9391efcbfe0d1e6fb63d87501dff8f6a	Magnetic field effects on the superconducting and quantum critical properties of layered systems with Dirac electrons	Nuclear Physics. B	MARINO, E ; NUNES, L	A3	
