trabalhoCompletoEmCongresso	 	2008	http://dx.doi.org/10.1016/j.physb.2007.10.087	Effects of a magnetic field on superconductivity and quantum criticality in quasi-two-dimensional systems with Dirac electrons?	SCES 2007	MARINO, E ; NUNES, L		
trabalhoCompletoEmCongresso	 	2008		Correspondence Principle and Uncertain Relations	XXXI Encontro Nacional da Matéria Condensada	OLIVEIRA, Adélcio Carlos de		
trabalhoCompletoEmCongresso	 	2007	http://dx.doi.org/10.1016/j.physc.2007.03.227	A quantum critical superconducting phase transition in quasi-two-dimensional systems with Dirac electrons?	VIII International Conference on Materials and Mechanisms of Superconductivity	MARINO, E ; NUNES, L		
trabalhoCompletoEmCongresso	 	2006		Alternative Strategies for College Physics Education	22nd ICDE World Conference on Distance Education	GREGORIO, M. A. ; NUNES, Lizardo H. C. M. ; MARECHAL, B. M. ; BELLO, P. H. R.		
trabalhoCompletoEmCongresso	 	2005		Quasi-stationary Simulation of the Contact Process	International Workshop on Physics Survey of Irregular Systems	DICKMAN, R. ; de OLIVEIRA, M. M.		
trabalhoCompletoEmCongresso	 	2002		Percolação para Principiantes	Bienal da SBM	Braga, G. A. ; de OLIVEIRA, M. M. ; Schieber, T. A. ; SANCHIS, R.		
trabalhoCompletoEmCongresso	 	2001		The Damping Rate of a Fermion Within the Linear Sigma Model at Finite Temperature	XXII Encontro Nacional de Fisica de Partículas e Campos	CALDAS, H. C. G		
trabalhoCompletoEmCongresso	 	2000		A cellular automata model for citrus variegated chlorosis	International Conference on New Trends in the Fractal Aspects of Complex Systems	MARTINS, M. L. ; G. Ceotto ; ALVES, S. G. ; BUFON, C. C. B. ; SILVA, J. M. ; LARANJEIRA, F. F.		
trabalhoCompletoEmCongresso	 	1999		Meson Properties on a Renormalizable Version of the NJL Model	Hadron Physics - Effective Theories in Low Energy QCD	A. L. Mota; NEMES, Maria Carolina ; HILLER, Brigitte ; WALLISER, H.		
trabalhoCompletoEmCongresso	 	1999		Gravidade em Baixas Dimensões	Simpósio de Iniciação Científica	Goulart, E		
trabalhoCompletoEmCongresso	 	1997		On the Renormalization of the Chiral Fermion Meson Model: An Algebraic Approach	XVIII Encontro Nacional de Física de Partículas e Campos	FRANCO, D. H. T. ; CALDAS, Heron Carlos de Godoy ; A. L. Mota ; NEMES, Maria Carolina		
resumoExpandidoEmCongresso	 	2020	DIFUSÃO ANÔMALA EM CAMINHADAS DE CUPINS	I Congresso Brasileiro Interdisciplinar de Ciência e Tecnologia, 2020, Diamantina. Anais do I Congresso Brasileiro Interdisciplinar em Ciência e Tecnologia	GONCALVES, B. D. ; ALVES, S. G. ; PAIVA, L. R.		
resumoExpandidoEmCongresso	 	2020	ABORDAGEM INTERDISCIPLINAR PARA ANÁLISE DE DADOS EMPÍRICOS DE RASTREAMENTO DE UM CUPIM CONFINADO	I Congresso Brasileiro Interdisciplinar de Ciência e Tecnologia, 2020, Diamantina. Anais do I Congresso Brasileiro Interdisciplinar em Ciência e Tecnologia	SILVA, L. B. ; BARROS, L. A. ; PAIVA, L. R.		
resumoExpandidoEmCongresso	 	2016	PARAMETRIC DYNAMICS OF AN EULER-BERNOULLI BEAM	International Conference on Nonlinear Science and Complexity, 2016, São José dos Campos. International Conference on Nonlinear Science and Complexity	Lilian Ribeiro ; OLIVEIRA, Adélcio Carlos de		
resumoExpandidoEmCongresso	 	2010	Onset of thermal rectification in graded mass systems: Analysis of the classic and quantum self-consistent harmonic chain of oscillators	11th Granada Seminar on Computational and Statistical Physics, 2011, La Herradura. AIP Conference Proceedings: Non-Equilibrium Statistical Physics Today.. Melvilli, New York: AIP: American Institute of Physics	Pereira, Emmanuel ; LEMOS, Humberto C. F. ; Ávila, Ricardo R.		
resumoExpandidoEmCongresso	 	2003	Neutral Pion Decay in a Hot and Dense Medium	Topics in Heavy Ion Collisions, 2003, Montreal, Canada. Folder of the International Meeting Topics in Heavy Ion Collisions	CALDAS, H. C. G		
